username,rating,text,date,company,city
"{'name': 'Vinay Yadav', 'link': 'https://www.google.com/maps/contrib/108411458344158362681?hl=en-US', 'contributor_id': '108411458344158362681', 'thumbnail': 'https://lh3.googleusercontent.com/a-/ALV-UjUWW2wfShFJS3_R3e27pvs9DyuWz1eYoBnN-mQ-O_lvHvawoB2a=s120-c-rp-mo-ba5-br100', 'local_guide': True, 'reviews': 165, 'photos': 1204}",4,Nice ambiance of the office.,5 years ago,TCS,Delhi
"{'name': 'JyoJo S', 'link': 'https://www.google.com/maps/contrib/113271016455740755996?hl=en-US', 'contributor_id': '113271016455740755996', 'thumbnail': 'https://lh3.googleusercontent.com/a/ACg8ocIoGoQsqjPSzrr_E7jVBuWi5J-6ctW1LfK2eZsWPEYPa1HmoASl=s120-c-rp-mo-ba5-br100', 'local_guide': True, 'reviews': 282, 'photos': 1020}",1,"Most of the products are cheap and I am clear will never buy their products, their cancellation policy is a farce. Do not buy their products",4 years ago,TCS,Delhi
"{'name': 'Rohit Mehra', 'link': 'https://www.google.com/maps/contrib/103593905531917134352?hl=en-US', 'contributor_id': '103593905531917134352', 'thumbnail': 'https://lh3.googleusercontent.com/a-/ALV-UjVbc6tuS_7RRBBMeACMjI05mZW2nqtH8Cvkmchg_plvDYQA8c_Nkw=s120-c-rp-mo-br100', 'local_guide': True, 'reviews': 15, 'photos': 0}",4,"Good products but very bad sarvice

Thanku",2 years ago,TCS,Delhi
"{'name': 'ankit j', 'link': 'https://www.google.com/maps/contrib/113252543573289412710?hl=en-US', 'contributor_id': '113252543573289412710', 'thumbnail': 'https://lh3.googleusercontent.com/a/ACg8ocKzfTNyPIzpqJf6GZPID2wAHi9TYRz_OOPyOiKIsz5UR8tRnw=s120-c-rp-mo-ba3-br100', 'local_guide': True, 'reviews': 44, 'photos': 0}",2,Not a good produxt,5 years ago,TCS,Delhi
"{'name': 'Kapil Dev', 'link': 'https://www.google.com/maps/contrib/114685949792452844018?hl=en-US', 'contributor_id': '114685949792452844018', 'thumbnail': 'https://lh3.googleusercontent.com/a-/ALV-UjXf-CMsBfzzFlqsE71KmObfR_01WAV2vGRMpNYWd8HKNs_nHv_t=s120-c-rp-mo-ba5-br100', 'local_guide': True, 'reviews': 261, 'photos': 224}",1,Office is closed last 2 years.,3 years ago,TCS,Delhi
"{'name': 'Sourabh Chawdhary', 'link': 'https://www.google.com/maps/contrib/107338477345606427760?hl=en-US', 'contributor_id': '107338477345606427760', 'thumbnail': 'https://lh3.googleusercontent.com/a-/ALV-UjUGr8c_Ge9bCaTlmIrkBmc4Jc5Ns91P-iCYcw3yq2YLghddjDkMXg=s120-c-rp-mo-ba3-br100', 'local_guide': True, 'reviews': 29, 'photos': 14}",5,Best Place To Work,7 years ago,TCS,Delhi
"{'name': 'Deepak kumar', 'link': 'https://www.google.com/maps/contrib/114381124497643561933?hl=en-US', 'contributor_id': '114381124497643561933', 'thumbnail': 'https://lh3.googleusercontent.com/a-/ALV-UjWEOSKADYmB5CoTrh1kse6X-5o0sJOdjAEXx6347CyS8TV4qf89=s120-c-rp-mo-ba4-br100', 'local_guide': True, 'reviews': 123, 'photos': 28}",4,Nice company to work with,6 years ago,TCS,Delhi
"{'name': 'raj sharma', 'link': 'https://www.google.com/maps/contrib/107493223599691680237?hl=en-US', 'contributor_id': '107493223599691680237', 'thumbnail': 'https://lh3.googleusercontent.com/a-/ALV-UjWOU2PyOsYs5P8tqbFX0_CwgVe5PfziTzFAMJkSevcxdKzqaQpP=s120-c-rp-mo-ba3-br100', 'local_guide': True, 'reviews': 17, 'photos': 0}",4,Did not expirienc,3 years ago,TCS,Delhi
"{'name': 'Vishnu Usha', 'link': 'https://www.google.com/maps/contrib/103732511027120165483?hl=en-US', 'contributor_id': '103732511027120165483', 'thumbnail': 'https://lh3.googleusercontent.com/a-/ALV-UjWeKdypRf_UrgyiQeRgAin8cz_HMYBSozTHRda0toQckTMwSjI4=s120-c-rp-mo-ba4-br100', 'local_guide': True, 'reviews': 91, 'photos': 126}",5,Nice ambience with good office space. It's situated on the 7th floor of Tower B and nearest metro is Phase 3.,2 years ago,Infosys,Delhi
"{'name': 'Prince Mishra', 'link': 'https://www.google.com/maps/contrib/116018830175316177279?hl=en-US', 'contributor_id': '116018830175316177279', 'thumbnail': 'https://lh3.googleusercontent.com/a/ACg8ocKdDwLjt176iCyB-L1uznDLr2sE5bAwZFvI96SWrVBA8VnqLg=s120-c-rp-mo-ba3-br100', 'local_guide': True, 'reviews': 16, 'photos': 7}",4,Nice place to visit. Hope to get internship there in some years. One of India's nameful company. If you visit some places like this You will see modern India,6 years ago,Infosys,Delhi
"{'name': 'Harpreet Singh', 'link': 'https://www.google.com/maps/contrib/101358959789895884509?hl=en-US', 'contributor_id': '101358959789895884509', 'thumbnail': 'https://lh3.googleusercontent.com/a-/ALV-UjUuaUMWu8-dq-TCcaRvBRRNCdgPPa6wWtepyiy4hYRr11DpFIc=s120-c-rp-mo-ba6-br100', 'local_guide': True, 'reviews': 445, 'photos': 4658}",5,"This building is in cyber city....near building number 14....there are two rapid metro station near this building...dlf phase 3 and mouslari station...lots of companies are there like.... Infosys, personiv, United lex, concetrix etc...so would like to recommend this prime location of Gurugram.... thanks..",5 years ago,Infosys,Delhi
"{'name': 'R A', 'link': 'https://www.google.com/maps/contrib/102221959162010073894?hl=en-US', 'contributor_id': '102221959162010073894', 'thumbnail': 'https://lh3.googleusercontent.com/a/ACg8ocKxJfOscuDae8uYOIKj4ID06kfWPkignKZRDX6BzOHDUIYP848I=s120-c-rp-mo-br100', 'reviews': 17, 'photos': 0}",1,"SLAVERY!! Typical Boomer, Vindictive Low lives with forged credentials running the show. Very definition of Biblical Hell!!
Employee treatment is absymal.Dont bother with them. They even tried to scam Google lol!!!",a year ago,Infosys,Delhi
"{'name': 'Abhishek Mathur', 'link': 'https://www.google.com/maps/contrib/105154721513794360407?hl=en-US', 'contributor_id': '105154721513794360407', 'thumbnail': 'https://lh3.googleusercontent.com/a-/ALV-UjWHNDEUWvpwYHznMLnTb-lwqUsHdDYizjgqqUYGKUaWQkT-bcDO=s120-c-rp-mo-br100', 'local_guide': True, 'reviews': 8, 'photos': 0}",5,I’ve been working here for the last 8 years and this is an awesome company for those who want to make a career. Ample opportunities and variety of roles combined with the focus of growing employees from within makes it a really employee oriented organization!,6 years ago,Infosys,Delhi
"{'name': 'Nidhi Gupta', 'link': 'https://www.google.com/maps/contrib/112265015666328501236?hl=en-US', 'contributor_id': '112265015666328501236', 'thumbnail': 'https://lh3.googleusercontent.com/a-/ALV-UjUoAP0ex-KKObYUb-759ICwqQBs5IfMRqgQvuRc8YMkeqKUcfG8=s120-c-rp-mo-ba4-br100', 'local_guide': True, 'reviews': 85, 'photos': 66}",5,Its a good place to work. Visited twice by car. Located on 7th floor has a small food outlet and nice staff.,2 years ago,Infosys,Delhi
"{'name': 'Rakesh Kumar', 'link': 'https://www.google.com/maps/contrib/114662103885038034962?hl=en-US', 'contributor_id': '114662103885038034962', 'thumbnail': 'https://lh3.googleusercontent.com/a-/ALV-UjWnE3y4HVCGouB8kIfoROhZgloSyC6aLWhFhQNYD4wwTHAbpR0alA=s120-c-rp-mo-ba4-br100', 'local_guide': True, 'reviews': 190, 'photos': 150}",5,always remember to send email before meeting. without mail they will not allow to go inside. you have to stand at reception they will not even offer you seat. this don't like. without appointment and prior mail you are not welcome here.,7 years ago,Infosys,Delhi
"{'name': 'Arpit Chaurasia', 'link': 'https://www.google.com/maps/contrib/103165801112131837760?hl=en-US', 'contributor_id': '103165801112131837760', 'thumbnail': 'https://lh3.googleusercontent.com/a-/ALV-UjWlmgIm6e8rgUcQWOeVEEk6xvPPOdb6jJMouRN1POoZETCUJsbZug=s120-c-rp-mo-br100', 'local_guide': True, 'reviews': 7, 'photos': 0}",3,"If you want to go any laptop submitted things then you go in tikri sector 48 location.
Other vise you ask your manager because in DLF office is available only bpm",2 years ago,Infosys,Delhi
"{'name': 'Rohit Sotra', 'link': 'https://www.google.com/maps/contrib/115735883083612421054?hl=en-US', 'contributor_id': '115735883083612421054', 'thumbnail': 'https://lh3.googleusercontent.com/a-/ALV-UjXicnqusP9iQ9HW8l24Al1eK8yPf2JJbF3402WWrhzwZgRNbpgaxw=s120-c-rp-mo-ba3-br100', 'local_guide': True, 'reviews': 34, 'photos': 77}",4,Good company to work but this office is in isolated place with no metro connectivity.,5 months ago,Wipro,Delhi
"{'name': 'Aakanksha Saini', 'link': 'https://www.google.com/maps/contrib/100373897037437603971?hl=en-US', 'contributor_id': '100373897037437603971', 'thumbnail': 'https://lh3.googleusercontent.com/a-/ALV-UjXGS2FLm14L1H_7sSfODGCnJp4ttM3b4Z2vyoBU_XoPz_dETzjG=s120-c-rp-mo-br100', 'reviews': 2, 'photos': 0}",5,Good company and good behaviour all company member 👍,a month ago,Wipro,Delhi
"{'name': 'Resham Das', 'link': 'https://www.google.com/maps/contrib/105356200382830891001?hl=en-US', 'contributor_id': '105356200382830891001', 'thumbnail': 'https://lh3.googleusercontent.com/a-/ALV-UjVd4iFb9YTiYgrrWkCYQJ8FxC88lfwrNu1B5kfg8Yvqd_Y6j3e3Bg=s120-c-rp-mo-ba8-br100', 'local_guide': True, 'reviews': 920, 'photos': 11512}",3,"The Wipro GDC, or the Gurgaon Development Center is a 7-storeyed building, but apparently smaller in term of land area it covers, located at Udyog Vihar, near the Gurgaon-Delhi border close to Delhi-Gurgaon Expressway to the right, and Kapashera Border to the left. The office is situated inside a puzzle of alleys at Udyog Vihar. This office has its cafeteria at the top floor.",3 years ago,Wipro,Delhi
"{'name': 'Kai For Everyone', 'link': 'https://www.google.com/maps/contrib/111908009926978625222?hl=en-US', 'contributor_id': '111908009926978625222', 'thumbnail': 'https://lh3.googleusercontent.com/a-/ALV-UjVxexQsmfGuhDj7Ebs2FxFTj4lpno_cYipO-kqXCV-ienII8F-3=s120-c-rp-mo-ba2-br100', 'local_guide': True, 'reviews': 13, 'photos': 1}",5,"It was really great working here, the office is amazing, facilities are great, but the coffee machines need a repair. Cafetaria is amazing, staff is good, gym trainer is good, managers are great. It was fun working here.",a year ago,Wipro,Delhi
"{'name': 'Lucky Kumar Sultana', 'link': 'https://www.google.com/maps/contrib/116557035995275301173?hl=en-US', 'contributor_id': '116557035995275301173', 'thumbnail': 'https://lh3.googleusercontent.com/a-/ALV-UjVINUL827D_cY9MEfbi5jn7eFr5wzef-zf_raYInE4UVNu0WAZgig=s120-c-rp-mo-ba3-br100', 'local_guide': True, 'reviews': 43, 'photos': 38}",5,"The office is very good and managed very well.

2 Floors underground parking
3 Elevators
Gym
2 Canteens
Total 6 Floors

ID card is needed for entry.
A gate pass is needed for parking.",a year ago,Wipro,Delhi
"{'name': 'Yamini Malik', 'link': 'https://www.google.com/maps/contrib/108076620152032232553?hl=en-US', 'contributor_id': '108076620152032232553', 'thumbnail': 'https://lh3.googleusercontent.com/a-/ALV-UjVAqMxKJ_V39WisZqfgXku0CNbCfhw1FQzXGalbGwtKGP-j_PN2=s120-c-rp-mo-ba3-br100', 'local_guide': True, 'reviews': 21, 'photos': 5}",1,"Fraud company selling faulty products.
No one picks calls or reverts on email. Will be filing a case in court against them.",9 months ago,Wipro,Delhi
"{'name': 'Giju Nair', 'link': 'https://www.google.com/maps/contrib/106266631203050247165?hl=en-US', 'contributor_id': '106266631203050247165', 'thumbnail': 'https://lh3.googleusercontent.com/a-/ALV-UjWmq3PL3zSqWKrtbFNaqpMxUS7XxvOogPJRT_M5Bsq1t7hLRavu=s120-c-rp-mo-ba6-br100', 'local_guide': True, 'reviews': 432, 'photos': 1393}",4,"Wipro's development centre in Gurgaon. Recently removated and really good facilities, such as underground parking, smart interaction zones, large meeting rooms, innovation labs and modern workplace culture. Many stellar projects have been delivered from this location. Its situated at Udyog Vihar and might be a tad bit difficult to find for the first time. However following Google map directions is the recommended approach.",a year ago,Wipro,Delhi
"{'name': 'SUMIT AHLAWAT', 'link': 'https://www.google.com/maps/contrib/117048764608253362559?hl=en-US', 'contributor_id': '117048764608253362559', 'thumbnail': 'https://lh3.googleusercontent.com/a/ACg8ocIESCS12cf5lRtZFdy0NPHBIwjGMjHztG28t12aw6OR7mbTQ80=s120-c-rp-mo-ba5-br100', 'local_guide': True, 'reviews': 230, 'photos': 48}",2,Interview process is okay. Waited for more than 2 hours of scheduled time. Then the HR called and provided one room to me. The other panel called me over my phone and taken technical interview. The process is okay but not given any feedback. Consultant people reverted that they will share the feedback in next 2 days but no response came from their end.,5 years ago,Wipro,Delhi
"{'name': 'Badal Bittu', 'link': 'https://www.google.com/maps/contrib/117162669624846046034?hl=en-US', 'contributor_id': '117162669624846046034', 'thumbnail': 'https://lh3.googleusercontent.com/a-/ALV-UjWMA-maHCxwlh7Z8S8tm9nGm-mpZ5OF9ypum7wydQFGItf4ozsD=s120-c-rp-mo-br100', 'local_guide': True, 'reviews': 2, 'photos': 0}",5,hi sir i am Niranjan kumar i want job in hcl,7 years ago,HCL,Delhi
"{'name': 'Ankit Anand', 'link': 'https://www.google.com/maps/contrib/112291592716428480352?hl=en-US', 'contributor_id': '112291592716428480352', 'thumbnail': 'https://lh3.googleusercontent.com/a/ACg8ocLmmYSHcWpJZ3X_qGdl-hFDcO4ylScpK_yTa1jp3zlBAOnaSw=s120-c-rp-mo-ba2-br100', 'local_guide': True, 'reviews': 41, 'photos': 0}",5,Awesome work culture,6 years ago,HCL,Delhi
"{'name': 'Narayan Karn', 'link': 'https://www.google.com/maps/contrib/112254036621853012842?hl=en-US', 'contributor_id': '112254036621853012842', 'thumbnail': 'https://lh3.googleusercontent.com/a-/ALV-UjW382UoBs3yiF4frbqhHDDkSeBvovLlWv3rCO2Z5F_uplVE_u4v=s120-c-rp-mo-br100', 'local_guide': True, 'reviews': 8, 'photos': 0}",5,I want to job in HCl ..,7 years ago,HCL,Delhi
"{'name': 'karan bhatia', 'link': 'https://www.google.com/maps/contrib/108690143823541220088?hl=en-US', 'contributor_id': '108690143823541220088', 'thumbnail': 'https://lh3.googleusercontent.com/a-/ALV-UjXXUJuOwFzk5TrhacYECY-ZjEDUPr3CQxEfWWJgBR70Itk9_7w=s120-c-rp-mo-ba7-br100', 'local_guide': True, 'reviews': 1004, 'photos': 203}",4,Excellent 👍👍👍👌,a year ago,HCL,Delhi
"{'name': 'Satwant Kaur', 'link': 'https://www.google.com/maps/contrib/116816697178236345837?hl=en-US', 'contributor_id': '116816697178236345837', 'thumbnail': 'https://lh3.googleusercontent.com/a/ACg8ocIt4cLHviI5bpKVQ-vCEzrMZKJY0pB2MF7Q6l4KfUFJxkYOXg=s120-c-rp-mo-br100', 'local_guide': True, 'reviews': 2, 'photos': 0}",3,,10 months ago,HCL,Delhi
"{'name': 'Ahuja Group', 'link': 'https://www.google.com/maps/contrib/102397131895880435297?hl=en-US', 'contributor_id': '102397131895880435297', 'thumbnail': 'https://lh3.googleusercontent.com/a/ACg8ocKeN7999lX-GvLmqn4iLAsmKEe0UHdTmvL7ygBmLs364yR_XQ=s120-c-rp-mo-br100', 'reviews': 3, 'photos': 0}",5,,2 years ago,HCL,Delhi
"{'name': 'bibhay meditation channel', 'link': 'https://www.google.com/maps/contrib/110949219109322804262?hl=en-US', 'contributor_id': '110949219109322804262', 'thumbnail': 'https://lh3.googleusercontent.com/a-/ALV-UjXFqVESeupD-k6kwtVdG9IUxv5f1poL0Tgd0BXrYL0fKK-BxNg=s120-c-rp-mo-br100', 'reviews': 0, 'photos': 0}",5,,2 years ago,HCL,Delhi
"{'name': 'Deepak maurya', 'link': 'https://www.google.com/maps/contrib/115968736161741481203?hl=en-US', 'contributor_id': '115968736161741481203', 'thumbnail': 'https://lh3.googleusercontent.com/a-/ALV-UjVqawJSdBPnd2U5_ewrlcIp4tyAnFS9A2HYh5UzOx2oDQTxKt1m6A=s120-c-rp-mo-br100', 'reviews': 0, 'photos': 1}",5,,3 years ago,HCL,Delhi
"{'name': 'BABLU RAJ', 'link': 'https://www.google.com/maps/contrib/104191462617629123746?hl=en-US', 'contributor_id': '104191462617629123746', 'thumbnail': 'https://lh3.googleusercontent.com/a-/ALV-UjWVT85XJ-xDFbxnNFO75wQ49aUQu7MqtgDSv8hTRUTKVk0r5_Ek=s120-c-rp-mo-br100', 'local_guide': True, 'reviews': 2, 'photos': 5}",5,Recently I have joined the company. As I have analyse  every thing is fine as well as campus and people also.,3 weeks ago,Tech Mahindra,Delhi
"{'name': 'Sandeep Chauhan', 'link': 'https://www.google.com/maps/contrib/115438828633075986510?hl=en-US', 'contributor_id': '115438828633075986510', 'thumbnail': 'https://lh3.googleusercontent.com/a/ACg8ocLuf2HuvjiGgCxxJ55pWGVaE6K7jWZRadzMMKfbyL-aaRau2A=s120-c-rp-mo-br100', 'reviews': 1, 'photos': 0}",1,"They should be given zero…even zero is valuable they should be given -1000… guys dont ever join tech mahindra. Worst nightmare and anand mahindra doesnt even care beside tweeting in twitter….I am writing this to let you know that I am filing an official complaint against the aasurant management that they are the worst management i have ever seen and they dont have courage to talk to me for anything. Ask anyone if they have talked to me before this decision. Now what they will do is take revenge and stop my relieving letter. If they have courage to talk to an employee i will come to office and see if they can talk how they harrasing the people there in the assurant. They have not given me exception on my behavior. Ask feedback about the management there from anyone working there. These guys should be terminated too. Mayank, gaurav, yatin , priya, amarjeet, pankaj no one came forward to talk to me. They all should be terminated. The manager should tell me about rhe smooth exit but they dont have courage to talk. Only thihg they say is talk to HR.  I will quote everything in social media too so that they get exposed. I cant use abusive words here. I will come to office and if they have courage come and talk to me and see how much empathy u have. They  dont know nothing. So much experience but dont know anything about work and ethics. I want compensation for this month too or I will file a court case agaisnt the management. I have all the proofs. All phone call records and mails and everything. I will drag each one of you. All i was searching was empathy and they have nothing. When I asked for leaves due to liver issue they didnt give it instead wasted my time and was that a big thing i was asking i have given the medical and all and they were like aliens that they dont know how to handle it. Even after their medical team approved it yatin said that i cant give leaves. Who is he to decide? All i was asking for day shift for 2 weeks only and their legs shaken. And they talk about my behavior. I am writing this each and every person should read it whole otherwise u will miss the purpose. After that when i start joining all i was asking for some refresher and wht they do is given 1 week training and says there is a certification. The certification which they had taken earlier was a joke.. every person cheated and passed. So in my case they take certification like I am giving upsc exam. I cleared first one technically because pankaj didnt checked properly the exam. And when I raised it, and find some answers are correct he said ok i am allowing u to get into production. Then suddenly after 2 days mayank says give test again. There is no cooperation between them. In second and thirdd test amarjeet make sure to make me fail as she made the question which even the people in production dont get the cases. She is also the culprit. I didnt clear the test so they will not talk to me after that. Wht kind of people they are? Yatin and priya dont know anything. I dont know why they are team leaders. I thought priya is good but she says one thing to you and then says some other thing. Earlier she says that raise complaint against HR charajit and next day she said charajit is good. They could have make my exit smooth but what they are doing is nothing. They are pure evil. I didnt get salary for my previous month just because the team lead yatin dont know wht to talk to HR and they both blame each other for NCNS. I am adding all the conversations here. Check everything. I will not leave u all like this. I will fight the legal aid against u all and make sure you get exposed to every platform. Mayank shrivastava, Gaurav sachdeva, yatin chaabra, priya, amarjeet, pankaj and alll are culprits. I will file a complaint against you all according to labour laws. You alll are pure evils.",5 months ago,Tech Mahindra,Delhi
"{'name': 'Mr. Parihar', 'link': 'https://www.google.com/maps/contrib/109323676706498012379?hl=en-US', 'contributor_id': '109323676706498012379', 'thumbnail': 'https://lh3.googleusercontent.com/a/ACg8ocIemZmXDzC4tIkbgLZRFvnb-QEh8LnuZ3ecAcZWoYCZYHZPTE45=s120-c-rp-mo-ba4-br100', 'local_guide': True, 'reviews': 109, 'photos': 121}",2,It's a nice company but HR management of this company have no sense of humour. They called candidate for jobs but they people even doesn't know that who called for the interview process and to whom and why. 🤣🤣,5 years ago,Tech Mahindra,Delhi
"{'name': 'uruba khan', 'link': 'https://www.google.com/maps/contrib/110784920828584605295?hl=en-US', 'contributor_id': '110784920828584605295', 'thumbnail': 'https://lh3.googleusercontent.com/a-/ALV-UjXdHKH40Wn09SAa9KEoTR95JYPgxG04A3LkhTdD0cTG6nw2Xd7o=s120-c-rp-mo-br100', 'reviews': 5, 'photos': 0}",1,My tech mahindra experience is worst because of one hr her name is gargi I had given interview day before yesterday and same day I got selected I got to know about the results around 4 and before that I was indulge in interview after my selection they asked me to join immediately I supported them even though she is aware I have to visit to the doctor which I missed visiting I was indulge with every procedure till 9:30 then next day again they have started like apk pas 5 min hai 10 min hai like they are playing KBC sort of thing then they informed me induction will be online so i supposed to come to the office which monday but in the after she informed that you have to come physically and there was no bus from my home town after 3 due to some andolan going on in noida khair i joined onboarding I marked my attandce my mother fell sick she is bp patient I need to rush to the hospital I forget my phone at my home once I come back gargi id not responding also without listing my problem she remove me from the group by saying apk jaise candidate nh chahiye ary apka khd ka koi procedure nh hai ap khd kam apne dil k hisab sai krrhe ho or ap hoto kon ho mujh yai bolne wale k mai join nh karskati ku ap nh chahti mai bewakoof hu jo mene interview dia also jab ap interview lete ho koi selection hota hai candidate ko time to dena chahiye nh same day interview liya usi din Sare rounds liye usk bad usi din bola k meeting join kro yai documents upload kro ary candidate ko pata thodi hai k ap k pas time nh hai infact candidate support krrha hai usk bad agar kuch hota hai bina sune ap rude behave krte ho also jab mai phn nh utha paye I saw msg from her side wo b proper dhamki bhara k ap response nh kroge to mai apko nikal dungi and all and that's what she did I wasted my time given interview or jaha bina reason sune aise behave hota hai wha na he jal specially Gargi or vishal apki onboarding krwa rhe hai to also o felt I am muslim that's why she did this to me it's easy these days I am very disappointed I have offer letter and everything but because of her I can't join,11 months ago,Tech Mahindra,Delhi
"{'name': 'Shivam Anand', 'link': 'https://www.google.com/maps/contrib/109506516651608598368?hl=en-US', 'contributor_id': '109506516651608598368', 'thumbnail': 'https://lh3.googleusercontent.com/a-/ALV-UjXAV4L0lV0HOS8Mvjg82tXOaXuSlBS_KZGYh-Y5I7l8YnSTRw91=s120-c-rp-mo-ba3-br100', 'local_guide': True, 'reviews': 32, 'photos': 4}",5,"The building was so good.Everything is perfect.Also have fountain area where you will get peace.Staff are also good..But if I talk about the cafeteria I will give 3start out of 5.They need to explore it more..
Overall the building is perfect.",a year ago,Tech Mahindra,Delhi
"{'name': 'Abhijeet Singh', 'link': 'https://www.google.com/maps/contrib/103294102958723057075?hl=en-US', 'contributor_id': '103294102958723057075', 'thumbnail': 'https://lh3.googleusercontent.com/a/ACg8ocLeky9oixIqnA2vtCYl2-6ezl3X9hHdF-Dv-Xd7mF3CDXoUdQ=s120-c-rp-mo-ba2-br100', 'local_guide': True, 'reviews': 3, 'photos': 1}",1,"I recently had a rather unsatisfactory experience at Tech Mahindra's Noida office. The management seemed disorganized, and the manager's leadership skills left much to be desired. Communication within the team was lacking, leading to confusion and inefficiencies in project execution. Overall, a disappointing workplace atmosphere that hindered productivity",a year ago,Tech Mahindra,Delhi
"{'name': 'Sumitra Nandan Upadhyay', 'link': 'https://www.google.com/maps/contrib/101070465842119921329?hl=en-US', 'contributor_id': '101070465842119921329', 'thumbnail': 'https://lh3.googleusercontent.com/a-/ALV-UjVuOk6N0ueZVkrbPlUxrsQCjOQMpB5g1wjPg8Nu4riXRyBccBHM=s120-c-rp-mo-ba2-br100', 'local_guide': True, 'reviews': 21, 'photos': 0}",5,Nice place to shape your carrier,a month ago,Tech Mahindra,Delhi
"{'name': 'pawan gound', 'link': 'https://www.google.com/maps/contrib/110812789656563324974?hl=en-US', 'contributor_id': '110812789656563324974', 'thumbnail': 'https://lh3.googleusercontent.com/a-/ALV-UjVg9UYwS09ZcwA_aR_kMBxG_hFl-xLlHDgadn2WDxrmtufM58M=s120-c-rp-mo-br100', 'local_guide': True, 'reviews': 5, 'photos': 4}",5,Nice company my dreams 💖,3 weeks ago,Tech Mahindra,Delhi
"{'name': 'mehraj rehman', 'link': 'https://www.google.com/maps/contrib/109796139426989990661?hl=en-US', 'contributor_id': '109796139426989990661', 'thumbnail': 'https://lh3.googleusercontent.com/a/ACg8ocJ9n62uUQZnwmR9tUr-ICX3gfr39lemvCa7H8Lwt6lR_lvJdQ=s120-c-rp-mo-br100', 'reviews': 1, 'photos': 0}",1,"Despite numerous complaints to HR, the company remains plagued by micromanagement and office politics. If you still believe this company is a good choice, feel free to join.",6 months ago,Capgemini,Delhi
"{'name': 'Ranjeet Pandey', 'link': 'https://www.google.com/maps/contrib/106117125853344664084?hl=en-US', 'contributor_id': '106117125853344664084', 'thumbnail': 'https://lh3.googleusercontent.com/a-/ALV-UjUdw_Xssmzbo4_l2dT6SYZGdbzklY838XHJHWvFGeogXJ5A1PYjoQ=s120-c-rp-mo-ba4-br100', 'local_guide': True, 'reviews': 57, 'photos': 263}",5,It's a very nice place to work. Very nice infrastructure,2 years ago,Capgemini,Delhi
