username,rating,text,date,company,city
"{'name': 'Nithin D souza', 'link': 'https://www.google.com/maps/contrib/111036403645342238403?hl=en-US', 'contributor_id': '111036403645342238403', 'thumbnail': 'https://lh3.googleusercontent.com/a-/ALV-UjXFpwE8SWKBo-QMVT_vej5Vm7X_k3JYYGGVyF5WrN9mjfk0OzqDdQ=s120-c-rp-mo-ba5-br100', 'local_guide': True, 'reviews': 95, 'photos': 227}",5,"Cognizant Technology Solutions in Bengaluru, located inside Manyata Tech Park, is a great place to work. The campus is well-maintained and equipped with all necessary amenities like cafeterias, gym, medical center, and recreational areas. The work culture is collaborative and supportive, and the management is approachable and transparent. The company invests in employee training and development, providing ample opportunities to enhance skills and knowledge. The salary and benefits packages are competitive, and the HR team is responsive to employee concerns. Overall, a great place for those seeking a career in the IT industry.🤍🇮🇳🙏",a year ago,Cognizant,Bengaluru
"{'name': 'Rakesh polaki', 'link': 'https://www.google.com/maps/contrib/113263949755195335104?hl=en-US', 'contributor_id': '113263949755195335104', 'thumbnail': 'https://lh3.googleusercontent.com/a/ACg8ocIbrBreoHZH7aanH76SdIbSJUBSIUcK-6iVRmVTKhAzuSfxGaeW=s120-c-rp-mo-ba5-br100', 'local_guide': True, 'reviews': 140, 'photos': 511}",5,"Great and clean facility.
Very big block.
Above the ground parking.
Inside LEED certified Embassy Manyata tech park.
Cons:
When there is rain, water gets logged on its way and it is difficult to reach the block from the entrance by walk.",a month ago,IBM,Bengaluru
"{'name': 'Raja Hussain', 'link': 'https://www.google.com/maps/contrib/109529192697909998416?hl=en-US', 'contributor_id': '109529192697909998416', 'thumbnail': 'https://lh3.googleusercontent.com/a-/ALV-UjVT5IHSwR9ueaY3jCRT1fjHp-nwZfsnFfTIAx2j3FsUl1NCysMORg=s120-c-rp-mo-ba2-br100', 'local_guide': True, 'reviews': 16, 'photos': 1}",5,I worked in this block for close to 9 years. It has 7 floors. Good place to be in. On the 3rd floor we have a pantry and it has a good walkway around this building and has a decent sitout to chill out during your break hours.,a month ago,IBM,Bengaluru
"{'name': 'Neethu Gowda', 'link': 'https://www.google.com/maps/contrib/110843385828477325198?hl=en-US', 'contributor_id': '110843385828477325198', 'thumbnail': 'https://lh3.googleusercontent.com/a-/ALV-UjWhXNduuq-t9nBmjErqm-EzQ8-hsI8V2y5r-MX4uPQLfMIrtKwo=s120-c-rp-mo-ba4-br100', 'local_guide': True, 'reviews': 41, 'photos': 137}",5,"You can experience that's so sweet moment, when people there in speaks kannada! Thanks to the management for placing such humble admins and receptionist they are so interactive and also ensuring to resolve queries regarding access.

I - I
B - Bengaluru
M- Mandi",a year ago,IBM,Bengaluru
"{'name': 'Pranam Bhat', 'link': 'https://www.google.com/maps/contrib/112758860571798557457?hl=en-US', 'contributor_id': '112758860571798557457', 'thumbnail': 'https://lh3.googleusercontent.com/a-/ALV-UjXQSkgWq-6s84VqcU_ocNcaNHRXOsNIlCdhpkzIOZwws072WYcIQA=s120-c-rp-mo-ba7-br100', 'local_guide': True, 'reviews': 463, 'photos': 5614}",4,"Had been there for an interview.

They neglect everyone. They don't bother you. Huge space. Crowded on weekends as well.",4 years ago,IBM,Bengaluru
"{'name': 'Subbarao Rallapalli', 'link': 'https://www.google.com/maps/contrib/115508953647872634894?hl=en-US', 'contributor_id': '115508953647872634894', 'thumbnail': 'https://lh3.googleusercontent.com/a-/ALV-UjUM85RtrKOuGAEFCP42RcgxhDZM70z-QkwlXmRxOGXQWozsFBZp=s120-c-rp-mo-ba5-br100', 'local_guide': True, 'reviews': 404, 'photos': 170}",4,G2 is the block where IBM has occupied all the floors in Manyata which is maintained well with spacious and reach to other buildings.,4 months ago,IBM,Bengaluru
"{'name': 'Sandip Nandi', 'link': 'https://www.google.com/maps/contrib/116623568588393203007?hl=en-US', 'contributor_id': '116623568588393203007', 'thumbnail': 'https://lh3.googleusercontent.com/a-/ALV-UjW0NkMNB-SEcMmNhdZw3yJbpGblR91sKN0RtbG3LbBgPQW_tDHP=s120-c-rp-mo-ba3-br100', 'local_guide': True, 'reviews': 18, 'photos': 33}",5,Awesome place to work. Enjoy the place. Have fun.,a year ago,IBM,Bengaluru
"{'name': 'Minam Rasool', 'link': 'https://www.google.com/maps/contrib/112121064858742452969?hl=en-US', 'contributor_id': '112121064858742452969', 'thumbnail': 'https://lh3.googleusercontent.com/a-/ALV-UjV3Jyz1DykCP_L2-fU02ynsYqBeNUIwJGugDkg921Sei04Fpf5W=s120-c-rp-mo-ba5-br100', 'local_guide': True, 'reviews': 83, 'photos': 210}",1,"If anyone is going for a job interview in IBM;  (if you get selected and they assure you you'll get an offer letter within some days and then after some days they will give you no reply and when you go to enquire they will say you are on hold, and all that kind of non-sense, they lie to you even if you get selected,
I have two names for G2 Block who is involved in this politics, who play with students lives ( Nikkita Fernandez and Rachana panwar).",2 years ago,IBM,Bengaluru
"{'name': 'Dona Abraham', 'link': 'https://www.google.com/maps/contrib/101520918258187881829?hl=en-US', 'contributor_id': '101520918258187881829', 'thumbnail': 'https://lh3.googleusercontent.com/a-/ALV-UjUVRnnEp3Gh1v1_RAYVDAAUIy6hcrDAmRJW7cQiL8hyv8v0mgUIhg=s120-c-rp-mo-ba4-br100', 'local_guide': True, 'reviews': 89, 'photos': 175}",5,Spacious and cool space to spend time. Seating arrangements are nice.,2 years ago,IBM,Bengaluru
