username,rating,text,date,ct,company
"{'name': 'Mohd Danish', 'link': 'https://www.google.com/maps/contrib/115861731011360468925?hl=en-US', 'contributor_id': '115861731011360468925', 'thumbnail': 'https://lh3.googleusercontent.com/a/ACg8ocK4OCS7wZ8UgBnasT1g37UgTLcNE7N0OOXHA9IjsHjIcuGEZAU=s120-c-rp-mo-ba3-br100', 'local_guide': True, 'reviews': 23, 'photos': 4}",5.0,Beautiful infrastructure with the elegance of nature inside the eon IT park. The whole park is well planned designed to function for modern days.,a year ago,pune,Tietoevry India Pvt Ltd.
"{'name': 'Harshad K', 'link': 'https://www.google.com/maps/contrib/117332201753027393908?hl=en-US', 'contributor_id': '117332201753027393908', 'thumbnail': 'https://lh3.googleusercontent.com/a-/ALV-UjUM1BjH6hnx771Y5UlRHw2fRVWWkxx1bpC73ubL42NpFDmPUUkdXg=s120-c-rp-mo-ba5-br100', 'local_guide': True, 'reviews': 322, 'photos': 365}",4.0,"Great Eon IT Park in Kharadi  ....world class facilities..... Multinational companies are growing rapidly as days are going....just amazing and naturally developed.... Great organization like ZS Associates, Mphasis, Tieto, Veritas, Vodafone, QSG Resources, and many more....also has great food cafeterias in each of the organization...for their respective company employees..",6 years ago,pune,Tietoevry India Pvt Ltd.
"{'name': 'Sachin Singh', 'link': 'https://www.google.com/maps/contrib/114928812771965667216?hl=en-US', 'contributor_id': '114928812771965667216', 'thumbnail': 'https://lh3.googleusercontent.com/a-/ALV-UjU04ilRYSI8qW-oJAhKEuSJJDEf2G8znKiECqQevyJhpvRB4O4p=s120-c-rp-mo-ba5-br100', 'local_guide': True, 'reviews': 145, 'photos': 210}",3.0,"This could be a best MNC one would like to work with. Located in EON Phase I building Cluster D. Gives good appraisal apparently to their employees. People seem to be working
For like last 10-12 years in the same company",5 years ago,pune,Tietoevry India Pvt Ltd.
"{'name': 'bhagyashri kharade', 'link': 'https://www.google.com/maps/contrib/118171369187602337736?hl=en-US', 'contributor_id': '118171369187602337736', 'thumbnail': 'https://lh3.googleusercontent.com/a-/ALV-UjXgJaUKcP4_fwGiUpgdr9qiUTk0cV0o_w_sp6bH10U7hOcjIyTe9g=s120-c-rp-mo-ba4-br100', 'local_guide': True, 'reviews': 43, 'photos': 166}",4.0,"Hello readers. Let me first tell you I don't travel by Uber ola or auto directly. I travel by public transportation which I feel cheap and faster than others.
I visited Tieto on 3 Rd Oct from Mumbai. Boared shivneri or any other ST bus that would drop you to Pune railway station.
Right outside the bus station you will find local city public transportation buses. Get into kharadi Goan bus and from khradi Goan it is 800 meters walk. You can get auto in worst case.
Get down at EON free zone and go to cluster D.",5 years ago,pune,Tietoevry India Pvt Ltd.
"{'name': 'Abhishek Saxena', 'link': 'https://www.google.com/maps/contrib/101528079709053581133?hl=en-US', 'contributor_id': '101528079709053581133', 'thumbnail': 'https://lh3.googleusercontent.com/a-/ALV-UjV6lPJ-A3SsTzYMfWon1xN9YAFt63WiuBPSyR_Eue6dt1I4ApYb=s120-c-rp-mo-br100', 'local_guide': True, 'reviews': 3, 'photos': 0}",1.0,"Worst internal process and ethics of any company I have given interviews so far. I am mentioning my experience and suggestions in the points below.

My experience:
1) I got a call from HR for a vacancy and we discussed everything including skills set, experience and required package.
2) I have given three rounds of interviews i.e. 2 technical, 1 managerial and spent almost 3 hours of mine.
3) Had to follow up all the times for feedback.
4) Cleared both of the technical rounds and the managerial round was good, The hiring manager provided all the details regarding company and project(s) but at the end he asked for package negotiation which was completely disgusting as the package was discussed from the beginning.
5) I had to again ask for feedback but the HR who was handling my candidature resigned in between and didn't respond then after 3-4 days I got contact of another HR, she also didn't share the feedback then again I had to call the very next day.
6) She told me that you did not receive positive feedback in the managerial round and when I asked for the reason, they didn't share anything.

Suggestion:
1) If the company and project is not having that much budget then HR and HM should not shortlist the respective candidates and should not waste their time.
2) Internal communication and process should be improved in terms of hiring.
3) Technical interviewers and managers should not ask for packages and negotiations.

Think before wasting your time with such companies.

Good Luck!!",a year ago,pune,Tietoevry India Pvt Ltd.
"{'name': 'shifa shaikh', 'link': 'https://www.google.com/maps/contrib/103399345977979154528?hl=en-US', 'contributor_id': '103399345977979154528', 'thumbnail': 'https://lh3.googleusercontent.com/a-/ALV-UjWQQmOStRmLFW8ERGv0k1h0n1Bn_vsJd5C4_3hc6MOR0s5qWGXp=s120-c-rp-mo-br100', 'reviews': 3, 'photos': 0}",5.0,"1.The organization is excellent in terms of work life balance.
2.They believe in upgrading their employees with latest certifications and technologies and offer great platform for the same.
3.Management is approachable and takes employees asks or queries in consideration.
4.No micro management at all.
Overall a great company to be associated and work with.",2 years ago,pune,Tietoevry India Pvt Ltd.
"{'name': 'Tushar Kose', 'link': 'https://www.google.com/maps/contrib/112214535585345239974?hl=en-US', 'contributor_id': '112214535585345239974', 'thumbnail': 'https://lh3.googleusercontent.com/a-/ALV-UjVp5LfPU1bngElpAxUiy52xUZeHwTfIIBRgKXi7azCSBWqofN9PGQ=s120-c-rp-mo-ba2-br100', 'local_guide': True, 'reviews': 12, 'photos': 17}",5.0,"Tietoevry is the best company for anyone to looked up on it, They provide excellent work life balance and great value towards there employees.",8 months ago,pune,Tietoevry India Pvt Ltd.
"{'name': 'Vivek Siwach', 'link': 'https://www.google.com/maps/contrib/108961830089258089603?hl=en-US', 'contributor_id': '108961830089258089603', 'thumbnail': 'https://lh3.googleusercontent.com/a-/ALV-UjWl5efm9RBWRWN09MjvZSHIbw7hyGErDo4s15NBWvTUVlyD-FdJ=s120-c-rp-mo-ba5-br100', 'local_guide': True, 'reviews': 119, 'photos': 172}",5.0,"One of the best company to work with.
Good work life balance. Easy learnings through internal trainings. Even if you will go for some certification, they have very simple process.
One of the best salary structure in the market. No variable pay.
Only deductions are income tax and PF.
Staff is too cooperative.",6 years ago,pune,Tietoevry India Pvt Ltd.
"{'name': 'Datta Gadhave', 'link': 'https://www.google.com/maps/contrib/109627768427639575886?hl=en-US', 'contributor_id': '109627768427639575886', 'thumbnail': 'https://lh3.googleusercontent.com/a-/ALV-UjVV_3_-zKuQz2YEERs8PDBnFuLTMfueYLNffDyxHbh7VLh7g8Y=s120-c-rp-mo-br100', 'local_guide': True, 'reviews': 1, 'photos': 2}",5.0,"Easy To use ERP
This ERP is user friendly and easy to understand. Since I am from production background I find that production data can be captured easily machine wise and can be downloaded most of the data in excel format. The best thing about Orbit ERP is, it can be accessed using your mobile. In case of any issue, quick support is provided within 24hrs.",2 years ago,pune,Noetic Labs
"{'name': 'Amit Pol', 'link': 'https://www.google.com/maps/contrib/110980323278612423040?hl=en-US', 'contributor_id': '110980323278612423040', 'thumbnail': 'https://lh3.googleusercontent.com/a/ACg8ocL5eAMBg2sZhkhqZN0TdHbeGC-HlnayG_ARtuG6_PAwg7MG3A=s120-c-rp-mo-br100', 'reviews': 11, 'photos': 0}",5.0,"Best ERP development company, i am totally satisfied with their services if some one looking for ERP development pls contact to Noetic Systems",7 years ago,pune,Noetic Labs
"{'name': 'Narendra Thakur', 'link': 'https://www.google.com/maps/contrib/111722381847868782299?hl=en-US', 'contributor_id': '111722381847868782299', 'thumbnail': 'https://lh3.googleusercontent.com/a-/ALV-UjV1OeKplXenSjTEm1tIKD788bWdwAHyQeVzcoEDjthnf2AxVQQ-Gw=s120-c-rp-mo-ba3-br100', 'local_guide': True, 'reviews': 64, 'photos': 36}",5.0,It is one of the best conpany and all supporting staff and good working environment,5 years ago,pune,Noetic Labs
"{'name': 'Ganesh Bhor', 'link': 'https://www.google.com/maps/contrib/117117530981447912400?hl=en-US', 'contributor_id': '117117530981447912400', 'thumbnail': 'https://lh3.googleusercontent.com/a-/ALV-UjUKBOqk5PkeG6UDNj1tsb-FFKLOOMFZsH9wj_l5k56WoAKcH0JoFw=s120-c-rp-mo-ba3-br100', 'local_guide': True, 'reviews': 34, 'photos': 2}",4.0,Good place for freshers,6 years ago,pune,Noetic Labs
"{'name': 'Yugandhara Pannase', 'link': 'https://www.google.com/maps/contrib/111380157786032151792?hl=en-US', 'contributor_id': '111380157786032151792', 'thumbnail': 'https://lh3.googleusercontent.com/a-/ALV-UjVlw-TgAAPgvHjDti3CUWCB509G0DDLyVAwfxlNC3tfqAVCwBL1=s120-c-rp-mo-ba2-br100', 'local_guide': True, 'reviews': 10, 'photos': 19}",5.0,I want to work here,5 years ago,pune,Noetic Labs
"{'name': 'Vishwajeet Rajeshirke', 'link': 'https://www.google.com/maps/contrib/101366543926823918396?hl=en-US', 'contributor_id': '101366543926823918396', 'thumbnail': 'https://lh3.googleusercontent.com/a-/ALV-UjWwzZBA0pS5JVw7m7C_d8ZBzuLjuqnSamJpLo55P6UU_3jTrwNpsQ=s120-c-rp-mo-ba3-br100', 'local_guide': True, 'reviews': 16, 'photos': 124}",5.0,Good place to work,2 years ago,pune,Noetic Labs
"{'name': 'Vijay Chavan', 'link': 'https://www.google.com/maps/contrib/111536258473611104967?hl=en-US', 'contributor_id': '111536258473611104967', 'thumbnail': 'https://lh3.googleusercontent.com/a-/ALV-UjX1zem8cI_VJP-uQXXF1u1nCP_gj6Lnk9KabBZ4paQiQcuQgZd-=s120-c-rp-mo-ba2-br100', 'local_guide': True, 'reviews': 30, 'photos': 0}",3.0,Nice infrastructure,4 years ago,pune,Noetic Labs
"{'name': 'ASHISH INGLE ツ', 'link': 'https://www.google.com/maps/contrib/115977831565519453770?hl=en-US', 'contributor_id': '115977831565519453770', 'thumbnail': 'https://lh3.googleusercontent.com/a-/ALV-UjU2iQQG1RRPoT76OdKrpLTEFpFJ5eBZcQZkcuUbhShOd0Xo0aQK8g=s120-c-rp-mo-ba2-br100', 'local_guide': True, 'reviews': 10, 'photos': 0}",4.0,,a year ago,pune,Noetic Labs
"{'name': 'kinjal construction', 'link': 'https://www.google.com/maps/contrib/108726931757990231703?hl=en-US', 'contributor_id': '108726931757990231703', 'thumbnail': 'https://lh3.googleusercontent.com/a/ACg8ocJYfZ0dzxi_VXFcaedYfvqfxYzzLy9cScqwAKLpBhkg9fXKAw=s120-c-rp-mo-br100', 'reviews': 1, 'photos': 0}",5.0,Overall Technical staff gave us proper & in detail training & solve every single query . Thank you .,3 weeks ago,pune,"Antraweb Technologies Pvt. Ltd. - Tally Support, Customization, Integration & Solutions"
"{'name': 'Finance Digitactix', 'link': 'https://www.google.com/maps/contrib/103497220876058583639?hl=en-US', 'contributor_id': '103497220876058583639', 'thumbnail': 'https://lh3.googleusercontent.com/a/ACg8ocKWYViSyA11fG4k-CJen4gVeE-hkgvTHEuquLxwjV__4Hdz1g=s120-c-rp-mo-br100', 'reviews': 2, 'photos': 0}",5.0,Experience is expellant with Rahul Morya. He teach us in very good manner. we are very thankful. Keep it up. Thank You So Much!,9 months ago,pune,"Antraweb Technologies Pvt. Ltd. - Tally Support, Customization, Integration & Solutions"
"{'name': 'saurabh bhalerao', 'link': 'https://www.google.com/maps/contrib/113958493285105355928?hl=en-US', 'contributor_id': '113958493285105355928', 'thumbnail': 'https://lh3.googleusercontent.com/a-/ALV-UjUZBkIPfNRsOlh1FgZYsQHSj4GiygMnXMWR5rqqfsCdN6BmDE2s=s120-c-rp-mo-br100', 'reviews': 2, 'photos': 0}",5.0,Antraweb Technologies Pvt. Ltd. has been a game-changer for our business. Their expertise in Tally support and customization is unparalleled. Their team seamlessly integrated our systems and provided innovative solutions that have significantly improved our productivity. Their commitment to client satisfaction is truly commendable. I couldn't be happier with the results and highly recommend Antraweb for any Tally-related needs.,a year ago,pune,"Antraweb Technologies Pvt. Ltd. - Tally Support, Customization, Integration & Solutions"
"{'name': 'For YouTube', 'link': 'https://www.google.com/maps/contrib/113927741639963133324?hl=en-US', 'contributor_id': '113927741639963133324', 'thumbnail': 'https://lh3.googleusercontent.com/a/ACg8ocJ7rxZm8-9QGYdYFe8AJPVM5He-Eb27gOtG6Nj6IsG-0O6TOQ=s120-c-rp-mo-br100', 'reviews': 2, 'photos': 0}",5.0,"Antraweb Technologies Pvt. Ltd. is a top-notch provider of Tally support, customization, integration, and solutions. Their team is highly knowledgeable and attentive, ensuring that all our needs are met with precision and efficiency. Their seamless integration and tailor-made solutions have greatly improved our business operations. Their expertise and dedication make them a valuable partner for any organization looking to streamline their accounting processes.",a year ago,pune,"Antraweb Technologies Pvt. Ltd. - Tally Support, Customization, Integration & Solutions"
"{'name': 'sneha signext', 'link': 'https://www.google.com/maps/contrib/103597120537051188727?hl=en-US', 'contributor_id': '103597120537051188727', 'thumbnail': 'https://lh3.googleusercontent.com/a/ACg8ocJ0U9gFmXmQovUrqlM1IGYAj_uagF447Ho85vwjxEmw4KQbdw=s120-c-rp-mo-br100', 'reviews': 1, 'photos': 0}",5.0,"We are happy to get such nice support from Executive. Antraweb is always providing ""Quick and Prompt Services"" to us. Also resolved our tally's  & accounting issues in a quickly. The better this is that his Response time is Very Good and given Accurate solutions.
such very nice experience we have get from Antraweb .

Thanks to give a very nice support .",3 years ago,pune,"Antraweb Technologies Pvt. Ltd. - Tally Support, Customization, Integration & Solutions"
"{'name': 'Anusha Kale', 'link': 'https://www.google.com/maps/contrib/108655247755807064765?hl=en-US', 'contributor_id': '108655247755807064765', 'thumbnail': 'https://lh3.googleusercontent.com/a-/ALV-UjWxOciBv61jarT2hdxFAY2RBZzS-CNxkIS7l5r0O3wEK90I-AmJ=s120-c-rp-mo-br100', 'reviews': 2, 'photos': 0}",5.0,"Munner Shaikh was very professional with proper guidance. He was very soft, speaking very softly and good understanding. I wish him all the best..",a year ago,pune,"Antraweb Technologies Pvt. Ltd. - Tally Support, Customization, Integration & Solutions"
"{'name': 'Akshay Kumbhar (New Arrivals)', 'link': 'https://www.google.com/maps/contrib/103488227349270882248?hl=en-US', 'contributor_id': '103488227349270882248', 'thumbnail': 'https://lh3.googleusercontent.com/a-/ALV-UjUyhI7a4A0MWOZTS2JWugKhlneaQAykP6MYe67M7m14iJphBexv=s120-c-rp-mo-br100', 'local_guide': True, 'reviews': 6, 'photos': 3}",5.0,"Sagar hogade was very professional with proper guiding knowledge. He was very fluently speaking and understanding, speaking very softly and good understanding. I wish him all the best..for the future opportunities",a year ago,pune,"Antraweb Technologies Pvt. Ltd. - Tally Support, Customization, Integration & Solutions"
"{'name': 'Chetan Golatkar', 'link': 'https://www.google.com/maps/contrib/100056057303202233628?hl=en-US', 'contributor_id': '100056057303202233628', 'thumbnail': 'https://lh3.googleusercontent.com/a-/ALV-UjWag_2HJRoSV3lPLA9_N1IQDSoRMONpVxvEZwSiAGeQNRqqU-0c=s120-c-rp-mo-ba2-br100', 'local_guide': True, 'reviews': 4, 'photos': 18}",5.0,"I'm happy with Antraweb Technologies services  very good services but all credit goes to Mr Anil My all quary is solve by him and  i think company need such a good and smart person. I had got a  exactly service what I was looking for.

The only reason to give 5 stars is the fact that I'm very much happy with service,thank you In future we will definitely look forward 😊",3 years ago,pune,"Antraweb Technologies Pvt. Ltd. - Tally Support, Customization, Integration & Solutions"
"{'name': 'Marshal kant', 'link': 'https://www.google.com/maps/contrib/103689248332796864012?hl=en-GB', 'contributor_id': '103689248332796864012', 'thumbnail': 'https://lh3.googleusercontent.com/a-/ALV-UjXSSQTYB8411aOjhSJuqbiFJKMFkyxGiGspxYVNinu5Ek78mjCLpw=s120-c-rp-mo-br100', 'reviews': 5, 'photos': 0}",5.0,"Synkrama Technologies is a great company to work with. They are very professional and knowledgeable, and they always deliver high-quality work. I would highly recommend them to anyone looking for software development or design services.",7 months ago,pune,Synkrama Technologies PVT LTD
"{'name': 'Deepika Jain', 'link': 'https://www.google.com/maps/contrib/101141583867827775004?hl=en-GB', 'contributor_id': '101141583867827775004', 'thumbnail': 'https://lh3.googleusercontent.com/a/ACg8ocLP5i9OIg8hW6MOm_r3UJCcS-Y6GBJLWe95EoOXOJXinIhWjg=s120-c-rp-mo-br100', 'reviews': 1, 'photos': 0}",5.0,"Exceptional experience with Synkrama Technologies for our website development! From start to finish, their team demonstrated unparalleled professionalism, delivering a high-quality website that exceeded our expectations. Communication was good, deadlines were met, and the attention to detail was impressive. We highly recommend their website app devlopment services in Pune!",7 months ago,pune,Synkrama Technologies PVT LTD
"{'name': 'yashika verma', 'link': 'https://www.google.com/maps/contrib/116909704756461250513?hl=en-GB', 'contributor_id': '116909704756461250513', 'thumbnail': 'https://lh3.googleusercontent.com/a-/ALV-UjWpuamWBZXeLfkHKvLL8jN5BfL3FWIq43TSWZLaTToRyG0nXCWW=s120-c-rp-mo-br100', 'reviews': 4, 'photos': 0}",5.0,I highly recommend this company for website designing and development services. Synkrama Technologies Pvt Ltd would be my first choice for designing or developing your website. Their work is of the highest quality.,7 months ago,pune,Synkrama Technologies PVT LTD
"{'name': 'Vikram Jain', 'link': 'https://www.google.com/maps/contrib/106386122928340791906?hl=en-GB', 'contributor_id': '106386122928340791906', 'thumbnail': 'https://lh3.googleusercontent.com/a/ACg8ocJ13sTyzIUWDB73Aeae2-lkaT7zkC5qrrdNMs3cyu8OgIzUGw=s120-c-rp-mo-br100', 'reviews': 3, 'photos': 5}",5.0,"I am highly satisfied with the Mobile App Development service provided by Synkrama Technologies Pvt Ltd ,a leading mobile app development company in Pune.We decide to select for them because of their responsiveness . The quality of their services is outstanding and they involved us in each step of the development process.",7 months ago,pune,Synkrama Technologies PVT LTD
"{'name': 'Shailesh Yadav', 'link': 'https://www.google.com/maps/contrib/103276096433819131561?hl=en-GB', 'contributor_id': '103276096433819131561', 'thumbnail': 'https://lh3.googleusercontent.com/a-/ALV-UjUOZ6a7bce0kTzpPJjBUQhTDA3yNhg0dfIiNnx9Y-7ahreRgH0=s120-c-rp-mo-br100', 'reviews': 1, 'photos': 0}",5.0,"I've never worked with such a great team before Synkrama has been the game changer for my business. The way they work, their dedication and most importantly how sound solutions they have towards the business they do is commendable. They are very communicative and completely transparent in their process. I highly recommend them.

Once again, Thank you Synkrama and team for such a wonderful experience. I will continue to use their services.",3 years ago,pune,Synkrama Technologies PVT LTD
"{'name': 'Hassan Nawaz Chattha', 'link': 'https://www.google.com/maps/contrib/118332151517732061448?hl=en-GB', 'contributor_id': '118332151517732061448', 'thumbnail': 'https://lh3.googleusercontent.com/a-/ALV-UjWaIa92zBAwU8Gui8qs-8Z-MGDxOWoErCOvjrL29K74ydITkrM=s120-c-rp-mo-br100', 'reviews': 1, 'photos': 0}",5.0,Exceptional service! Synkrama Technologies surpassed my expectations with their top-notch solutions and outstanding customer support. Definitely a five-star experience!,a year ago,pune,Synkrama Technologies PVT LTD
"{'name': 'alexandra gray', 'link': 'https://www.google.com/maps/contrib/116193869514520169616?hl=en-GB', 'contributor_id': '116193869514520169616', 'thumbnail': 'https://lh3.googleusercontent.com/a-/ALV-UjXWSLxoGySbElBrL3tM0j21rIaZkv7iuun5bIbWXtgt_ziQi3G0=s120-c-rp-mo-br100', 'reviews': 2, 'photos': 0}",5.0,"Synkrama has been a magnificent organization since the beginning. They deal with you like an individual, not a representative. Have been gleaning some useful knowledge of new things since day 1. I've never worked with such an extraordinary group before Synkrama has been a unique advantage for my business.",2 years ago,pune,Synkrama Technologies PVT LTD
"{'name': 'Rathod Impex', 'link': 'https://www.google.com/maps/contrib/100091071260260512832?hl=en-GB', 'contributor_id': '100091071260260512832', 'thumbnail': 'https://lh3.googleusercontent.com/a/ACg8ocJT_d4T_qp-YM6Z1wV5wW9X8aMWDEnT4VEqrdTqMnC32UAfHg=s120-c-rp-mo-br100', 'reviews': 1, 'photos': 0}",5.0,Synkram Technologies PVT LTD is one of the top Ecommerce Development Companies in Bengaluru. Both ecommerce website development and digital marketing services were available here at the best quality.,7 months ago,pune,Synkrama Technologies PVT LTD
"{'name': 'Backup Revogreen', 'link': 'https://www.google.com/maps/contrib/102361170011141822292?hl=en-US', 'contributor_id': '102361170011141822292', 'thumbnail': 'https://lh3.googleusercontent.com/a/ACg8ocLyjlTxPaq4M01SLl3Qzm_9wGbHujALdAqxpGVA-BhRkhLSFw=s120-c-rp-mo-br100', 'reviews': 1, 'photos': 0}",5.0,"I recently worked with a bespoke web development company and I'm extremely satisfied with their services. They provided a professional and responsive service, delivering a high-quality product that exceeded my expectations. The team took the time to understand my unique business needs and created a custom solution that effectively met those needs. The website is visually stunning and highly functional. They also provided ongoing support and maintenance to ensure that my website is running smoothly. I highly recommend this company for anyone in need of a custom website solution.",2 years ago,pune,ScroBits Technologies
"{'name': 'Pranav Shirude', 'link': 'https://www.google.com/maps/contrib/106801414188081784470?hl=en-US', 'contributor_id': '106801414188081784470', 'thumbnail': 'https://lh3.googleusercontent.com/a-/ALV-UjWYeLiZ9vpOD6WW_zqH-qcI3gl0VHFrkDFkUxGgvmXhO8K69ti2vA=s120-c-rp-mo-ba2-br100', 'local_guide': True, 'reviews': 18, 'photos': 9}",5.0,"I know Arpit and his teammates since college time. They have been facilitating customers since Mid 2020 with absolute trust and transparency. Their Customer First Approach made them finest of all. If I would have been organization and wanted to set up a team of MERN developers, I would go with them any day with my eyes closed",a year ago,pune,ScroBits Technologies
"{'name': 'Sahil Hariyani', 'link': 'https://www.google.com/maps/contrib/117654837078669781368?hl=en-US', 'contributor_id': '117654837078669781368', 'thumbnail': 'https://lh3.googleusercontent.com/a-/ALV-UjU5vB4JtzcbufL2UyVJgeKyP2iHj3Uy1iBatDTM3mpnccvdj-Ty=s120-c-rp-mo-br100', 'local_guide': True, 'reviews': 9, 'photos': 3}",5.0,"Best company for customised End-to-End IT, Web, Mobile development, They make really good design, understand the business and provide perfect solution as per needs; I really appreciate the SEO optimisation efforts they take and the way they educate business owners about digital strategies.

I shared multiple references to this company as they always provide good Quality.",2 years ago,pune,ScroBits Technologies
"{'name': 'nikhil patil', 'link': 'https://www.google.com/maps/contrib/100009334389245794483?hl=en-US', 'contributor_id': '100009334389245794483', 'thumbnail': 'https://lh3.googleusercontent.com/a-/ALV-UjXfcXIbqsp6fRfH78BqdFYzjEiGCm2SBc4d-JMfDBKDb2-LJAaR=s120-c-rp-mo-br100', 'reviews': 1, 'photos': 0}",5.0,"Great IT company to work at! I joined as a software automation tester, team helped me a lot in the early days& the best part is their believe and trust in me, they trusted on me to carry on full fledged test and asked me to set the testing flow for team.
Great opportunities and learning.
Thanks",2 years ago,pune,ScroBits Technologies
"{'name': 'Ashvini Khankule', 'link': 'https://www.google.com/maps/contrib/103244365509604096640?hl=en-US', 'contributor_id': '103244365509604096640', 'thumbnail': 'https://lh3.googleusercontent.com/a/ACg8ocLIZkzcJz0Q_MhZw28B9gClqy9i-SdS6m0gVh8Td0_bbNbn_A=s120-c-rp-mo-br100', 'local_guide': True, 'reviews': 1, 'photos': 0}",5.0,"A nice company to become technically fit for the future, good people, supportive, talented and skillful people, good environment between the team and all  employees in the firm.",9 months ago,pune,ScroBits Technologies
"{'name': 'Somesh Bhosale', 'link': 'https://www.google.com/maps/contrib/110335563677546678331?hl=en-US', 'contributor_id': '110335563677546678331', 'thumbnail': 'https://lh3.googleusercontent.com/a-/ALV-UjWoOYdoLJBkx6NxCQfxVUiWn1dJQa_8BGRHdjblbSJikh4pXkVI=s120-c-rp-mo-br100', 'reviews': 1, 'photos': 0}",5.0,"Scrobits Technologies provides top-notch software development solutions and excels in delivering innovative cloud-native solutions with exceptional UI/UX. Their company culture is vibrant, fostering a fun-loving atmosphere through parties and cricket matches, creating a close-knit team. They value outings to promote team bonding and relaxation. Moreover, Scrobits Technologies offers great growth and learning opportunities, enabling individuals to enhance their skills and reach new heights. Highly recommended for their cutting-edge solutions, enjoyable culture, and continuous development.",a year ago,pune,ScroBits Technologies
