username,rating,text,date,ct,company
"{'name': 'Silpi Singh', 'link': 'https://www.google.com/maps/contrib/110588200822944866877?hl=en-US', 'contributor_id': '110588200822944866877', 'thumbnail': 'https://lh3.googleusercontent.com/a-/ALV-UjXOlr8mLGLoS2zEBmbkQF2C3ezvaXZUSBsyDzEk-K7zks_JdHSg=s120-c-rp-mo-br100', 'reviews': 1, 'photos': 0}",5.0,"I had my Party Plan MLM software developed by Taksh IT Solutions, and I must say their work exceeded my expectations. They maintained a highly professional approach throughout the entire process and provided excellent support at every step. The design and functionality of the software are both user-friendly, and they implemented all the features with great attention to detail.

What impressed me the most was their timely delivery. They understood my requirements clearly and customized the software accordingly, ensuring the project was completed on time. I'm very happy with the outcome and would definitely consider working with them again in the future. I highly recommend Taksh IT Solutions to anyone looking for top-quality MLM software.👍👍👍",3 months ago,Noida,Taksh IT Solutions Private Limited
"{'name': 'Golu Sharma', 'link': 'https://www.google.com/maps/contrib/110094192344557273566?hl=en-US', 'contributor_id': '110094192344557273566', 'thumbnail': 'https://lh3.googleusercontent.com/a/ACg8ocIckw0EHVVa0zcsyfypRo3yLZ90KWjI30b6WlYkQ9Umdd11_g=s120-c-rp-mo-br100', 'reviews': 1, 'photos': 0}",5.0,"We had a Binary Plan MLM Software developed by Taksh IT Solutions, and they exceeded our expectations by delivering an outstanding product. Their team showcased professionalism, ensured timely delivery, and provided excellent customization options. We received support and guidance at every step, which was incredibly helpful for our business. We highly recommend Taksh IT Solutions for anyone in need of reliable and high-quality MLM software. Choose them without any hesitation!👍👍👍👍",3 months ago,Noida,Taksh IT Solutions Private Limited
"{'name': 'Smartindia portal', 'link': 'https://www.google.com/maps/contrib/109101896684277855424?hl=en-US', 'contributor_id': '109101896684277855424', 'thumbnail': 'https://lh3.googleusercontent.com/a/ACg8ocLYpDYLHsrcwkURG8tg2mV3GN202u2PUe1-DOjbzvUJQbYGhQ=s120-c-rp-mo-br100', 'reviews': 1, 'photos': 0}",5.0,"We had a Board Plan MLM Software developed by Taksh IT Solutions, and they went above and beyond to deliver an excellent product that exceeded our expectations. Their team demonstrated great professionalism, provided timely delivery, and offered extensive customization options. They ensured smooth communication and offered outstanding support throughout the development process. If you’re looking for reliable, high-quality MLM software, we highly recommend Taksh IT Solutions. Their expertise and commitment are truly impressive👍👍👍👍",3 months ago,Noida,Taksh IT Solutions Private Limited
"{'name': 'Arpit Gaur', 'link': 'https://www.google.com/maps/contrib/107225009405423980758?hl=en-US', 'contributor_id': '107225009405423980758', 'thumbnail': 'https://lh3.googleusercontent.com/a-/ALV-UjXquMv1gVCfuRqAn5rL2XpxVA6HoLwNYg8Ay0gpX9S7eyWlMewf=s120-c-rp-mo-br100', 'local_guide': True, 'reviews': 4, 'photos': 3}",5.0,"Customer Support**:
The customer support provided by Taksh IT Solutions is outstanding. Their support team is available 24/7 and is always prompt in addressing our concerns and resolving any issues. The use of a ticketing system helps in tracking and managing our requests efficiently, ensuring minimal downtime and disruption to our operations.",7 months ago,Noida,Taksh IT Solutions Private Limited
"{'name': 'NISHANT Srivastav', 'link': 'https://www.google.com/maps/contrib/106667104169318203792?hl=en-US', 'contributor_id': '106667104169318203792', 'thumbnail': 'https://lh3.googleusercontent.com/a/ACg8ocL0iAVNzJbHMPWO_oN3hEPcMWqTUY4VRmdrf4LxV1CuIyyx6RA=s120-c-rp-mo-br100', 'reviews': 2, 'photos': 0}",5.0,"I have been working as a .NET Developer at Taksh IT Solutions Private Limited for the past year, and it has been a highly positive experience. The company fosters a supportive and innovative work environment, encouraging professional growth and development. The team is skilled and collaborative, and the management is approachable and supportive. I highly recommend Taksh IT Solutions Private Limited for its commitment to excellence and employee well-being.",9 months ago,Noida,Taksh IT Solutions Private Limited
"{'name': 'abhay pratap Singh', 'link': 'https://www.google.com/maps/contrib/106933408494686508882?hl=en-US', 'contributor_id': '106933408494686508882', 'thumbnail': 'https://lh3.googleusercontent.com/a/ACg8ocLEH2SDMyWgyZTun3IzFajtHOG528nQECJCqvMwjedy9W8EvwVF=s120-c-rp-mo-br100', 'reviews': 2, 'photos': 0}",5.0,"Quality of Services**:
Taksh IT Solutions consistently delivers high-quality IT services that have significantly enhanced our business operations. Their team of experts ensures that all solutions are tailored to our specific needs, resulting in efficient and effective outcomes.",7 months ago,Noida,Taksh IT Solutions Private Limited
"{'name': 'John Thomson', 'link': 'https://www.google.com/maps/contrib/117862602655834346649?hl=en-US', 'contributor_id': '117862602655834346649', 'thumbnail': 'https://lh3.googleusercontent.com/a/ACg8ocIgY_0ci1-FGKzFM6Vst9B9SJep7dZ7LYn3UX-clSoOsvDDog=s120-c-rp-mo-br100', 'reviews': 1, 'photos': 0}",5.0,"I'm highly impressed with the ICO software developed by Taksh It Solutions. The features are robust, user-friendly, and perfectly tailored to meet our needs. Their attention to detail and excellent customer support truly stand out.",8 months ago,Noida,Taksh IT Solutions Private Limited
"{'name': 'Aditya Gaur', 'link': 'https://www.google.com/maps/contrib/105179956799269283511?hl=en-US', 'contributor_id': '105179956799269283511', 'thumbnail': 'https://lh3.googleusercontent.com/a-/ALV-UjVz_qCbSTJ6on6tZZ0F9DpK9M8MxIBuoHqXHdB6KZMdu2l30e29=s120-c-rp-mo-br100', 'local_guide': True, 'reviews': 1, 'photos': 2}",5.0,"Taksh IT Solutions employs modern server infrastructure with high-performance storage solutions, ensuring efficient data handling and processing. The networking equipment in use supports high-speed data transfer and robust connectivity.",7 months ago,Noida,Taksh IT Solutions Private Limited
"{'name': 'Saif Mohammad', 'link': 'https://www.google.com/maps/contrib/105433310971655191338?hl=en-US', 'contributor_id': '105433310971655191338', 'thumbnail': 'https://lh3.googleusercontent.com/a/ACg8ocJ5T3eORnNJUB67hUPE2G3__bA9QfL3BhC3BaCOcYbyQ50t5g=s120-c-rp-mo-br100', 'reviews': 1, 'photos': 0}",5.0,"We had a great experience with Mariox Software, an mobile app development company in Noida. Our project was a success thanks to their care for quality and attention to detail. Thanks!",2 months ago,Noida,"Mariox Software - Top Mobile App Development Company in Noida, India | Custom iOS & Android Apps Development Services"
"{'name': 'Farzana Parveen', 'link': 'https://www.google.com/maps/contrib/117578417040616615988?hl=en-US', 'contributor_id': '117578417040616615988', 'thumbnail': 'https://lh3.googleusercontent.com/a/ACg8ocIZJULdSDmkoIs5znlLZW0uGhxA8ZKOLYo9hCPDfzH-ic6PAQ=s120-c-rp-mo-br100', 'local_guide': True, 'reviews': 1, 'photos': 0}",5.0,"Mariox is the best app development company in Noida. It is an inspiring place to work, with a helpful team and fun projects. I'm happy to work for such a great company.",3 weeks ago,Noida,"Mariox Software - Top Mobile App Development Company in Noida, India | Custom iOS & Android Apps Development Services"
"{'name': 'Vandana Tiwari', 'link': 'https://www.google.com/maps/contrib/107176859489010361897?hl=en-US', 'contributor_id': '107176859489010361897', 'thumbnail': 'https://lh3.googleusercontent.com/a/ACg8ocJz01HvQkylH7hrBssBW9Q9XHhdbElICyS-PGfIXhel2nhSgQ=s120-c-rp-mo-br100', 'reviews': 1, 'photos': 0}",5.0,"Mariox Software's team was polite, quick to respond, and on time with a great product. The experience we had working with Mariox as our app development company in Noida was great.",3 months ago,Noida,"Mariox Software - Top Mobile App Development Company in Noida, India | Custom iOS & Android Apps Development Services"
"{'name': 'Ratnesh Mishra', 'link': 'https://www.google.com/maps/contrib/114295723804179657708?hl=en-US', 'contributor_id': '114295723804179657708', 'thumbnail': 'https://lh3.googleusercontent.com/a-/ALV-UjXMAn2SNnFu4ZQL92MhDnDUCVygAfsV1p_xbxWrjsjBVWinHycQPw=s120-c-rp-mo-br100', 'local_guide': True, 'reviews': 13, 'photos': 0}",5.0,"For our company, using Mariox Software has changed everything. As the top mobile app development company in Hyderabad, they offered creative ideas that catered to our needs. Their knowledge of application development guaranteed a flawless experience. The outcomes make us unable to be happy!",3 months ago,Noida,"Mariox Software - Top Mobile App Development Company in Noida, India | Custom iOS & Android Apps Development Services"
"{'name': 'Asiya Parveen', 'link': 'https://www.google.com/maps/contrib/116073913752155306062?hl=en-US', 'contributor_id': '116073913752155306062', 'thumbnail': 'https://lh3.googleusercontent.com/a/ACg8ocKwllaJm-tmvR_91Fc2LOGeXQSlFWkqwTcg3EiQaF7G4Enn3A=s120-c-rp-mo-br100', 'local_guide': True, 'reviews': 2, 'photos': 0}",5.0,"Here at Mariox software, we make outstanding app development in Noida. This company is a great workplace because it has a great team, cutting edge technology, and room for job growth!",3 weeks ago,Noida,"Mariox Software - Top Mobile App Development Company in Noida, India | Custom iOS & Android Apps Development Services"
"{'name': 'Hotel Aarya', 'link': 'https://www.google.com/maps/contrib/109603232348851496176?hl=en-US', 'contributor_id': '109603232348851496176', 'thumbnail': 'https://lh3.googleusercontent.com/a/ACg8ocLV0J3rnI2H6lJXvciDgZCxso-KG0Ktt28z0l_AKEaTQdjDeQ=s120-c-rp-mo-br100', 'reviews': 2, 'photos': 0}",5.0,"App development is what Mariox Software in Noida does best. As a result of their skilled team, they can provide smooth, unique solutions. You can easily use and rely on the tools. Excellent customer service. It's a perfect pick for an app development service.",5 months ago,Noida,"Mariox Software - Top Mobile App Development Company in Noida, India | Custom iOS & Android Apps Development Services"
"{'name': 'Akhilesh Srivastava', 'link': 'https://www.google.com/maps/contrib/105190373192707323049?hl=en-US', 'contributor_id': '105190373192707323049', 'thumbnail': 'https://lh3.googleusercontent.com/a/ACg8ocJcpIbjoAPE0D5H9gRyYej2qSRWQBQrXlLNOlvBahMKeBv2ng=s120-c-rp-mo-br100', 'local_guide': True, 'reviews': 1, 'photos': 0}",5.0,Flexible work schedules at Mariox Software help workers keep a good mix between work and personal life. This adaptability is very helpful in the fast-paced field of mobile app development services in Noida.,2 months ago,Noida,"Mariox Software - Top Mobile App Development Company in Noida, India | Custom iOS & Android Apps Development Services"
"{'name': 'Avantika tiwari Tiwari', 'link': 'https://www.google.com/maps/contrib/102513632421875974887?hl=en-US', 'contributor_id': '102513632421875974887', 'thumbnail': 'https://lh3.googleusercontent.com/a/ACg8ocIM_XUHRe8yvqMo97lwl8QS66Tu5BavQFimNuc1_wwE0l0UOw=s120-c-rp-mo-br100', 'reviews': 1, 'photos': 0}",5.0,"Mariox Software, an app development company in Noida, did a great job. They completely got what we wanted and gave us an app that really shows off our brand. Their help and knowledge made our project a success. Mariox, thank you!",3 months ago,Noida,"Mariox Software - Top Mobile App Development Company in Noida, India | Custom iOS & Android Apps Development Services"
"{'name': 'Mahi Sharma', 'link': 'https://www.google.com/maps/contrib/111965206262587236216?hl=en-US', 'contributor_id': '111965206262587236216', 'thumbnail': 'https://lh3.googleusercontent.com/a-/ALV-UjWsM9HBjxi52qnvFBoycfxQHyDQprnuhNrdKMr4Bfnw2o1sGLM=s120-c-rp-mo-br100', 'reviews': 1, 'photos': 0}",5.0,"Omefyi Software Technologies Pvt. Ltd. is outstanding! The social media marketing strategies and team is highly skilled but also very corporative and friendly. If you’re looking to make a strong online impact, I highly recommend them.",6 months ago,Noida,Omefyi Software Technologies Pvt. Ltd.
"{'name': 'Dharmendra Chauhan', 'link': 'https://www.google.com/maps/contrib/117930910984887350578?hl=en-US', 'contributor_id': '117930910984887350578', 'thumbnail': 'https://lh3.googleusercontent.com/a-/ALV-UjXK7DilgUREspsigTzVSL8ncklz9v6XdHlA71o_mUJPEfoS6b5d=s120-c-rp-mo-ba3-br100', 'local_guide': True, 'reviews': 32, 'photos': 106}",5.0,"I had a fantastic experience with Omefyi software Technologies. Their team is professional, talented, and attentive to client needs. They created a visually stunning and user-friendly website that perfectly represents my brand. Highly recommend!",9 months ago,Noida,Omefyi Software Technologies Pvt. Ltd.
"{'name': 'Shachindra Kaushik', 'link': 'https://www.google.com/maps/contrib/111935082634859547389?hl=en-US', 'contributor_id': '111935082634859547389', 'thumbnail': 'https://lh3.googleusercontent.com/a/ACg8ocLS9_jC-xvPpFj4FZk63URxZPWobNuGQBtHHJjrnmUOKVWidQ=s120-c-rp-mo-br100', 'reviews': 1, 'photos': 0}",5.0,"I've been using the digital marketing services provided by Omefyi Software Technologies for my business and I am really happy with the response I am getting. I must say that I'm thoroughly impressed with their work, dedication and client support system. They have a team of experts who are highly skilled and knowledgeable and their customer support is uncomparible in the industry. Wish them a good luck.",11 months ago,Noida,Omefyi Software Technologies Pvt. Ltd.
"{'name': 'Kashish Gupta', 'link': 'https://www.google.com/maps/contrib/115635927314754570553?hl=en-US', 'contributor_id': '115635927314754570553', 'thumbnail': 'https://lh3.googleusercontent.com/a-/ALV-UjWWIpXAZE-kw8w4-DADfPNrg_udIuiczXrEQLQrXWKLzJ2g_GJ1=s120-c-rp-mo-br100', 'local_guide': True, 'reviews': 4, 'photos': 0}",5.0,"Good people they solved my SEO of my website, Part I like most is transparency they educate clients what ever action they do.

I will work again with them for my next website design and SEO",3 months ago,Noida,Omefyi Software Technologies Pvt. Ltd.
"{'name': 'Pooja chauhan', 'link': 'https://www.google.com/maps/contrib/106426944003134817453?hl=en-US', 'contributor_id': '106426944003134817453', 'thumbnail': 'https://lh3.googleusercontent.com/a-/ALV-UjWW7eznVUviEJ9ECdm8ZRCB3jvwFT8Vz0ybtfnpvq5BbR1TWE0r=s120-c-rp-mo-br100', 'reviews': 1, 'photos': 0}",5.0,"Omefyi Software Technologies Pvt. Ltd. is amazing! They helped me shine online with their smart marketing. Their team rocks and they're super friendly too. If you want to do great online, go with them.",9 months ago,Noida,Omefyi Software Technologies Pvt. Ltd.
"{'name': 'swati kaushik', 'link': 'https://www.google.com/maps/contrib/103114362340560252469?hl=en-US', 'contributor_id': '103114362340560252469', 'thumbnail': 'https://lh3.googleusercontent.com/a/ACg8ocI3P-C51gtAOJMKMaDDfNxXA3gslNrvOQLUXNT8FnFlw-WQfA=s120-c-rp-mo-br100', 'reviews': 1, 'photos': 0}",5.0,"Omefyi Software Technologies Pvt. Ltd. offers an unparalleled work environment where innovation thrives. Their team is highly experienced and collaborative, fostering a culture of excellence. Their exceptional digital marketing services are tailored to the needs of clients using cutting-edge strategies for optimal results. With Omefyi, you can count on a dynamic workplace, a dedicated team, and excellent services that exceed expectations.

.",a year ago,Noida,Omefyi Software Technologies Pvt. Ltd.
"{'name': 'Shivendra Kaushik', 'link': 'https://www.google.com/maps/contrib/111771987288447470982?hl=en-US', 'contributor_id': '111771987288447470982', 'thumbnail': 'https://lh3.googleusercontent.com/a-/ALV-UjWYyWEuICIiwhbt7W8Gh8CkNLglWGZlQ61WHuV536n07InErK6v=s120-c-rp-mo-br100', 'reviews': 4, 'photos': 0}",5.0,"Omefyi Software Technologies provides exceptional digital marketing services with a professional team dedicated to boosting online presence. Their expertise in digital marketing strategies ensures effective campaigns tailored to clients' needs. With Omefyi, expect top-notch service and measurable results. Their team's professionalism and commitment make them a reliable choice for anyone looking to enhance their online marketing efforts.",11 months ago,Noida,Omefyi Software Technologies Pvt. Ltd.
"{'name': 'Kiara Fernandez-Bravo', 'link': 'https://www.google.com/maps/contrib/100370600810112343871?hl=en-US', 'contributor_id': '100370600810112343871', 'thumbnail': 'https://lh3.googleusercontent.com/a/ACg8ocJJqKvZYMPLGipPwjGfdfiGxHKz_4Hs_YPtQGQO0ak7Yfmgp7g=s120-c-rp-mo-br100', 'reviews': 1, 'photos': 0}",5.0,"I'm thrilled to share my experience with Omefyi Company. They have been an absolute game-changer for my online business, and I can't express how grateful I am for their exceptional services.

From the moment I partnered with them, I noticed a significant improvement in my website's search engine rankings. Their team of experts demonstrated an in-depth understanding of the ever-evolving world of SEO, and they tailored a strategy that perfectly suited my business needs.

What truly sets them apart is their commitment to transparency and communication. They kept me informed about every step of the process, explaining the strategies they were implementing and the results we were achieving. It's clear that they genuinely care about their clients' success.

Thank you for your outstanding work and unwavering commitment to my business's success. You've truly made a positive impact, and I couldn't be happier with the results.",a year ago,Noida,Omefyi Software Technologies Pvt. Ltd.
"{'name': 'Kamlesh Pant', 'link': 'https://www.google.com/maps/contrib/105987671294950376714?hl=en-US', 'contributor_id': '105987671294950376714', 'thumbnail': 'https://lh3.googleusercontent.com/a/ACg8ocLRXyQQNWl7lr0J0gm6jYrDW3sJ7iDIEy2tuePThy6HhwdHyQ=s120-c-rp-mo-br100', 'reviews': 2, 'photos': 0}",5.0,"I had the privilege of working at Beganto Software Company for several years, and it was an incredible experience. The company culture is inclusive, and the management genuinely cares about employee well-being.

The team at Beganto Software is not only talented but also supportive. Whenever I faced challenges, my colleagues were there to lend a helping hand. The collaborative environment fostered creativity and innovation.

Moreover, the company invests in professional development. I attended workshops, conferences, and training sessions that enhanced my skills. Beganto Software truly values its employees’ growth.

Overall, I highly recommend Beganto Software to anyone seeking a positive work environment, growth opportunities, and a supportive team.",8 months ago,Noida,Beganto Software Solutions Private Limited
"{'name': 'Rijun Saini', 'link': 'https://www.google.com/maps/contrib/102904640840771127066?hl=en-US', 'contributor_id': '102904640840771127066', 'thumbnail': 'https://lh3.googleusercontent.com/a/ACg8ocISH0-Vzc8NQJt4v8KBlOv5L8Y0X8inZNvNLygw5_QCnRSsTg=s120-c-rp-mo-br100', 'reviews': 3, 'photos': 0}",5.0,"It has been an enriching experience working at Beganto.The company provides outstanding opportunities for career advancement and personal growth. I've found the support from management to be pivotal in shaping my development, and their dedication to maintaining a positive work environment is truly admirable. This company provides you a very warm and peaceful environment. It's a privilege to be part of a company that values both its employees' growth and well-being.",8 months ago,Noida,Beganto Software Solutions Private Limited
"{'name': 'Avneesh verma', 'link': 'https://www.google.com/maps/contrib/100736966375067875144?hl=en-US', 'contributor_id': '100736966375067875144', 'thumbnail': 'https://lh3.googleusercontent.com/a-/ALV-UjWYqoDEoMxEHDVaracXynLfAId6eF1A-aMC3CYCjvCoMXFqP2U=s120-c-rp-mo-br100', 'local_guide': True, 'reviews': 2, 'photos': 0}",5.0,"I've had an amazing experience working at Beganto Software Solutions. As a job seeker, I found the recruitment process to be smooth and efficient. The company culture is vibrant, fostering growth and innovation. The team is talented, supportive, and collaborative, making every project a pleasure to work on. I highly recommend Beganto Software Solutions to anyone looking to advance their career in the IT field",9 months ago,Noida,Beganto Software Solutions Private Limited
"{'name': 'avinash bharti', 'link': 'https://www.google.com/maps/contrib/106785902880982612153?hl=en-US', 'contributor_id': '106785902880982612153', 'thumbnail': 'https://lh3.googleusercontent.com/a/ACg8ocLpR-SOY4gn_n5ocfQ5u4okbg8SO9iAvx0mMKI5ydlb-dNTqQ=s120-c-rp-mo-br100', 'reviews': 4, 'photos': 1}",5.0,"I have had a fantastic experience working at Beganto. The work culture is outstanding, fostering a positive and inclusive environment.
The flexible timing allows for a great work-life balance. Additionally, the people here are incredibly supportive. Overall, it's a wonderful place to work and grow.",8 months ago,Noida,Beganto Software Solutions Private Limited
"{'name': 'Ashutosh Saini', 'link': 'https://www.google.com/maps/contrib/103355357778205352549?hl=en-US', 'contributor_id': '103355357778205352549', 'thumbnail': 'https://lh3.googleusercontent.com/a-/ALV-UjXhdBNCZp3sDoeXl9PyLzWzvYD0fP_iSuQuQUrBliivcimZslbGvA=s120-c-rp-mo-br100', 'reviews': 4, 'photos': 0}",5.0,Fantastic work environment. Beganto is a company with small team size but having high values of business conduct. I spent about 8 year 2006-2014 working with Beganto. Those were the best times of my professional life... A lot of learnings and fun... All the best Beganto.,9 months ago,Noida,Beganto Software Solutions Private Limited
"{'name': 'Kamal Singh', 'link': 'https://www.google.com/maps/contrib/111918782479549448691?hl=en-US', 'contributor_id': '111918782479549448691', 'thumbnail': 'https://lh3.googleusercontent.com/a-/ALV-UjVH3ZF0FH-kPMuCLBrdUF2O3VgN_cb6wVfGqDXY4qM404-wqCI=s120-c-rp-mo-br100', 'local_guide': True, 'reviews': 6, 'photos': 0}",5.0,"I've had pleasure of working at Beganto and it has been an incredible experience.
This company values its employees and provided the environment to learn and grow at your best. Staff is supportive and everyone stands for each other.",9 months ago,Noida,Beganto Software Solutions Private Limited
"{'name': 'Brijesh Kumar', 'link': 'https://www.google.com/maps/contrib/115064418194692548576?hl=en-US', 'contributor_id': '115064418194692548576', 'thumbnail': 'https://lh3.googleusercontent.com/a-/ALV-UjWKYKQFAt4wDPthCp_KeZyluzQQANUFi3Fh9ZgygmV7k2C4CYcF=s120-c-rp-mo-br100', 'reviews': 7, 'photos': 0}",5.0,"I am working here as a Software Tester from last 14 years. My experience with this company has been excellent. The employer genuinely cares for your growth personally and professionally as well.
Every employee feel more comfortable due to good working culture, friendly staff, peaceful environment and good understanding among the employees. You can expect a good learning experience. Thanks!!",9 months ago,Noida,Beganto Software Solutions Private Limited
"{'name': 'Atul tiwari', 'link': 'https://www.google.com/maps/contrib/105094899408786811269?hl=en-US', 'contributor_id': '105094899408786811269', 'thumbnail': 'https://lh3.googleusercontent.com/a-/ALV-UjVcNLGxcL8LBwWwpzuNMl-fSpZmQTy_--tRgM-pIhwa3fkt1W43=s120-c-rp-mo-br100', 'reviews': 3, 'photos': 0}",5.0,"Great opportunities to kick start your career and Very good place to work. Possibility to work in different fields and projects. Very good work life balance and also work culture is very good.
The company certainly has great work atmosphere and the staff is good.
I have had a fair share of my time working with beganto and have only wonderful things to say.",9 months ago,Noida,Beganto Software Solutions Private Limited
"{'name': 'Rahul Kumar', 'link': 'https://www.google.com/maps/contrib/114145562804627834889?hl=en-US', 'contributor_id': '114145562804627834889', 'thumbnail': 'https://lh3.googleusercontent.com/a/ACg8ocLu7pFxeofRRWXrX6lbDQqkzpd0jEniDakaj9pqviBB_fsoxA=s120-c-rp-mo-br100', 'local_guide': True, 'reviews': 1, 'photos': 4}",5.0,"Tekniko Global is a fantastic workplace with supportive leadership, a collaborative team, and great opportunities for growth. The company values innovation, work-life balance, and continuous learning. Highly recommended for professional development!",a month ago,Noida,"Tekniko Global | Mobile App Development Company in Noida | Android, iOS App Development Company"
"{'name': 'Aditya Singh', 'link': 'https://www.google.com/maps/contrib/101342643532722023146?hl=en-US', 'contributor_id': '101342643532722023146', 'thumbnail': 'https://lh3.googleusercontent.com/a/ACg8ocK1LAey340lcsFjzn0aUK-7Lp9t9ricQsqD4HUg1Cx0wC6m=s120-c-rp-mo-br100', 'reviews': 1, 'photos': 0}",5.0,"Tekniko Global has been an excellent company!
""He developed a mobile app for us, and the results were outstanding. Highly satisfied with their work and professionalism."" Their innovative solutions and exceptional customer service helped streamline our processes. Highly recommend them for any tech-related needs. Truly reliable and professional!""",3 months ago,Noida,"Tekniko Global | Mobile App Development Company in Noida | Android, iOS App Development Company"
