username,rating,text,date,ct,company
"{'name': 'Chandan Sharma', 'link': 'https://www.google.com/maps/contrib/107028490566195537936?hl=en-US', 'contributor_id': '107028490566195537936', 'thumbnail': 'https://lh3.googleusercontent.com/a/ACg8ocJvAxuCP2TnrRl1BGG113qz3a6KX03i7ehNzLjt3fGk5kgu4w=s120-c-rp-mo-br100', 'reviews': 6, 'photos': 6}",1.0,"They have a hire and fire policy. They will mostly hire to keep you on hold for future projects which you will get if you are lucky else you will be fired after completing 3 months of bench period. They will suspend your account after that so that you won't be able to raise your voice. Also management is not bothered about such malpractices happening, so advice to people only join if you don't have a good offer of other companies and before joining do check with the project manager and ask them to have a word with an  employee who is already working on the project.
Else you will be hired for the bench and treated like an employee godown and enrolled into projects where no technical skills are required or else forced to resign after 3 months of bench.",a year ago,pune,Persistent Systems Limited
"{'name': 'Sagar Ingale', 'link': 'https://www.google.com/maps/contrib/103480775485600025362?hl=en-US', 'contributor_id': '103480775485600025362', 'thumbnail': 'https://lh3.googleusercontent.com/a-/ALV-UjVQFQBC6j2UdRm_6coL99h9AX5fVkE_FQiUiWFF-F-5BFNt87OBGw=s120-c-rp-mo-ba5-br100', 'local_guide': True, 'reviews': 218, 'photos': 1062}",5.0,"Building Digital Business Through Innovation, Integration, and Analytics.
Good place to start your carrier. Work culture is good and Clients are great.
Great Ambiance.. Nice Working environment.. Good Security and Parking Arrangement.",7 years ago,pune,TIBCO Software India Pvt. Ltd
"{'name': 'Govind Kamat', 'link': 'https://www.google.com/maps/contrib/110785491366560731328?hl=en-US', 'contributor_id': '110785491366560731328', 'thumbnail': 'https://lh3.googleusercontent.com/a-/ALV-UjU1CgsAERQuPPQFVZWDFA1UYio8ifdGYQ21qgpuWcDjuP-6sPXM=s120-c-rp-mo-ba4-br100', 'local_guide': True, 'reviews': 65, 'photos': 161}",4.0,Nice vibrant place helping staff is another nice thing about this place,4 years ago,pune,TIBCO Software India Pvt. Ltd
"{'name': 'RN B', 'link': 'https://www.google.com/maps/contrib/108105664760397235028?hl=en-US', 'contributor_id': '108105664760397235028', 'thumbnail': 'https://lh3.googleusercontent.com/a-/ALV-UjVXB_4lqP_4jPDO1I45o2tOGJERzJchYt640TUnJ0T3-9jew2rpZA=s120-c-rp-mo-ba3-br100', 'local_guide': True, 'reviews': 28, 'photos': 0}",5.0,"One of the most enthusiastic workplaces with the tremendous work-life balance filled with excellent growth opportunities. Technology Transformation has enabled success in throughout tenure here! Competitive salary and appreciations for hard work!
Good day!",5 years ago,pune,TIBCO Software India Pvt. Ltd
"{'name': 'PRASHANT SHINDE', 'link': 'https://www.google.com/maps/contrib/102690975198923278918?hl=en-US', 'contributor_id': '102690975198923278918', 'thumbnail': 'https://lh3.googleusercontent.com/a/ACg8ocKRJgLlV1N2rRO53l0y3ZfHGVaoqcJmEKASuAUbtDlpgLBoQy5e=s120-c-rp-mo-ba4-br100', 'local_guide': True, 'reviews': 70, 'photos': 43}",4.0,"One of the best product based it organization.
Work life balance is what you can expect from tibco. As well have market standard competitive salary structure.",2 years ago,pune,TIBCO Software India Pvt. Ltd
"{'name': 'BHUSHAN CHAUDHARI', 'link': 'https://www.google.com/maps/contrib/114306576575432448703?hl=en-US', 'contributor_id': '114306576575432448703', 'thumbnail': 'https://lh3.googleusercontent.com/a-/ALV-UjVfKdA7f2UTRzzGPkWUoxatSSEotClXP9yeUY1N484OiRBt0cVi=s120-c-rp-mo-ba2-br100', 'local_guide': True, 'reviews': 7, 'photos': 16}",5.0,"Great Work place.
Very kind Staff and Officemates.
Nice environment.",2 years ago,pune,TIBCO Software India Pvt. Ltd
"{'name': 'Amit Choudhary', 'link': 'https://www.google.com/maps/contrib/112397999767198621852?hl=en-US', 'contributor_id': '112397999767198621852', 'thumbnail': 'https://lh3.googleusercontent.com/a-/ALV-UjVbsqkCU3mYc9CUo2Dhjeqwya7rZoPdp7JopyNUwyhiU1fMABqbbA=s120-c-rp-mo-ba3-br100', 'local_guide': True, 'reviews': 70, 'photos': 30}",4.0,Good product based company. Employee strength is moderate which makes it even better. Non technical staff is very helpful and friendly.,4 years ago,pune,TIBCO Software India Pvt. Ltd
"{'name': 'Ajay Deshmukh', 'link': 'https://www.google.com/maps/contrib/113869127183773671509?hl=en-US', 'contributor_id': '113869127183773671509', 'thumbnail': 'https://lh3.googleusercontent.com/a-/ALV-UjVNdlcW54dqTqqfkElja_S0ZinJPBNftc55d-qdUjJvS0BdnwxG=s120-c-rp-mo-ba3-br100', 'local_guide': True, 'reviews': 29, 'photos': 0}",5.0,Best and most supportive Facilities and security team. House keeping and overall management is superb.,2 years ago,pune,TIBCO Software India Pvt. Ltd
"{'name': 'shiva kumar gubba', 'link': 'https://www.google.com/maps/contrib/116310141567849862138?hl=en-US', 'contributor_id': '116310141567849862138', 'thumbnail': 'https://lh3.googleusercontent.com/a-/ALV-UjUJwfYoh0BKnrj_jQx3rTMiaQDUzNbXC_VTIGLL266YqhlL7_fb=s120-c-rp-mo-ba2-br100', 'local_guide': True, 'reviews': 12, 'photos': 3}",4.0,Nice place to work. One can satisfied with work life balance. Need some improvement in HR policies.,7 years ago,pune,TIBCO Software India Pvt. Ltd
"{'name': 'Sk Asif Akram', 'link': 'https://www.google.com/maps/contrib/100757900684513861191?hl=en-US', 'contributor_id': '100757900684513861191', 'thumbnail': 'https://lh3.googleusercontent.com/a-/ALV-UjWW65x9s-lr8b7MifF6LTKNDSaSjKF4fqlOXXG_wV_9-qyZQYI=s120-c-rp-mo-br100', 'reviews': 1, 'photos': 0}",5.0,"Mplussoft has been an incredible part of my journey. I joined as a  fresher two years ago, and it has been an amazing journey since then. This company gave me the opportunity to step into the tech world, grow, and succeed as a software developer. I’m truly grateful for everything I’ve learned and achieved here.",2 months ago,pune,MPLUSSOFT
"{'name': 'Mitali Aswale', 'link': 'https://www.google.com/maps/contrib/103066140354057967340?hl=en-US', 'contributor_id': '103066140354057967340', 'thumbnail': 'https://lh3.googleusercontent.com/a/ACg8ocIMSgBpPuTDXKn6H7rpozptP-XBZhZqy11VU-2sMrTmpMnC4A=s120-c-rp-mo-br100', 'reviews': 2, 'photos': 0}",5.0,"MPlusSoft is a standout software development company in Pune. Their team is highly skilled, delivering customized solutions that fit our business needs perfectly. If you're looking for reliable and innovative software development, MPlusSoft is the one to trust!",2 months ago,pune,MPLUSSOFT
"{'name': 'Shubham Kiloliya', 'link': 'https://www.google.com/maps/contrib/101509091760967156278?hl=en-US', 'contributor_id': '101509091760967156278', 'thumbnail': 'https://lh3.googleusercontent.com/a-/ALV-UjWVBTC90lj-J7Y_XjywZFdjgdQtjmsr1mnWv7oeTqqMXCdPKX5Ndw=s120-c-rp-mo-br100', 'local_guide': True, 'reviews': 2, 'photos': 0}",5.0,"""Working with such a talented and supportive team at MPlusSoft Technologies is a great experience. We collaborate seamlessly to deliver innovative solutions and consistently exceed client expectations.""",2 months ago,pune,MPLUSSOFT
"{'name': 'Omkar Shinde', 'link': 'https://www.google.com/maps/contrib/110441643122143418798?hl=en-US', 'contributor_id': '110441643122143418798', 'thumbnail': 'https://lh3.googleusercontent.com/a-/ALV-UjXdY0LsR8EeUrwbtbWxDwwSHpGNKihsq_f8mSEzGbbJ2jq87NtKEA=s120-c-rp-mo-br100', 'reviews': 2, 'photos': 0}",5.0,MPlusSoft offers outstanding SEO and custom software development services in Pune. Their team optimized our online presence and delivered a tailored software solution that streamlined our operations. Highly recommend their expertise for SEO and custom software needs!,2 months ago,pune,MPLUSSOFT
"{'name': 'Vidushi tak', 'link': 'https://www.google.com/maps/contrib/112481523186430897485?hl=en-US', 'contributor_id': '112481523186430897485', 'thumbnail': 'https://lh3.googleusercontent.com/a-/ALV-UjUzjxkNW0cYtx8PkOEbEYwejDC8uABTZa-VSBR5sA_ySyizuatU=s120-c-rp-mo-br100', 'local_guide': True, 'reviews': 5, 'photos': 0}",5.0,"Great App Development Service in Pune!MPlusSoft provided excellent app development services for our business. Their team in Pune is highly skilled, delivering a user-friendly, customized app that met all our needs. Highly recommend them for anyone looking for professional app development!",2 months ago,pune,MPLUSSOFT
"{'name': 'kiran salve', 'link': 'https://www.google.com/maps/contrib/114206856250633208846?hl=en-US', 'contributor_id': '114206856250633208846', 'thumbnail': 'https://lh3.googleusercontent.com/a-/ALV-UjWcYKx0y0RuTqG1BUakClKT1oaXid1KYwVvtv5MsFBdG0x6mbKe=s120-c-rp-mo-br100', 'local_guide': True, 'reviews': 3, 'photos': 0}",5.0,"Great Software development company. The team is very helpful and Co-operative.
Thank you Mplussoft Technologies",3 months ago,pune,MPLUSSOFT
"{'name': 'Guswah real estate', 'link': 'https://www.google.com/maps/contrib/113578059035385418652?hl=en-US', 'contributor_id': '113578059035385418652', 'thumbnail': 'https://lh3.googleusercontent.com/a/ACg8ocLkaUHJmwBXLtbQMhrASoaRJJYaUgZPRJcuo6s7LsF70rFMlg=s120-c-rp-mo-br100', 'local_guide': True, 'reviews': 1, 'photos': 1}",5.0,"If this seems like an excellent review, it's because this company earned it honestly unlike a few others I've dealt with, they delivered exactly as they promised. When unforeseen hurdles came along, they bent over backwards to accommodate us. They knows what they're doing. Don't hesitate to hire them",7 years ago,pune,MPLUSSOFT
"{'name': 'Kunal Bhingarkar', 'link': 'https://www.google.com/maps/contrib/103190653915124406321?hl=en-US', 'contributor_id': '103190653915124406321', 'thumbnail': 'https://lh3.googleusercontent.com/a-/ALV-UjWGtMTlwsmhitIJkbI1BUdyAZEVMeOCOZPeyVwmcct8UX82tdKS=s120-c-rp-mo-br100', 'local_guide': True, 'reviews': 3, 'photos': 0}",5.0,"MPLUSSOFT is an excellent place to work! There are plenty of growth prospects and a friendly atmosphere that promotes a healthy work-life balance. It is an exciting and creative place to work, equipped with a state-of-the-art technology stack.

It's been a pleasure working with the MPLUSSOFT Android team. They are quite talented, in addition to being very supportive. Being a part of such a fantastic group is an honour!",a year ago,pune,MPLUSSOFT
"{'name': 'balcony andyou', 'link': 'https://www.google.com/maps/contrib/101574172779153385631?hl=en-US', 'contributor_id': '101574172779153385631', 'thumbnail': 'https://lh3.googleusercontent.com/a-/ALV-UjU1jRDP8k-f55mmysztfAjR6BYjPvrrFzLA7FRMN3Oi_ZAJzZ8=s120-c-rp-mo-br100', 'reviews': 1, 'photos': 0}",5.0,GeekyWorks made our ecommerce website.. superbly executed and tech consultancy was brilliant. Very transparent in their dealing 👍👍.. A team passionate Geeks I would say. Thank you !!,4 years ago,pune,GeekyWorks IT Solutions Pvt. Ltd.
"{'name': 'Puneet Sharma', 'link': 'https://www.google.com/maps/contrib/105277274661598420239?hl=en-US', 'contributor_id': '105277274661598420239', 'thumbnail': 'https://lh3.googleusercontent.com/a-/ALV-UjWd8L3AuxrEBe5hkJC0CgdA3kqLNDhzkKgIFQ6XzqsfLjJpCaxy=s120-c-rp-mo-ba3-br100', 'local_guide': True, 'reviews': 70, 'photos': 37}",4.0,Got a very stable application made from Geeky Works. Totally satisfied with the product delivered by the geeks. Appreciate the professional attitude shown by them. Would love to continue with them in future also.,9 years ago,pune,GeekyWorks IT Solutions Pvt. Ltd.
"{'name': 'Lakeer Kukadia', 'link': 'https://www.google.com/maps/contrib/102920646332336789702?hl=en-US', 'contributor_id': '102920646332336789702', 'thumbnail': 'https://lh3.googleusercontent.com/a-/ALV-UjVF7GRyK6UoMDBkYs0j1ip8V-4Bi8Ka_H5URktwleurkxFwksEA=s120-c-rp-mo-br100', 'reviews': 2, 'photos': 0}",5.0,Geeky Works is a first-rate and high level design agency that made me confident and comfortable that they understood and could produce what we envisioned. Highly Recommended!!,9 years ago,pune,GeekyWorks IT Solutions Pvt. Ltd.
"{'name': 'Irfan Shaik', 'link': 'https://www.google.com/maps/contrib/111819551780352954203?hl=en-US', 'contributor_id': '111819551780352954203', 'thumbnail': 'https://lh3.googleusercontent.com/a/ACg8ocIHb8gIBbh660HRebiglBfVeEqwq3N9wALXAD_kLD-mssMBbQ=s120-c-rp-mo-br100', 'reviews': 2, 'photos': 0}",1.0,Very bad company don't join they give offer latter and onboarding date 1week back now they are saying proceed put on hold,a year ago,pune,GeekyWorks IT Solutions Pvt. Ltd.
"{'name': 'Edward Kashmere', 'link': 'https://www.google.com/maps/contrib/104305935605115443339?hl=en-US', 'contributor_id': '104305935605115443339', 'thumbnail': 'https://lh3.googleusercontent.com/a/ACg8ocKMAix31Qdt41EaQzp2BHEkC3ZhmctMkjfhJJBNzCCk0uO7GA=s120-c-rp-mo-br100', 'reviews': 2, 'photos': 0}",5.0,"As the president of AllianceMax I have the responsibility to use high-value, global firms like Geeky Works! Geeky Works - I give you my best recommendation!'",9 years ago,pune,GeekyWorks IT Solutions Pvt. Ltd.
"{'name': 'Ishan Talathi', 'link': 'https://www.google.com/maps/contrib/118003769991972435594?hl=en-US', 'contributor_id': '118003769991972435594', 'thumbnail': 'https://lh3.googleusercontent.com/a-/ALV-UjVcXIN5e13dxxtb_L2gN9k_hs0SE1O_vJi1Ih2DE8abZ6NAm_LzXw=s120-c-rp-mo-ba3-br100', 'local_guide': True, 'reviews': 19, 'photos': 11}",5.0,Geekyworks help a lot of our clients with web and mobile application development. Excellent work and fast service.,9 years ago,pune,GeekyWorks IT Solutions Pvt. Ltd.
"{'name': 'W J M', 'link': 'https://www.google.com/maps/contrib/108445439929270650239?hl=en-US', 'contributor_id': '108445439929270650239', 'thumbnail': 'https://lh3.googleusercontent.com/a-/ALV-UjW3tcnnyTiNvdNu4mkdkcyG5SlfCsoDsJ0y6ca8k91pD7wOcgk9=s120-c-rp-mo-ba3-br100', 'local_guide': True, 'reviews': 39, 'photos': 6}",1.0,They've been clocked,4 months ago,pune,GeekyWorks IT Solutions Pvt. Ltd.
"{'name': 'A K', 'link': 'https://www.google.com/maps/contrib/110157226190926222591?hl=en-US', 'contributor_id': '110157226190926222591', 'thumbnail': 'https://lh3.googleusercontent.com/a-/ALV-UjVv33Pp1dtoKY1o6CroPcWYlF6jV2_xFgZQw46Znf17lLRsa0jE=s120-c-rp-mo-br100', 'reviews': 9, 'photos': 17}",3.0,Can we call directly to the company regarding job?,a year ago,pune,GeekyWorks IT Solutions Pvt. Ltd.
"{'name': 'rahul patil', 'link': 'https://www.google.com/maps/contrib/104714510636335401626?hl=en-US', 'contributor_id': '104714510636335401626', 'thumbnail': 'https://lh3.googleusercontent.com/a-/ALV-UjU09JfOgsmMqf0br84sX6R9dR93Hgylk8HLmVq9kE10P43CgTPZ=s120-c-rp-mo-br100', 'reviews': 12, 'photos': 7}",1.0,"I have 2 years of experience as a dot-net developer, and I gave an interview in Cybage and cleared all the technical rounds, but at the HR round, they said your profile criteria are not fit for the job. Please be professional while committing anything to the candidate.",a year ago,pune,Cybage Software
"{'name': 'Ravindra Vangipuram', 'link': 'https://www.google.com/maps/contrib/101253769791688630516?hl=en-US', 'contributor_id': '101253769791688630516', 'thumbnail': 'https://lh3.googleusercontent.com/a-/ALV-UjWKEVyawmdAiuPmUDCSFsZPA-9fmsQ-2-SpqNfyBTR26pkEzyQJfQ=s120-c-rp-mo-ba6-br100', 'local_guide': True, 'reviews': 1747, 'photos': 1565}",4.0,Second branch of Cybage Office in the city. Looks excellent during night. Great work culture.,5 years ago,pune,Cybage Software
"{'name': 'Deepak Y', 'link': 'https://www.google.com/maps/contrib/117544652077594718630?hl=en-US', 'contributor_id': '117544652077594718630', 'thumbnail': 'https://lh3.googleusercontent.com/a-/ALV-UjWx1JvbJ0dtGD5rCDoBbs-5tKVwJxx0qn1J2C9iHebOS43x4MIa=s120-c-rp-mo-ba6-br100', 'local_guide': True, 'reviews': 360, 'photos': 2306}",4.0,"It's a big IT company.  perfect sport to learn lot of this in your career.  Socially,  their management staff from Entrance to HR is all good and decent.
It's like they have their own eco-system.
Wish it had more relaxing working hours :)",8 years ago,pune,Cybage Software
"{'name': 'Mahesh Mane', 'link': 'https://www.google.com/maps/contrib/108306875841447999815?hl=en-US', 'contributor_id': '108306875841447999815', 'thumbnail': 'https://lh3.googleusercontent.com/a/ACg8ocIUznct_9uum03K58WBGQhXcbSztlcI0IViCwhzk3c_Jlakbw=s120-c-rp-mo-br100', 'reviews': 1, 'photos': 0}",5.0,"Good place to work. HR department is conducting many activities to charge employee continuously. People are helpful. Good environment. cafeteria, garden etc.",2 years ago,pune,Cybage Software
"{'name': 'Optimus Prime', 'link': 'https://www.google.com/maps/contrib/115519104756775410397?hl=en-US', 'contributor_id': '115519104756775410397', 'thumbnail': 'https://lh3.googleusercontent.com/a-/ALV-UjV1PXJXijYuqOHozzI5frZGoCEuQ-PnocXsTV3ft0lHSVfqQMwF=s120-c-rp-mo-br100', 'local_guide': True, 'reviews': 12, 'photos': 2}",1.0,"1. During Covid19 pandemic, they tried their best to make people to work from office, allowed WFH after government announced lockdown.
2. No employees except higher level managers (not even technical architects) are allowed for work from home.
3. Current time (March 2021) they have come up with a new policy -- if you are coming to office at start of month then you'll have to come to office for whole month, even if you have allowed to work from home and you come to the office say on March 2 then you'll have to continue coming to office for whole March. They are very aggressive on asking people to work from office and not home.
4. If you are on bench (people end up on being on bench due to various reasons like end of the project or new joiner in the organization)
then you have to come to the office and be there for 8 hrs, there are several trainings happen but most of them are conducted online which you can attend from home as well.
5. If you are on bench, then you'll have to buy Udemy courses by spending your own money, company will reimburse it whenever you complete the course.

Why I am emphasizing on WFH related issues?
Answer -- This just another IT company, when most of the people especially bachelors has left their rented Flats and moved to their hometown, this company is asking people to come to the office when the whole industry is okay with providing work from and if you don't come to office then you'll end up getting Zero rupee in salary, it becomes LWP -- (leave without pay).

I had offer to join them, but I am so lucky and happy to join another much lower in reputation (as per Cybage) company.",4 years ago,pune,Cybage Software
"{'name': 'Prajakta Reke', 'link': 'https://www.google.com/maps/contrib/108647037466685779781?hl=en-US', 'contributor_id': '108647037466685779781', 'thumbnail': 'https://lh3.googleusercontent.com/a/ACg8ocL1RHYKWjUS-C_q-TW6oHCT53uyTgDTg4Nf09hLAQiMLXzIZik=s120-c-rp-mo-br100', 'reviews': 4, 'photos': 1}",5.0,Great place to work. High level of Job security. work culture is very good. supportive peoples. Everything is good..,2 years ago,pune,Cybage Software
"{'name': 'Kiran Chavan', 'link': 'https://www.google.com/maps/contrib/115635660053783974864?hl=en-US', 'contributor_id': '115635660053783974864', 'thumbnail': 'https://lh3.googleusercontent.com/a-/ALV-UjX4qEgxqMAKX8uXhQWD4a83DK7NSbqPQEJd2CUhJGwpaEACV1mo=s120-c-rp-mo-ba3-br100', 'local_guide': True, 'reviews': 41, 'photos': 25}",4.0,"Organization is good for everyone, good management, employee oriented, environment, good learning experience in organization. CEO's good vision , direction running this organization on right path and direction. Friendly environment makes here more comfortable. Including to employee in festival season.",5 years ago,pune,Cybage Software
"{'name': 'Ravi Singh', 'link': 'https://www.google.com/maps/contrib/117584438106553530552?hl=en-US', 'contributor_id': '117584438106553530552', 'thumbnail': 'https://lh3.googleusercontent.com/a-/ALV-UjVUx3tkdBJVPq-5eZ__R1GbhE2TLjV16wC31BzfTtPJhbRk97YT=s120-c-rp-mo-ba4-br100', 'local_guide': True, 'reviews': 76, 'photos': 120}",5.0,"Cybage initially started growing from this location and after they grew enough headcounts, they shifted their opration to another building just in near vicinity. Now this building accomodates their Support Services team. Its one of the most peaceful place to work. Most of all, I love the seating arrangements or the cubicals they have. Such an amazing work ethics and culture they have. I am enjoying my time here and would recommended others to look for an opportunity here to work.",5 years ago,pune,Cybage Software
"{'name': 'Ajay', 'link': 'https://www.google.com/maps/contrib/104586764120944401100?hl=en-US', 'contributor_id': '104586764120944401100', 'thumbnail': 'https://lh3.googleusercontent.com/a-/ALV-UjV7VExIw7KiCCBe_nW5l5IQ5DOYA3gxYVwtWltAnnHdoGQTI-VFZA=s120-c-rp-mo-ba4-br100', 'local_guide': True, 'reviews': 92, 'photos': 348}",5.0,It's one of the best and blue chip companies.. Employee centric organization and policies.. Parking facility is available.. Pantry will always have snacks and fruits for anyone..,3 years ago,pune,BMC Software India
"{'name': 'Paresh Chaudhari', 'link': 'https://www.google.com/maps/contrib/103953520754918241359?hl=en-US', 'contributor_id': '103953520754918241359', 'thumbnail': 'https://lh3.googleusercontent.com/a-/ALV-UjWC8AiiITqmKFq9Kf31BpTLXIlM0w6QwC4n6zXDjQwio6PrAyXB=s120-c-rp-mo-ba4-br100', 'local_guide': True, 'reviews': 55, 'photos': 29}",5.0,Awesome place to work. Great team building & learning environment. Managers are very very good and motivational. Well experienced and knowledgeable people at work. Oh yes! Free food all day long.,2 years ago,pune,BMC Software India
"{'name': 'Saddam Sayyad', 'link': 'https://www.google.com/maps/contrib/108573242413112104581?hl=en-US', 'contributor_id': '108573242413112104581', 'thumbnail': 'https://lh3.googleusercontent.com/a-/ALV-UjWB3dnI6aYKdW5Igf7JcjzbrymtRrNu2rmJrcEE4f8U9hVRls_P=s120-c-rp-mo-br100', 'reviews': 5, 'photos': 0}",5.0,"Wonderful organization with great colleagues which are exceptionally talented. Company culture is employee centric. Future is bright with BMC, undoubtedly.",11 months ago,pune,BMC Software India
"{'name': 'Sandip Marathe', 'link': 'https://www.google.com/maps/contrib/103629744027026378557?hl=en-US', 'contributor_id': '103629744027026378557', 'thumbnail': 'https://lh3.googleusercontent.com/a-/ALV-UjXEoy_-1C_v5hFes0R0bWqSsExz300ygr6dktZU5GkRod9U9cnr=s120-c-rp-mo-ba4-br100', 'local_guide': True, 'reviews': 69, 'photos': 30}",1.0,"Pathetic place to be honest. No work life balance, and a very toxic work environment adds to your frustration. They say the have the best employee benifits programs but they are in a delusion. My employer prior to bmc had best benifits and after bmc also has best benifits because they provide peace of mind and sense of job security along with all other benifits. I was part of a team who day in and day out interacts with other employees from the org, and there is one thing I can say for sure - other employees from foreign countries also seemed to be always stressed out and that speaks volumes about the kind of toxic culture this organisation displays.
BMC is not willing to accept their defeat infront of a giant like ServiceNow.
BMC's flagship product ""remedy"" now they call it BMC Helix is old and slow and what not, it lacks besic features but still this company somehow thinks they are the market leaders. And the same arrogance can be seen in the higher management. They also employ a lot of ""Contractors"" who are then treated like second class citizens.
Do your own research and really think through before joining this place. 🙏🙏",a year ago,pune,BMC Software India
"{'name': 'Vishal Anand', 'link': 'https://www.google.com/maps/contrib/108541891181276686281?hl=en-US', 'contributor_id': '108541891181276686281', 'thumbnail': 'https://lh3.googleusercontent.com/a-/ALV-UjU6KJzRVai02A7HgydqZQSwphkr1Yvw8JVW8MDR3nhGDI4itApp=s120-c-rp-mo-ba5-br100', 'local_guide': True, 'reviews': 148, 'photos': 12}",5.0,Software company which helps businesses to become an Autonomous Digital Enterprises,5 months ago,pune,BMC Software India
"{'name': 'Swanand Kulkarni', 'link': 'https://www.google.com/maps/contrib/114634730546176645185?hl=en-US', 'contributor_id': '114634730546176645185', 'thumbnail': 'https://lh3.googleusercontent.com/a-/ALV-UjWh_vgS5ycZ3T5fhrZh1yqxBWKAr3f2Hx8DIAQ1TrFGnMsEJyg2=s120-c-rp-mo-br100', 'local_guide': True, 'reviews': 2, 'photos': 2}",5.0,"Software product based company. One of the reputed MNC. Nice, pleasant location to work. Supportive environment.",5 years ago,pune,BMC Software India
"{'name': 'RAHUL BANERJEE', 'link': 'https://www.google.com/maps/contrib/115735514867469632425?hl=en-US', 'contributor_id': '115735514867469632425', 'thumbnail': 'https://lh3.googleusercontent.com/a-/ALV-UjWzW3HvQFN-luPZlUnyE-vKEas0hTfiuJiwGP9DNRsdvmZvbmQ=s120-c-rp-mo-ba3-br100', 'local_guide': True, 'reviews': 47, 'photos': 5}",4.0,"Had a good experience giving the interview.The environment was very nice with good interior. The people behavior was also good. Though I am a bit upset for not getting a proper closer from them if they selected me or not and every time I enquire they reply with they have yet to decide which don't make any sense to me.

Rest the office is a place where any one would love to work.",5 years ago,pune,BMC Software India
"{'name': 'Shubham Goyal', 'link': 'https://www.google.com/maps/contrib/103699914077281774355?hl=en-US', 'contributor_id': '103699914077281774355', 'thumbnail': 'https://lh3.googleusercontent.com/a-/ALV-UjVxm6BxojTFPaS2ezkrFfL0ove94aPShahVsqpVenXWHcay5aU=s120-c-rp-mo-ba2-br100', 'local_guide': True, 'reviews': 9, 'photos': 1}",5.0,Nice place to work,3 weeks ago,pune,BMC Software India
