username,rating,text,date,ct,company
"{'name': 'Mayur Gaware', 'link': 'https://www.google.com/maps/contrib/115095088687811320630?hl=en-US', 'contributor_id': '115095088687811320630', 'thumbnail': 'https://lh3.googleusercontent.com/a-/ALV-UjU3Q6AqXRh8FK-v81gZtyi8G3t40isocpH3l0OxTV6j-S7b1IE4=s120-c-rp-mo-br100', 'reviews': 5, 'photos': 0}",5.0,"Best software development practices and quality.
I gave a testing interview here, and I am amazed by the well documented procedure and testing templates that they follow.
QMS at its best!
Thank you ScroBits for the opportunity.",2 years ago,pune,ScroBits Technologies
"{'name': 'Prasad Desai', 'link': 'https://www.google.com/maps/contrib/114200645998779838806?hl=en-US', 'contributor_id': '114200645998779838806', 'thumbnail': 'https://lh3.googleusercontent.com/a-/ALV-UjWvh7nG7Vb-SGXpRJHiHUUEYMg-rDJ7Mwlf4yUMeuI-UZ5Csk5wNQ=s120-c-rp-mo-br100', 'local_guide': True, 'reviews': 7, 'photos': 2}",5.0,A perfect and elegant company which can provide the business solutions up to the mark. Website is so convincing that any of the client can trust on the company easily.,4 years ago,pune,ScroBits Technologies
"{'name': 'anagha shete', 'link': 'https://www.google.com/maps/contrib/104498322423855580723?hl=en-US', 'contributor_id': '104498322423855580723', 'thumbnail': 'https://lh3.googleusercontent.com/a-/ALV-UjVI3YXZEQk4EeGYu4dfSuctJlcnLTO3YeiVsJb3w93IdHcnQG0B7Q=s120-c-rp-mo-ba2-br100', 'local_guide': True, 'reviews': 16, 'photos': 0}",1.0,"I appeared for an interview at VM3 Tech Solutions last year and had a disappointing experience. Despite following up multiple times with HR (Ms. Anushka), I never received any clear update on whether I was selected or not. My repeated attempts to contact the HR department were ignored, which reflects poorly on their professionalism and communication standards. This lack of transparency and responsiveness was highly frustrating and unprofessional.",2 months ago,pune,VM3 Tech Solutions LLP
"{'name': 'Santhosh Srirambhatla', 'link': 'https://www.google.com/maps/contrib/112290174281878909190?hl=en-US', 'contributor_id': '112290174281878909190', 'thumbnail': 'https://lh3.googleusercontent.com/a/ACg8ocKYkYeB_RWHJ1JtB2zRk797j9v7uQ7gh9xKG9HkZDB8LVb3XQ=s120-c-rp-mo-br100', 'local_guide': True, 'reviews': 7, 'photos': 0}",5.0,"VM3 Tech provided us with outstanding services to create the web-site, business profile deck, branding and content for the web-site. I was looking for a starter web-site but what they delivered just exceeded all of my expectations. I would recommend VM3 Tech to any company.",5 months ago,pune,VM3 Tech Solutions LLP
"{'name': 'Arya', 'link': 'https://www.google.com/maps/contrib/111498511307153012805?hl=en-US', 'contributor_id': '111498511307153012805', 'thumbnail': 'https://lh3.googleusercontent.com/a-/ALV-UjXYsbHaLIhmo8JqWs0u5lXLaggLZgjXusbSJ0OHOGyYKuGA1oY0=s120-c-rp-mo-br100', 'reviews': 3, 'photos': 0}",5.0,"The live classes, insights into business strategies in digital marketing, and interactions with Vasanti Ma'am have been incredibly helpful and enriching.",3 months ago,pune,VM3 Tech Solutions LLP
"{'name': 'Prashant Singh', 'link': 'https://www.google.com/maps/contrib/108125538214695335120?hl=en-US', 'contributor_id': '108125538214695335120', 'thumbnail': 'https://lh3.googleusercontent.com/a/ACg8ocKN1lWJYYFkXKKFo1ReBnzrjXTb6_9n4x-fB1-COiHcFvTCwQ=s120-c-rp-mo-br100', 'reviews': 1, 'photos': 0}",4.0,"The session on advertising was informative, where Vasanti Ma'am explained the different platforms used for advertisements. She went into detail about the functions of each platform and how to use them effectively.",3 months ago,pune,VM3 Tech Solutions LLP
"{'name': 'Amit Sawant', 'link': 'https://www.google.com/maps/contrib/106268788892171982446?hl=en-US', 'contributor_id': '106268788892171982446', 'thumbnail': 'https://lh3.googleusercontent.com/a/ACg8ocKlQGDM-PGNKc_PZJSpzxFJdK_M4ncvp-CypLcGQKHnk9VlWA=s120-c-rp-mo-br100', 'reviews': 4, 'photos': 0}",5.0,VM3 Tech Solutions LLP is a very positive team with best creative ideas and they do assist a lot in sales leads and importantly very good feedbacks with a professional a touch. Rgds. /Amit ( Director - Multilogistics),4 months ago,pune,VM3 Tech Solutions LLP
"{'name': 'Sameer Alam', 'link': 'https://www.google.com/maps/contrib/105147004483353056506?hl=en-US', 'contributor_id': '105147004483353056506', 'thumbnail': 'https://lh3.googleusercontent.com/a/ACg8ocKQfgb4EKG1g0XA-N5v1-oIr-vWdIQmAlIrgwqD2OwYvonVlg=s120-c-rp-mo-br100', 'local_guide': True, 'reviews': 1, 'photos': 0}",5.0,"The live classes, combined with cutting-edge strategies in digital marketing and the engaging sessions with Vasanti Ma'am, have been transformative and inspiring.",3 months ago,pune,VM3 Tech Solutions LLP
"{'name': 'Himanshu Bhide', 'link': 'https://www.google.com/maps/contrib/104206030967986805284?hl=en-US', 'contributor_id': '104206030967986805284', 'thumbnail': 'https://lh3.googleusercontent.com/a/ACg8ocKz0jfxD0WvqnhR17pCsdlBIeCWUVoiSiWnjF29P-xcuCJ4cw=s120-c-rp-mo-br100', 'reviews': 4, 'photos': 0}",5.0,"🌟 Highly Recommended: Exceptional Service from VM3 Tech Solutions LLP 🌟

I recently had the pleasure of working with VM3 Tech Solutions LLP to create a website for my insurance business, and I couldn’t be more satisfied with the results. The support from the entire team was outstanding.

A special thanks to Mrs. Vasanti Mulajkar, who truly understood my requirements and provided the most appropriate solutions. Her attention to detail and commitment to delivering a high-quality website that meets my business needs were evident throughout the process.

The professionalism, responsiveness, and expertise demonstrated by VM3 Tech Solutions LLP made the entire experience seamless and enjoyable. If you're looking for a team that listens to your needs and delivers beyond expectations, I highly recommend VM3 Tech Solutions LLP.

Thank you, VM3, for a job well done!",7 months ago,pune,VM3 Tech Solutions LLP
"{'name': 'Nimisha Khakurdikar', 'link': 'https://www.google.com/maps/contrib/111699331687927316240?hl=en-US', 'contributor_id': '111699331687927316240', 'thumbnail': 'https://lh3.googleusercontent.com/a-/ALV-UjV1N-NxZkSguq1h3dz-R3jwIwCY-3uzSKk1mYGPBeV9bbnm669K=s120-c-rp-mo-br100', 'reviews': 3, 'photos': 6}",5.0,I got a logo desiged for my Firm. Most  Wonderful experience I must say. Quick service with innovative ideas that matches your demands. Well experienced team members. Highly recommended.,9 months ago,pune,VM3 Tech Solutions LLP
"{'name': 'Manager Westros CHS', 'link': 'https://www.google.com/maps/contrib/114754685657167321203?hl=en-US', 'contributor_id': '114754685657167321203', 'thumbnail': 'https://lh3.googleusercontent.com/a/ACg8ocJ4co9r2PvxHyEKI42t_44BZG2GXHO0X3hu3uh3YYPUQlZNfg=s120-c-rp-mo-br100', 'local_guide': True, 'reviews': 1, 'photos': 0}",5.0,"I recently had the pleasure of working with Ascent Software Solutions, and I must say, their professionalism truly stands out. The team's personalized recommendations made a significant difference in my experience. Their commitment to effective service is evident in every interaction, showcasing a dedication to quality that is both refreshing and wonderful. I highly recommend their services to anyone in need.",a week ago,pune,Ascent Software Solutions | Since 2010
"{'name': 'Sumit Singh', 'link': 'https://www.google.com/maps/contrib/103087278880561950037?hl=en-US', 'contributor_id': '103087278880561950037', 'thumbnail': 'https://lh3.googleusercontent.com/a-/ALV-UjVu7KZ9BB29Zc68qUqprAtZondRmiQVZ9xqqwvRtDF_HOlcUpr_=s120-c-rp-mo-ba4-br100', 'local_guide': True, 'reviews': 141, 'photos': 149}",5.0,"Ascent Software Solutions exceeded my expectations with their remarkable customer service. The team's personalized recommendations made a significant difference, ensuring my satisfaction with their effective solutions. Highly recommend their expertise.",a month ago,pune,Ascent Software Solutions | Since 2010
"{'name': 'Swapnil Joshi', 'link': 'https://www.google.com/maps/contrib/112152663471457178447?hl=en-US', 'contributor_id': '112152663471457178447', 'thumbnail': 'https://lh3.googleusercontent.com/a-/ALV-UjXqTuco-078jGzw5lSXRugmUNxCoprtjdNklVzOfS3bbHU74TeQ=s120-c-rp-mo-br100', 'reviews': 1, 'photos': 0}",5.0,"Ascent Software Solutions truly impressed me with their exceptional customer service. Their team is dedicated and always ready to assist, making the entire process smooth and enjoyable. I highly recommend their project management services for their effectiveness and great value. It’s refreshing to see such professionalism and care in action.",a month ago,pune,Ascent Software Solutions | Since 2010
"{'name': 'ICR PAINTS', 'link': 'https://www.google.com/maps/contrib/107881851337198964332?hl=en-US', 'contributor_id': '107881851337198964332', 'thumbnail': 'https://lh3.googleusercontent.com/a/ACg8ocI2zMLssBdFu26PN_xxNDmnkFXvbCCyA1-Vv22zOHnohwi0Fg=s120-c-rp-mo-br100', 'local_guide': True, 'reviews': 1, 'photos': 0}",5.0,Ascent Software Solutions provided an exceptional experience with their quick service and personalized recommendations. The professionalism and effectiveness of their team are commendable. I highly recommend this company for anyone seeking satisfying and reliable solutions tailored to their needs.,4 days ago,pune,Ascent Software Solutions | Since 2010
"{'name': 'Santosh Ban', 'link': 'https://www.google.com/maps/contrib/116419674355424749449?hl=en-US', 'contributor_id': '116419674355424749449', 'thumbnail': 'https://lh3.googleusercontent.com/a-/ALV-UjX5Y5j3k4LL4Ra5gkE43RGREOrbCbtNLrpKJCB3X3VWIWT_-S4=s120-c-rp-mo-br100', 'local_guide': True, 'reviews': 7, 'photos': 1}",5.0,"I recently had the pleasure of working with Ascent Software Solutions and was thoroughly impressed by their exceptional customer service. The team provided personalized recommendations that truly catered to my needs. The effectiveness of their solutions exceeded my expectations, making for a great experience overall. I highly recommend them for anyone seeking quality and professionalism in their service.",a month ago,pune,Ascent Software Solutions | Since 2010
"{'name': 'Vishal Kale', 'link': 'https://www.google.com/maps/contrib/116691994495383881031?hl=en-US', 'contributor_id': '116691994495383881031', 'thumbnail': 'https://lh3.googleusercontent.com/a-/ALV-UjVIMDP3QlGFirHv6FBlo3Ql4WWEEo-JnN_jfSoRseYsWKr6X1M3=s120-c-rp-mo-br100', 'local_guide': True, 'reviews': 1, 'photos': 1}",5.0,"Ascent Software Solutions truly impressed me with their fantastic customer service. The team's expertise and effectiveness in addressing my needs were remarkable. Their personalized recommendations made a real difference, showcasing their commitment to quality and professionalism. Highly recommended.",a month ago,pune,Ascent Software Solutions | Since 2010
"{'name': 'Vijaya Sutar', 'link': 'https://www.google.com/maps/contrib/106540619037117689567?hl=en-US', 'contributor_id': '106540619037117689567', 'thumbnail': 'https://lh3.googleusercontent.com/a/ACg8ocLccGGgKguBR2eno1N_EJRI3z4h6W3ZhXAicqZJ7TlsG6mo1w=s120-c-rp-mo-br100', 'local_guide': True, 'reviews': 4, 'photos': 1}",5.0,"I recently engaged with Ascent Software Solutions for their project management services, and I was thoroughly impressed. The team demonstrated remarkable efficiency and professionalism throughout the process. Their attention to detail and personalized recommendations truly set them apart. I wholeheartedly recommend their services for anyone seeking quality customer care.",a month ago,pune,Ascent Software Solutions | Since 2010
"{'name': 'Sachin Swami', 'link': 'https://www.google.com/maps/contrib/107925817248399276104?hl=en-US', 'contributor_id': '107925817248399276104', 'thumbnail': 'https://lh3.googleusercontent.com/a-/ALV-UjUbRkrji0nE7xyry8wfwrAhh97MPFnTtTvw8DFjGTA5dmG1ar4=s120-c-rp-mo-ba2-br100', 'local_guide': True, 'reviews': 32, 'photos': 8}",5.0,"I recently utilized the services of Ascent Software Solutions and was thoroughly impressed by the effectiveness of their team. Their expertise in delivering tailored solutions truly sets them apart. The personalized recommendations I received significantly enhanced my experience, showcasing their commitment to quality and professionalism. I highly recommend their services for anyone seeking valuable support.",a month ago,pune,Ascent Software Solutions | Since 2010
"{'name': 'Shashank', 'link': 'https://www.google.com/maps/contrib/110414401973596011104?hl=en-US', 'contributor_id': '110414401973596011104', 'thumbnail': 'https://lh3.googleusercontent.com/a-/ALV-UjVRFIcmktIe8nfCuXxhEj_N4518GivuLAFPqZynVSkdQGiLufw=s120-c-rp-mo-ba4-br100', 'local_guide': True, 'reviews': 56, 'photos': 34}",5.0,"I have been working in Redhat for the last 3+ years and I can say, This is the best company which I have found in my career, Best Open-source, Cultural, Got a chance to interact with a great mind people here.",a week ago,pune,Red Hat India Private Limited
"{'name': 'Tanmoy Chakraborty', 'link': 'https://www.google.com/maps/contrib/108017332253857784137?hl=en-US', 'contributor_id': '108017332253857784137', 'thumbnail': 'https://lh3.googleusercontent.com/a-/ALV-UjVlJnMVlT-h-VCJLUJcyfZXW_g4Ro-5NGQ7i0qZrVRH4vZgxN3HlQ=s120-c-rp-mo-ba5-br100', 'local_guide': True, 'reviews': 215, 'photos': 386}",5.0,An awesome place to work for. I have worked there for sometime 1.5 years. The place is awesome the redhat building tower 10 view is awesome. Also the magarpatta city is one of the great place to be.,5 years ago,pune,Red Hat India Private Limited
"{'name': 'Satyam Jaiswal', 'link': 'https://www.google.com/maps/contrib/100973707054342048655?hl=en-US', 'contributor_id': '100973707054342048655', 'thumbnail': 'https://lh3.googleusercontent.com/a-/ALV-UjXW6Ulh_nXY16DHgga60pEVF3yqV0bjWIWeW0DLLFOwiLQptCcLXg=s120-c-rp-mo-ba4-br100', 'local_guide': True, 'reviews': 39, 'photos': 157}",4.0,"The infrastructure of this place is very attractive, and the management and security is very good. You have to show proper ID like PAN card to get entry. The offices inside are named based on historical places like, Sindhudurg, LauhGadh etc.",6 years ago,pune,Red Hat India Private Limited
"{'name': 'Karan Sandha', 'link': 'https://www.google.com/maps/contrib/105212848642191350292?hl=en-US', 'contributor_id': '105212848642191350292', 'thumbnail': 'https://lh3.googleusercontent.com/a-/ALV-UjVq5aFlQhkLcDNU7GkT4pytLtH9V7bafSb7LEvjfZK7SaPe1dJO=s120-c-rp-mo-ba4-br100', 'local_guide': True, 'reviews': 61, 'photos': 668}",5.0,Though the attached photos are from the tech park. The working environment in Redhat is awesome.,5 years ago,pune,Red Hat India Private Limited
"{'name': 'Gaurav Kulkarni', 'link': 'https://www.google.com/maps/contrib/108566139035380313803?hl=en-US', 'contributor_id': '108566139035380313803', 'thumbnail': 'https://lh3.googleusercontent.com/a-/ALV-UjXNDJAhU1mzBIUxUjy_jUWdPIvxO6VxBI25kIAJO0gRWpiRopNzGA=s120-c-rp-mo-ba3-br100', 'local_guide': True, 'reviews': 32, 'photos': 88}",5.0,"Best places to work, good infrastructure, great office and friendly staff.",2 years ago,pune,Red Hat India Private Limited
"{'name': 'Azizur Rahman', 'link': 'https://www.google.com/maps/contrib/103397037039915458593?hl=en-US', 'contributor_id': '103397037039915458593', 'thumbnail': 'https://lh3.googleusercontent.com/a/ACg8ocK2TEPqhtoxEvw98Jca1DDEWoa1GiZb1TddJQ4D197H6wNsRy8=s120-c-rp-mo-br100', 'local_guide': True, 'reviews': 2, 'photos': 0}",1.0,I am Azizurrahman from Delhi. My friend has given an interview online and he is selected. But the company is charging 1.12 lpa for security purposes. Is this right please tell me because I don't know about the company.,8 months ago,pune,Red Hat India Private Limited
"{'name': 'Niladri Saha', 'link': 'https://www.google.com/maps/contrib/113712728350606394292?hl=en-US', 'contributor_id': '113712728350606394292', 'thumbnail': 'https://lh3.googleusercontent.com/a/ACg8ocKEWguMgKjbw-9EnKrXbAwnbtcpnkDd4_wnP9XwvG40EFYyRuQ=s120-c-rp-mo-ba4-br100', 'local_guide': True, 'reviews': 203, 'photos': 5}",3.0,"Great company to work with. Everyone's dream to work with them but they should streamline the interview process and try to give an opportunity to deserving candidates to appear in interview. However, they rarely do that.",a year ago,pune,Red Hat India Private Limited
"{'name': 'Pradeep Pal', 'link': 'https://www.google.com/maps/contrib/106068009404161417734?hl=en-US', 'contributor_id': '106068009404161417734', 'thumbnail': 'https://lh3.googleusercontent.com/a-/ALV-UjVeYUC4X15flkNLXPIkreWEarh1rbDY2Oftyo8RY40cyF_24z0c=s120-c-rp-mo-ba5-br100', 'local_guide': True, 'reviews': 228, 'photos': 1428}",5.0,It a wonderful office and staff too...,4 years ago,pune,Red Hat India Private Limited
"{'name': 'Dhananjay Kumar', 'link': 'https://www.google.com/maps/contrib/118189983051182795802?hl=en-US', 'contributor_id': '118189983051182795802', 'thumbnail': 'https://lh3.googleusercontent.com/a-/ALV-UjUtFPEmVytuW5GJR8qf-uDDkCtRavyKxa3ZnhRgdcy2LQh4doPG=s120-c-rp-mo-br100', 'local_guide': True, 'reviews': 1, 'photos': 0}",5.0,"Great place to work, friendly environment. Nice and helping people are there. Very good opportunity for professional improvement, you own a major responsibility, no micro management. Understanding team, proper guidance. Good work life balance. Best place to grow your skills and talent under very enthusiastic and influential leaders and seniors.
I learn many more things at here like how to grow your professional skills as well as how to improve yourself. It gives many more opportunity to me.",5 years ago,pune,Thinkitive Technologies Private Limited
"{'name': 'sonali kemkar', 'link': 'https://www.google.com/maps/contrib/110846024055672243821?hl=en-US', 'contributor_id': '110846024055672243821', 'thumbnail': 'https://lh3.googleusercontent.com/a/ACg8ocItic3w6zPWa5hW6Jq9wGQU6O0LuTB6VEpuyPtucz2EkfIvUg=s120-c-rp-mo-br100', 'local_guide': True, 'reviews': 7, 'photos': 8}",5.0,"It was a great honour for me to start my career here. I joined as fresher, and now it's almost 1year 6 months, I got opportunities to explore myself. Also I m learning new technologies. So it's great place to explore as we as learn. One of the  important part is,the Managers are very supportive. I m enjoying my journey here......",5 years ago,pune,Thinkitive Technologies Private Limited
"{'name': 'Dushyant', 'link': 'https://www.google.com/maps/contrib/101272137587263858312?hl=en-US', 'contributor_id': '101272137587263858312', 'thumbnail': 'https://lh3.googleusercontent.com/a/ACg8ocInhdpDkh7xINCySNIEjdXE4Bqv9GJBnUR2dJ3Cv2HOGOhGFQc=s120-c-rp-mo-ba5-br100', 'local_guide': True, 'reviews': 149, 'photos': 100}",4.0,"I worked for the DotNet department for two years. There is a TL, She is really good mentor, very supportive and guide you a lot to grow in your career.

Pros
1. Good to explore your skills, technologies and domain knowledge.
2. Team Lead of DotNet department is really too good, strong and motivated and good human.
3. Flexible timing and friendly environment

Note:
Overall its good place If you are planning to join this company you can join.",2 years ago,pune,Thinkitive Technologies Private Limited
"{'name': 'Tushar Saner', 'link': 'https://www.google.com/maps/contrib/104321841770916726322?hl=en-US', 'contributor_id': '104321841770916726322', 'thumbnail': 'https://lh3.googleusercontent.com/a/ACg8ocKdV5bMS4hOq8QXXsmkPb_PKWpy5qj0sCQHfJFHcoTKStDQrQ=s120-c-rp-mo-br100', 'reviews': 1, 'photos': 0}",5.0,"Great place to work, friendly environment. Nice and helping people
Best place to grow your skills and talent under very enthusiastic and influential leaders and seniors.
Worked on different domains like retail, education and health domain.
Great exposure to Automation, DevOps and multiple tools",5 years ago,pune,Thinkitive Technologies Private Limited
"{'name': 'Pradeep Shinde', 'link': 'https://www.google.com/maps/contrib/108765614507021176095?hl=en-US', 'contributor_id': '108765614507021176095', 'thumbnail': 'https://lh3.googleusercontent.com/a-/ALV-UjUFuAHGBBNPsfjyLEbfX6_hcw0HISNTV6rrPQ7MqajzsE7u7fsQ=s120-c-rp-mo-ba3-br100', 'local_guide': True, 'reviews': 51, 'photos': 1}",4.0,"Good atmosphere ...
Staff is also polite...

I was there for aptitude (written test),my experience there was one of the best experience ...Proper seating arrangment,management was good enough...

PMT bus availability is poor, visit by private vehicle or
If not in hurry then can use
1. balewadi PMT upto balewadi fata then uber or ola
2.Baner PMT upto Baner Dmart then ola or uber",a year ago,pune,Thinkitive Technologies Private Limited
"{'name': 'Hrishikesh Andhale', 'link': 'https://www.google.com/maps/contrib/117904453734250031384?hl=en-US', 'contributor_id': '117904453734250031384', 'thumbnail': 'https://lh3.googleusercontent.com/a-/ALV-UjUfliXf-GsI4p0Q4AUTEFtAUKakoqOsFVdA1cNj0yx3KZ_x8rR1ew=s120-c-rp-mo-br100', 'local_guide': True, 'reviews': 4, 'photos': 0}",5.0,"Very Good organisation for learning things. So many projects are there, so u will get to learn all new technologies here. Working As web developer here.
Also the best part is very friendly environment and work life balance. Great scope for betterment of Ur life and career.",5 years ago,pune,Thinkitive Technologies Private Limited
"{'name': 'Neelesh Bhopali', 'link': 'https://www.google.com/maps/contrib/111230691119393882417?hl=en-US', 'contributor_id': '111230691119393882417', 'thumbnail': 'https://lh3.googleusercontent.com/a-/ALV-UjXRcS7_OY6rPaNoKtYzyIaerBTBDa0SCMVS8nBxPU262vHGbk8=s120-c-rp-mo-br100', 'local_guide': True, 'reviews': 6, 'photos': 1}",5.0,"Thinkitive is a phenomenal atmosphere to build your Development skills as a Developer and beyond. A dynamic startup environment still exists within a company that has been #1 in it's industry for Five years and counting. Ask questions, take advantage of the extensive trainings offered and learn everything about the products so you can speak in the simplest terms to the clients, and have fun too.",5 years ago,pune,Thinkitive Technologies Private Limited
"{'name': 'Shubham Badhan', 'link': 'https://www.google.com/maps/contrib/114432568700605035744?hl=en-US', 'contributor_id': '114432568700605035744', 'thumbnail': 'https://lh3.googleusercontent.com/a-/ALV-UjU6zV2LO-Bdrks8iZ9Iy_pCX18-X9xb9ZIbq8ZzVSUaoQQNf_df=s120-c-rp-mo-br100', 'reviews': 3, 'photos': 0}",4.0,"A typical day at work consist of analyzing and sourcing data on employee information and optimizing job descriptions for clients. I have gained expertise on multiple platforms such as Laravel, Angular, React, Python, ect... We have great leaders here and the management is very transparent. The culture is my favorite thing about Thinkitive. It is very diverse and family oriented. The most enjoyable part of the job is learning new things everyday by implementing change.",5 years ago,pune,Thinkitive Technologies Private Limited
