username,rating,text,date,ct,company
"{'name': 'Sanjay Pansare', 'link': 'https://www.google.com/maps/contrib/117204530380020175638?hl=en-US', 'contributor_id': '117204530380020175638', 'thumbnail': 'https://lh3.googleusercontent.com/a-/ALV-UjUAi4gSqzQf6yLUDD5uGZwvqg1YH5M-ndV8AUTk3eyOClXAfoQ=s120-c-rp-mo-br100', 'reviews': 1, 'photos': 0}",5.0,"Yashashree madam is very knowledgeable about tally. Whenever we raised any query, it has been solved by her. We don't have a single incidence where our query was not unsolved by her. We really appreciate her knowledge and polite behavior. Our sincere thanks to her & best wishes.",a month ago,pune,Prism IT Solutions Pvt. Ltd.
"{'name': 'Preeti Kumari', 'link': 'https://www.google.com/maps/contrib/116890832943424763050?hl=en-US', 'contributor_id': '116890832943424763050', 'thumbnail': 'https://lh3.googleusercontent.com/a-/ALV-UjWLsXug-mAleLgH5W43TY1EAxJdn_TuVY0KcfbHpdi8fCZl5v8=s120-c-rp-mo-br100', 'local_guide': True, 'reviews': 3, 'photos': 0}",5.0,"""I am thoroughly impressed with the support I received! The team was responsive, knowledgeable, and went above and beyond to resolve my issue quickly. They patiently answered all my questions and provided clear instructions that made it easy for me to understand. I felt genuinely valued as a customer, and it’s clear they are committed to delivering outstanding service.",4 months ago,pune,Prism IT Solutions Pvt. Ltd.
"{'name': 'Nandkishor Khapre', 'link': 'https://www.google.com/maps/contrib/104141850511025251767?hl=en-US', 'contributor_id': '104141850511025251767', 'thumbnail': 'https://lh3.googleusercontent.com/a/ACg8ocKCVRzwx9-pOJSDqL_W2WVrakWtYYfsJqNoZVxxdbdHDax46w=s120-c-rp-mo-br100', 'reviews': 1, 'photos': 0}",5.0,"Excellent support system.
Very quick resolution of any queries. We got excellent support from Yashshri Madam. Thank a lot for your kind support.",3 weeks ago,pune,Prism IT Solutions Pvt. Ltd.
"{'name': 'VISHWAKARMA ENTERPRISES', 'link': 'https://www.google.com/maps/contrib/115220279080883685888?hl=en-US', 'contributor_id': '115220279080883685888', 'thumbnail': 'https://lh3.googleusercontent.com/a-/ALV-UjWCN1xyPGSV-RseVwsCwoXykm5fGeOqaLcrzfstCjxfZL1UH1U=s120-c-rp-mo-br100', 'local_guide': True, 'reviews': 1, 'photos': 0}",4.0,solved the problem by very good communication and quick service to Prism team special thank you from Toshiba mam.,5 days ago,pune,Prism IT Solutions Pvt. Ltd.
"{'name': 'prashant bansal', 'link': 'https://www.google.com/maps/contrib/107220944225578402831?hl=en-US', 'contributor_id': '107220944225578402831', 'thumbnail': 'https://lh3.googleusercontent.com/a/ACg8ocLCJJeW4xHUMdAkD_whvERpnbnlVF8JkF70Fsqon-c_21iYZQ=s120-c-rp-mo-br100', 'reviews': 1, 'photos': 0}",4.0,"i've been facing issue regarding E-invoice, Miss rama solved that issue quickly and generated E-invoice quickly from tally prime, very quick support from prism it solution, thank you",a month ago,pune,Prism IT Solutions Pvt. Ltd.
"{'name': 'Pallav Kaushik', 'link': 'https://www.google.com/maps/contrib/112623153114670007279?hl=en-US', 'contributor_id': '112623153114670007279', 'thumbnail': 'https://lh3.googleusercontent.com/a/ACg8ocL_bM3E3c83O6WOhfDG6omfSBMPpW3QyuVNIqqm6Q-jMmGFnA=s120-c-rp-mo-br100', 'reviews': 1, 'photos': 0}",5.0,"I am truly grateful to the Prism team for providing highly commendable service.
I would like to express my sincere appreciation to Prism and the entire support team for their exceptional assistance and prompt responses.",4 months ago,pune,Prism IT Solutions Pvt. Ltd.
"{'name': 'VishnuVardhan', 'link': 'https://www.google.com/maps/contrib/117024647770992963913?hl=en-US', 'contributor_id': '117024647770992963913', 'thumbnail': 'https://lh3.googleusercontent.com/a-/ALV-UjXD348VR-3lfCDv9WzPYpkdTi6jKemtjVgI0RPvngyLRydD_OvhkA=s120-c-rp-mo-br100', 'reviews': 1, 'photos': 0}",5.0,Dear Yashashree you provide best service & explained how to converted tally ERP 9 silver to tally prime silver 4.1  version. all queries solved & explained very nicely.,5 months ago,pune,Prism IT Solutions Pvt. Ltd.
"{'name': 'Accounts Arya', 'link': 'https://www.google.com/maps/contrib/118422795590123004206?hl=en-US', 'contributor_id': '118422795590123004206', 'thumbnail': 'https://lh3.googleusercontent.com/a/ACg8ocLWP4gXoIyQUqQoV3QI-UXiws7t1v4jbTgHFQRm8RUcmBVlrQ=s120-c-rp-mo-br100', 'reviews': 1, 'photos': 0}",5.0,"Vaishnavi mam is very good supportive person, I appreciate your cooperation
service was quick and the staff was friendly",a month ago,pune,Prism IT Solutions Pvt. Ltd.
"{'name': 'Tamthing Ronra', 'link': 'https://www.google.com/maps/contrib/116113966450231927345?hl=en-US', 'contributor_id': '116113966450231927345', 'thumbnail': 'https://lh3.googleusercontent.com/a-/ALV-UjXCIM_r8AJzuCn29hGQzh7KQu9wHRYyNJ_UU-bleLft8wBwqBv4=s120-c-rp-mo-br100', 'reviews': 3, 'photos': 0}",5.0,"Been working in  Talentica for the last 3 years. work life balance is good. management is transparent. enough opportunities to learn and grow. another good thing is that the company shows it's concerns for the employees by conducting numerous beneficial trainings from time to time. Nitin and Manju, the heads, are quite gentle and friendly. However, I do not like the quality of the office biscuits! :D",7 years ago,pune,Talentica Software (I) Pvt. Ltd.
"{'name': 'Alakh Sharma', 'link': 'https://www.google.com/maps/contrib/115103394412327306231?hl=en-US', 'contributor_id': '115103394412327306231', 'thumbnail': 'https://lh3.googleusercontent.com/a-/ALV-UjUIzV0yCJ7QLFfI_i-ONpZj47-xx_Z2p6jz88lzdLKXyqH8RJo=s120-c-rp-mo-ba4-br100', 'local_guide': True, 'reviews': 33, 'photos': 31}",5.0,Best place to work.,6 months ago,pune,Talentica Software (I) Pvt. Ltd.
"{'name': 'Rahul Monde', 'link': 'https://www.google.com/maps/contrib/107567480260997677756?hl=en-US', 'contributor_id': '107567480260997677756', 'thumbnail': 'https://lh3.googleusercontent.com/a-/ALV-UjVHiS3okwsoxDkH2PpRF9MZmXJk4XNMtFOEUfZGAojEU_Y5-JQ1=s120-c-rp-mo-ba3-br100', 'local_guide': True, 'reviews': 46, 'photos': 86}",5.0,Have been to this place for several meetups in last one year. Very neat and employee friendly environment. Learned a lot in all these meet ups.,7 years ago,pune,Talentica Software (I) Pvt. Ltd.
"{'name': 'Sachchidanand tripathi', 'link': 'https://www.google.com/maps/contrib/110832349136752732111?hl=en-US', 'contributor_id': '110832349136752732111', 'thumbnail': 'https://lh3.googleusercontent.com/a-/ALV-UjUDnxxzlzJFJuDf5-ZVUaPe3tzPgUGQvqABfshYSpn-HMM3_wbfsA=s120-c-rp-mo-ba2-br100', 'local_guide': True, 'reviews': 20, 'photos': 7}",5.0,One of the best company to work for. Best work culture I ever came across in my professional journey. Surrounded by some of the best minds from the country.,7 years ago,pune,Talentica Software (I) Pvt. Ltd.
"{'name': 'Abhishek Anand', 'link': 'https://www.google.com/maps/contrib/107790374891090518264?hl=en-US', 'contributor_id': '107790374891090518264', 'thumbnail': 'https://lh3.googleusercontent.com/a-/ALV-UjXoCyllg9AbKTHdYYal3noRXeRkyYNqFOHFTKwPIqmsQ9yUNg=s120-c-rp-mo-br100', 'local_guide': True, 'reviews': 6, 'photos': 0}",5.0,Great place to work at. One of the best work culture and really helpful and approachable CEOs. You can learn a lot from everyone around here.,5 years ago,pune,Talentica Software (I) Pvt. Ltd.
"{'name': 'Puneet Sharma', 'link': 'https://www.google.com/maps/contrib/102037727773870777674?hl=en-US', 'contributor_id': '102037727773870777674', 'thumbnail': 'https://lh3.googleusercontent.com/a-/ALV-UjWkUuH8KwJIoG1xtsKRIwcjdr5ihKJMbEVaXZCYEYE1uf5P-nqz3Q=s120-c-rp-mo-ba7-br100', 'local_guide': True, 'reviews': 290, 'photos': 7541}",5.0,"One of the best companies to work for. Has start-up projects , work environment is terrific, learning is good, and looks after it's employees.",5 years ago,pune,Talentica Software (I) Pvt. Ltd.
"{'name': 'Mukesh Verma', 'link': 'https://www.google.com/maps/contrib/103001586295391088632?hl=en-US', 'contributor_id': '103001586295391088632', 'thumbnail': 'https://lh3.googleusercontent.com/a-/ALV-UjV62-K0YhxkhcCdApl-dbIs32nHBTCySa3QcxC_1ql71vfZCd-c=s120-c-rp-mo-ba3-br100', 'local_guide': True, 'reviews': 33, 'photos': 85}",5.0,It's a good company to work with. I am really interested to work with them if someday I get opportunity.,6 years ago,pune,Talentica Software (I) Pvt. Ltd.
"{'name': 'VILAS PAWAR', 'link': 'https://www.google.com/maps/contrib/116983125685110722681?hl=en-US', 'contributor_id': '116983125685110722681', 'thumbnail': 'https://lh3.googleusercontent.com/a-/ALV-UjVYohc72VYiNLTKxGx1Yvhy174INHmAGnq3x287L0kqCJ4anXBGPw=s120-c-rp-mo-ba3-br100', 'local_guide': True, 'reviews': 28, 'photos': 7}",4.0,It's a Software company which provides plenty of services to the new startups located on Baner Pashan link road near HDFC bank,3 years ago,pune,Talentica Software (I) Pvt. Ltd.
"{'name': 'Raj D', 'link': 'https://www.google.com/maps/contrib/100954916118749703774?hl=en-US', 'contributor_id': '100954916118749703774', 'thumbnail': 'https://lh3.googleusercontent.com/a-/ALV-UjUGC0kNLsRma_ur7Vm42ihTiXsL1V28w8txy1D4FhB2ZeRI7yqvWw=s120-c-rp-mo-ba4-br100', 'local_guide': True, 'reviews': 38, 'photos': 273}",5.0,The best place to work. Understands individual's skills and groom them well to enrich. Most people have/are working for years.,8 months ago,pune,Cybage Software Private Limited
"{'name': 'Sumeet Dagde', 'link': 'https://www.google.com/maps/contrib/104780167461343133570?hl=en-US', 'contributor_id': '104780167461343133570', 'thumbnail': 'https://lh3.googleusercontent.com/a-/ALV-UjUbO0-983ND82KqC0d1plZ3jqnjqC_XDrRxOzcUw_QtE0z3vjaVXA=s120-c-rp-mo-ba3-br100', 'local_guide': True, 'reviews': 42, 'photos': 88}",5.0,"Best place to work.
Dmart, DIY nearby.
Huge Parking space.
Great place to work.",a year ago,pune,Cybage Software Private Limited
"{'name': 'Nofij Barudwale', 'link': 'https://www.google.com/maps/contrib/108214983700308394065?hl=en-US', 'contributor_id': '108214983700308394065', 'thumbnail': 'https://lh3.googleusercontent.com/a-/ALV-UjWffg0AjZZ_tfiZyOMDHpEw44Sd9B-xLv2rvMjIRW0onL0bxDk=s120-c-rp-mo-ba4-br100', 'local_guide': True, 'reviews': 67, 'photos': 37}",5.0,"Cybage Software delivers exceptional IT solutions with a focus on innovation and client satisfaction, while also promoting a great work life balance for its employees.",a month ago,pune,Cybage Software Private Limited
"{'name': 'Ajay Suryawanshi', 'link': 'https://www.google.com/maps/contrib/108574814485712404499?hl=en-US', 'contributor_id': '108574814485712404499', 'thumbnail': 'https://lh3.googleusercontent.com/a-/ALV-UjWkwFFZpaGpj52JHYyfV9aysBVn1l_GpnQMhUTHQ8f1R70fFqcNjA=s120-c-rp-mo-ba2-br100', 'local_guide': True, 'reviews': 5, 'photos': 46}",5.0,Best place to work... as I am working here in the Software Developer position...,8 months ago,pune,Cybage Software Private Limited
"{'name': 'Ravindra Vangipuram', 'link': 'https://www.google.com/maps/contrib/101253769791688630516?hl=en-US', 'contributor_id': '101253769791688630516', 'thumbnail': 'https://lh3.googleusercontent.com/a-/ALV-UjWKEVyawmdAiuPmUDCSFsZPA-9fmsQ-2-SpqNfyBTR26pkEzyQJfQ=s120-c-rp-mo-ba6-br100', 'local_guide': True, 'reviews': 1747, 'photos': 1565}",4.0,It's also called as twin towers of Cybage. It is located near East Avenue. The other Cybage office is in West Avenue. These are two similar towers. There is a fountain within the campus with some greenery. There are either pool or table tennis tables on each floor. The work culture is nice which you find in other locations as well.,5 years ago,pune,Cybage Software Private Limited
"{'name': 'Abhishek Singh', 'link': 'https://www.google.com/maps/contrib/109558636296482806040?hl=en-US', 'contributor_id': '109558636296482806040', 'thumbnail': 'https://lh3.googleusercontent.com/a-/ALV-UjVv5u2zBmDzQwgAeNl2StBs4PQkqW5jkN2pv67tkajG3d-ntisG0w=s120-c-rp-mo-ba4-br100', 'local_guide': True, 'reviews': 68, 'photos': 127}",5.0,"Employee Friendly Company, Excellent Infrastructure. Office is situated in the heart of city. Malls, restaurants, airport, railway station are all nearby.",2 years ago,pune,Cybage Software Private Limited
"{'name': 'श्रीनाथ गादेकर', 'link': 'https://www.google.com/maps/contrib/106566555283375326040?hl=en-US', 'contributor_id': '106566555283375326040', 'thumbnail': 'https://lh3.googleusercontent.com/a-/ALV-UjVj8GMEHVW6FHR0J343i4SqVlsMrijYcuNWaeg6Zys7Qz-tQTpT=s120-c-rp-mo-ba4-br100', 'local_guide': True, 'reviews': 58, 'photos': 136}",5.0,It's good company for freshers to grow and work environment is also good.,2 years ago,pune,Cybage Software Private Limited
"{'name': 'udit joshi', 'link': 'https://www.google.com/maps/contrib/111540435842759235921?hl=en-US', 'contributor_id': '111540435842759235921', 'thumbnail': 'https://lh3.googleusercontent.com/a-/ALV-UjUs0sdwEPVc4YKH9WifjOUTRIQbJJNA0WjUehjMC72ZYOgJkvDb4w=s120-c-rp-mo-ba3-br100', 'local_guide': True, 'reviews': 20, 'photos': 42}",5.0,Currently working here and proud to be a cybagian !! Work life balance is awesome and great place to work !,a year ago,pune,Cybage Software Private Limited
"{'name': 'Harshvardhan Patil', 'link': 'https://www.google.com/maps/contrib/111298918668694307849?hl=en-US', 'contributor_id': '111298918668694307849', 'thumbnail': 'https://lh3.googleusercontent.com/a-/ALV-UjVZbsRt1JCXCkVT3h5XxIZdntZoi6nTPVSeEznz55P_Ul-xP9oT=s120-c-rp-mo-br100', 'local_guide': True, 'reviews': 2, 'photos': 0}",5.0,"Codeplateau Technology delivered outstanding Power BI consulting services, significantly improving the efficiency of our finance dashboards. Their team was not only highly knowledgeable but also very proactive, consistently providing up-to-date updates throughout the project. They played a crucial role in helping us design complex metrics such as Revenue, Profit, Performance, and Growth, driving substantial improvements in our financial reporting. Their attention to detail and dedicated support made a big difference. Highly recommend their services!",4 months ago,pune,Codeplateau Technology Solutions - Power BI consulting services
"{'name': 'Dhere KP', 'link': 'https://www.google.com/maps/contrib/117398344991163797646?hl=en-US', 'contributor_id': '117398344991163797646', 'thumbnail': 'https://lh3.googleusercontent.com/a/ACg8ocJX41bEJRzLr_ms2LIgirfwCwvFujg35j5JWOT73bfY6umsUQ=s120-c-rp-mo-br100', 'reviews': 3, 'photos': 5}",5.0,"We had an outstanding experience collaborating with CodePlateau! Their expertise in Power BI helped us transform shop floor data into intuitive visual reports, now showcased on plant TVs for employees and customers alike. This shift has enabled us to go paperless, and CodePlateau played a pivotal role in creating this streamlined ecosystem. We highly recommend their Power BI consulting services in Pune!",2 months ago,pune,Codeplateau Technology Solutions - Power BI consulting services
"{'name': 'Snowy Sharma', 'link': 'https://www.google.com/maps/contrib/108948636590213529156?hl=en-US', 'contributor_id': '108948636590213529156', 'thumbnail': 'https://lh3.googleusercontent.com/a/ACg8ocIZc5El1XRO3s7MNIm-FnGNb8pnjkgg6c-U-TFsvNYWQVorprs=s120-c-rp-mo-br100', 'reviews': 3, 'photos': 1}",5.0,"Dear Codeplateau Team

I wanted to take a moment to express my heartfelt thanks for the exceptional work you’ve done on our interior design website. The site is not only visually stunning but also incredibly functional and user-friendly.
Your attention to detail is evident in every aspect of the design, from the elegant layout to the intuitive navigation. It’s clear that a lot of thought and effort went into creating a website that truly reflects our brand and vision.

Thank you once again for your dedication and creativity.It has been a pleasure working with such a talented and committed team, and we look forward to collaborating on future projects.

Warm regards,
Snowy
Interior Designer
(SEG Interiors)",8 months ago,pune,Codeplateau Technology Solutions - Power BI consulting services
"{'name': 'Cate Fairley', 'link': 'https://www.google.com/maps/contrib/104918129455283461949?hl=en-US', 'contributor_id': '104918129455283461949', 'thumbnail': 'https://lh3.googleusercontent.com/a/ACg8ocLS-y719rXLMElO3nZIZz1S10qIn8ppjt7NajYcirJ10t0rHw=s120-c-rp-mo-br100', 'reviews': 5, 'photos': 0}",5.0,"Nikesh and his team are incredibly efficient, responsive and have made my website and customer relationship platform so user friendly. I highly recommend Code Plateau, 6-stars!",8 months ago,pune,Codeplateau Technology Solutions - Power BI consulting services
"{'name': ""i'ara Specialist Support Coordination"", 'link': 'https://www.google.com/maps/contrib/115534432661860783047?hl=en-US', 'contributor_id': '115534432661860783047', 'thumbnail': 'https://lh3.googleusercontent.com/a-/ALV-UjWLow8eVT65YIXv2aseWfGk8pINLaMS7qmAMdWRUf4KdlrW_2g=s120-c-rp-mo-br100', 'reviews': 3, 'photos': 0}",5.0,We worked with the team at Codeplateau to develop a CRM for our business. They were fantastic to work with and very responsive. Highly recommend!!!,8 months ago,pune,Codeplateau Technology Solutions - Power BI consulting services
"{'name': 'Gaurang Shah', 'link': 'https://www.google.com/maps/contrib/113090497812414620380?hl=en-US', 'contributor_id': '113090497812414620380', 'thumbnail': 'https://lh3.googleusercontent.com/a/ACg8ocJiw-CRvgZUmKPS0WtmOPhM5AurO-zxCeFZXRo7ne0I7bNv6A4=s120-c-rp-mo-br100', 'local_guide': True, 'reviews': 2, 'photos': 3}",5.0,"The Codeplateau Technology Solutions team delivered an excellent web page that met all our expectations.

They understood the requirements very well.

The design was professional and user-friendly, and the development team was highly responsive to all our requests. We're satisfied and would highly recommend them.",2 years ago,pune,Codeplateau Technology Solutions - Power BI consulting services
"{'name': 'Direct2Karma - UKHF', 'link': 'https://www.google.com/maps/contrib/113853554917049783431?hl=en-US', 'contributor_id': '113853554917049783431', 'thumbnail': 'https://lh3.googleusercontent.com/a-/ALV-UjVNICker_j5Q-J9tCfIDXc04r9Tmi6P1MOl43b8YT06z9G57LE=s120-c-rp-mo-br100', 'reviews': 1, 'photos': 0}",5.0,"I would recommend CodePlateau  for following reasons
1. Great web designers and get to know what you have in mind.
2. Experienced team
3.Highly professional
4.Accomodative of any changes if imperative.
5. Excellent internal review mechanism to keep the followup and updates
Am very happy with the output.
Wish all the best to the team.",6 years ago,pune,Codeplateau Technology Solutions - Power BI consulting services
"{'name': 'Mish Walkeden', 'link': 'https://www.google.com/maps/contrib/104212504156063578613?hl=en-US', 'contributor_id': '104212504156063578613', 'thumbnail': 'https://lh3.googleusercontent.com/a-/ALV-UjUkXqM_BQDhP-R1tnMEJ8fnucHTpjUVwWxbaOG9LKAHD8GDT-8=s120-c-rp-mo-br100', 'reviews': 1, 'photos': 0}",5.0,Codeplateau are awesome - we work together on a daily basis and they deliver outstanding work. They have helped us with large digital projects as well as on-going monthly digital management. I would highly recommend Codeplateau to any business looking to grow their digital space.,5 years ago,pune,Codeplateau Technology Solutions - Power BI consulting services
"{'name': 'Sundeep Patel', 'link': 'https://www.google.com/maps/contrib/114644339303672872472?hl=en-US', 'contributor_id': '114644339303672872472', 'thumbnail': 'https://lh3.googleusercontent.com/a-/ALV-UjUxdX1de76Wy1AGSGfyTEn8D1XuvhM6hQdQauMwoe4KL5xFtn7SvA=s120-c-rp-mo-ba6-br100', 'local_guide': True, 'reviews': 179, 'photos': 2292}",5.0,"Persistent Systems Ltd is a global software company that provides innovative software solutions to clients worldwide. The Bhageerath office is one of the company's offices located in Pune, India. As an employee of Persistent Systems Ltd, I have had the opportunity to work at this office and experience its work culture, facilities, and environment.

Work Culture:
The work culture at Persistent Systems Ltd Bhageerath office is excellent. The company values its employees and provides a supportive environment that encourages creativity, innovation, and collaboration. The office has an open-door policy, and employees are encouraged to share their ideas and opinions freely. The management is approachable and provides ample opportunities for career growth and development.

Facilities:
The Bhageerath office has excellent facilities that cater to the needs of its employees. The office is spacious and well-equipped with state-of-the-art technology and infrastructure. The office has a modern cafeteria that serves a variety of delicious food and beverages. The office also has a gymnasium, a recreation room, and a meditation center, which are available to employees to use during their free time.

Environment:
The environment at Persistent Systems Ltd Bhageerath office is conducive to work. The office is located in a peaceful and quiet area, away from the hustle and bustle of the city. The office is surrounded by lush greenery and has a beautiful view of the nearby hills. The office has an eco-friendly policy and encourages its employees to adopt sustainable practices.

Employee Experience:
As an employee of Persistent Systems Ltd Bhageerath office, my experience has been excellent. The company provides a supportive and inclusive work environment that values its employees. The facilities and amenities provided by the company are top-notch, which makes it a great place to work. The company also provides ample opportunities for career growth and development.

Conclusion:
In conclusion, Persistent Systems Ltd Bhageerath office is a great place to work. The work culture is excellent, and the company values its employees. The facilities and amenities provided by the company are top-notch, which makes it a comfortable and enjoyable place to work. The environment is conducive to work, which makes it an ideal location for an office. Overall, it is a highly recommended place to work.",a year ago,pune,Persistent Systems Limited
"{'name': 'Aakash Gaurav', 'link': 'https://www.google.com/maps/contrib/115683065675314486377?hl=en-US', 'contributor_id': '115683065675314486377', 'thumbnail': 'https://lh3.googleusercontent.com/a-/ALV-UjVRhUY09Q1LrNNGM1qr2DxgN7r5M_FA4MgdYs6UshIKrafY-SNt=s120-c-rp-mo-ba4-br100', 'local_guide': True, 'reviews': 54, 'photos': 409}",5.0,"Google map always shows backside of persistent bhageerath building, but you can search panchshil tech park or Yardi software, it is beside of those building. Their are fews IT companies there.

Apart from that, the area is very greenery and quite. Its first building of persistent and it's one of the best MNC company. It has 4 total branch in Pune only. So if you selected in persistent, it is very good for your career, you have plenty of opportunities to learn new skill. Its salary bracket is also good among other MNCs. So best of luck 👍🏼",3 years ago,pune,Persistent Systems Limited
"{'name': 'Praveen Soni', 'link': 'https://www.google.com/maps/contrib/105256165947426620582?hl=en-US', 'contributor_id': '105256165947426620582', 'thumbnail': 'https://lh3.googleusercontent.com/a-/ALV-UjWy_czWt_j77G-NdiFAnHqquX3hOova8pNayjU5GAJnB_6Nz8g=s120-c-rp-mo-ba4-br100', 'local_guide': True, 'reviews': 163, 'photos': 43}",5.0,One of the best IT company in pune. Location and offices are best. Personally I likes the name of buildings.,2 years ago,pune,Persistent Systems Limited
"{'name': 'Harshad N', 'link': 'https://www.google.com/maps/contrib/114937498974400215707?hl=en-US', 'contributor_id': '114937498974400215707', 'thumbnail': 'https://lh3.googleusercontent.com/a-/ALV-UjXBISuC0P0RxodQ46bfKejqVALmul_Z-v109sSb7QHUNwSjmcHQ=s120-c-rp-mo-ba6-br100', 'local_guide': True, 'reviews': 175, 'photos': 1508}",5.0,"Well known IT company in Pune. Founded and managed by Dr Deshpande.
Persistent family known for their social service along with the core business in IT sector..",a year ago,pune,Persistent Systems Limited
"{'name': 'Sachin Erudkar', 'link': 'https://www.google.com/maps/contrib/110014826976483263882?hl=en-US', 'contributor_id': '110014826976483263882', 'thumbnail': 'https://lh3.googleusercontent.com/a/ACg8ocJeJu4CKqcEixuDSnZ6Hhizl5roIOcTqrLg-Us4ONdhAbr6JA=s120-c-rp-mo-br100', 'reviews': 3, 'photos': 0}",1.0,"Multi level interview pannel as they don't have confidence on their pannel.

After 4 rounds Manager asked me some questions that not related to my skills.
And finally he said you need to work more on your skills.

Most pathetic company

All 5 star comments are either paid or posted by their employees",10 months ago,pune,Persistent Systems Limited
"{'name': 'The Journeyer', 'link': 'https://www.google.com/maps/contrib/113754041605971982745?hl=en-US', 'contributor_id': '113754041605971982745', 'thumbnail': 'https://lh3.googleusercontent.com/a-/ALV-UjVStq_LcKyXnzfY8kimsGUQXCoVsl8yBIAtmRmCNLSLa-L45hjP=s120-c-rp-mo-ba4-br100', 'local_guide': True, 'reviews': 35, 'photos': 31}",5.0,I go there often in every 3 months. Good culture. Polite security guard. Good lobby area. Overall nice company,11 months ago,pune,Persistent Systems Limited
"{'name': 'Umesh Bugade', 'link': 'https://www.google.com/maps/contrib/116799767564624064548?hl=en-US', 'contributor_id': '116799767564624064548', 'thumbnail': 'https://lh3.googleusercontent.com/a-/ALV-UjU2vd3jMnj5AQYqloT9vjx7lLrRyqoGA5Jr4YrxxH2GPcVSvIs=s120-c-rp-mo-ba5-br100', 'local_guide': True, 'reviews': 107, 'photos': 230}",5.0,"Very modern design offices in almost every smart city in India. Basically Pune based IT company. Great and one the fastest growing Indian IT companies. You will find facilities learning and development, training , food , insurance, cab , gym , sports activities etc. Overall a very good environment and work life balance for employees.",a year ago,pune,Persistent Systems Limited
