username,rating,text,date,ct,company
"{'name': 'Vishal Gond', 'link': 'https://www.google.com/maps/contrib/108669257949830498173?hl=en-US', 'contributor_id': '108669257949830498173', 'thumbnail': 'https://lh3.googleusercontent.com/a-/ALV-UjWIy_Ate2_pXsnZzi1TTd-oLl8_smAY5xVd9SYNFmzO177_SCG_=s120-c-rp-mo-br100', 'reviews': 1, 'photos': 16}",5.0,"Tekniko Global is a fantastic mobile app development company. They deliver high-quality, user-friendly apps with excellent support and timely delivery. Highly skilled team—definitely recommend for any app development needs!",a month ago,Noida,"Tekniko Global | Mobile App Development Company in Noida | Android, iOS App Development Company"
"{'name': 'Ankit LIC', 'link': 'https://www.google.com/maps/contrib/107473409783133018101?hl=en-US', 'contributor_id': '107473409783133018101', 'thumbnail': 'https://lh3.googleusercontent.com/a-/ALV-UjWUFvwCL3ZsPASc14s9eNf8dUms52Myt3OEva44ZNfQRjn1DI1DhA=s120-c-rp-mo-ba3-br100', 'local_guide': True, 'reviews': 5, 'photos': 5}",5.0,"Tekniko Global offers a dynamic work environment with great leadership, a supportive team, and ample growth opportunities. It’s a fantastic company for anyone passionate about mobile app development.",a month ago,Noida,"Tekniko Global | Mobile App Development Company in Noida | Android, iOS App Development Company"
"{'name': 'Anshuman Gupta', 'link': 'https://www.google.com/maps/contrib/103631518544997071955?hl=en-US', 'contributor_id': '103631518544997071955', 'thumbnail': 'https://lh3.googleusercontent.com/a-/ALV-UjV3a_DrJhPCnQNv7yewV-fBW-0oLetZ9TE3rq0jaO60yT53F3o=s120-c-rp-mo-br100', 'reviews': 1, 'photos': 1}",5.0,"Tekniko Global offers exceptional service with professional, innovative solutions. Their team is knowledgeable, communicative, and dedicated to delivering quality results on time. Highly recommend for anyone needing reliable tech support!",a month ago,Noida,"Tekniko Global | Mobile App Development Company in Noida | Android, iOS App Development Company"
"{'name': 'Ranjit Kumar', 'link': 'https://www.google.com/maps/contrib/104819076901723596262?hl=en-US', 'contributor_id': '104819076901723596262', 'thumbnail': 'https://lh3.googleusercontent.com/a/ACg8ocImGG8AQT_Jv0-NOKSVyjrDAoUNOYEtDQBso0X-OC---mdbgA=s120-c-rp-mo-br100', 'reviews': 1, 'photos': 0}",5.0,"Working at Tekniko Global has been a great experience. It’s a place where innovation is valued, and the team always supports each other in creating high-quality mobile apps.",a month ago,Noida,"Tekniko Global | Mobile App Development Company in Noida | Android, iOS App Development Company"
"{'name': 'Dr Abhiraj Kumar Abhiraj Kumar', 'link': 'https://www.google.com/maps/contrib/103373149151626054437?hl=en-US', 'contributor_id': '103373149151626054437', 'thumbnail': 'https://lh3.googleusercontent.com/a-/ALV-UjWt9Z6QZGS4w69WwhlL9scLX1mXd27EW9qg3D3oB4NlJkvUg_HH=s120-c-rp-mo-br100', 'reviews': 1, 'photos': 0}",5.0,"A Company that truly invests in its people! Tekniko Global offers a collaborative atmosphere, skill-buelding opportunities, and a great work Life balance. Highly recommend for career growth.",a month ago,Noida,"Tekniko Global | Mobile App Development Company in Noida | Android, iOS App Development Company"
"{'name': 'r kumar', 'link': 'https://www.google.com/maps/contrib/100062276890875965640?hl=en-US', 'contributor_id': '100062276890875965640', 'thumbnail': 'https://lh3.googleusercontent.com/a-/ALV-UjXivrZjuAGHZuvBfVYi3Ezrq1qh79QETJGhRXYDL9HcCSoWsYw=s120-c-rp-mo-br100', 'reviews': 1, 'photos': 0}",5.0,"Tekniko Global is a great company for anyone looking to advance in mobile app development. The team is supportive, the projects are engaging, and there are endless growth opportunities.",a month ago,Noida,"Tekniko Global | Mobile App Development Company in Noida | Android, iOS App Development Company"
"{'name': 'nardev singh', 'link': 'https://www.google.com/maps/contrib/107807642874204114625?hl=en-US', 'contributor_id': '107807642874204114625', 'thumbnail': 'https://lh3.googleusercontent.com/a-/ALV-UjUf8wIxlclYu50QEJazps2O1nw29QjUwZf5w2-vZW4pl8Bnwbmo=s120-c-rp-mo-br100', 'reviews': 1, 'photos': 0}",5.0,Best company for website designers,4 months ago,Noida,SP Technosoft (P) Ltd
"{'name': 'kajri group', 'link': 'https://www.google.com/maps/contrib/114932421112637118114?hl=en-US', 'contributor_id': '114932421112637118114', 'thumbnail': 'https://lh3.googleusercontent.com/a/ACg8ocLE9mmbAHY-rQ1XetDS1kQ4u1XUBeESvcdE8YWzWVapUhDPLw=s120-c-rp-mo-br100', 'reviews': 1, 'photos': 0}",5.0,"Best Website design @ development company in Delhi ncr, Wonderful. Thank you, !!! The team did a great job....",5 years ago,Noida,SP Technosoft (P) Ltd
"{'name': 'rinku singh', 'link': 'https://www.google.com/maps/contrib/100693459630263216097?hl=en-US', 'contributor_id': '100693459630263216097', 'thumbnail': 'https://lh3.googleusercontent.com/a/ACg8ocIJfIsc0Ek-quM_ZYMHyBXXi2AJ8nb21zpySky9ojHrtr46Bg=s120-c-rp-mo-br100', 'reviews': 1, 'photos': 0}",5.0,One  of the most fastest grown company for website development and promotion with lots of experts under a roof.We have working together I have  gain a lots of knowledge and experiences.,5 years ago,Noida,SP Technosoft (P) Ltd
"{'name': 'divya garg', 'link': 'https://www.google.com/maps/contrib/105151389747546815589?hl=en-US', 'contributor_id': '105151389747546815589', 'thumbnail': 'https://lh3.googleusercontent.com/a/ACg8ocKYCdnKjpt1DoAcTm6DI26t-hGfBF9FZbeq3x-4h_RifQfQJA=s120-c-rp-mo-br100', 'reviews': 3, 'photos': 1}",5.0,Best website design and development company in noida.The team Work delivered on time..,3 years ago,Noida,SP Technosoft (P) Ltd
"{'name': 'akash singh singer', 'link': 'https://www.google.com/maps/contrib/102033143549362045765?hl=en-US', 'contributor_id': '102033143549362045765', 'thumbnail': 'https://lh3.googleusercontent.com/a-/ALV-UjWpsRPxfURZY0oAWrUIfkMdRBOL_oMXkUKNVqbQ1z-p51x8ONow=s120-c-rp-mo-br100', 'reviews': 1, 'photos': 0}",5.0,One of the best company for website design and so many things.,3 years ago,Noida,SP Technosoft (P) Ltd
"{'name': 'ramesh pathak', 'link': 'https://www.google.com/maps/contrib/104815994638275704775?hl=en-US', 'contributor_id': '104815994638275704775', 'thumbnail': 'https://lh3.googleusercontent.com/a/ACg8ocJvbznuX68CmSByuVjbrdLXwm7A_cZGTLnoFkOCpU0o4aVYaw=s120-c-rp-mo-br100', 'local_guide': True, 'reviews': 2, 'photos': 0}",5.0,SP Technosoft Pvt LTD is the Best Website Design and Development company in Delhi NCR. SP Technosoft Pvt LTD is the one of the fatest Growing Company in India.,6 years ago,Noida,SP Technosoft (P) Ltd
"{'name': 'Vikas Singh', 'link': 'https://www.google.com/maps/contrib/104767552260365984691?hl=en-US', 'contributor_id': '104767552260365984691', 'thumbnail': 'https://lh3.googleusercontent.com/a/ACg8ocLbUeEkIwqZDmusn4lL1HiTzOlqOmNLdRlbW6BLQNCHMaFInA=s120-c-rp-mo-br100', 'local_guide': True, 'reviews': 6, 'photos': 0}",5.0,"One  of the most fastest grown company for website development and promotion....
with lots of experts under a roof.",3 years ago,Noida,SP Technosoft (P) Ltd
"{'name': 'Ritesh Singh', 'link': 'https://www.google.com/maps/contrib/101634562146677609907?hl=en-US', 'contributor_id': '101634562146677609907', 'thumbnail': 'https://lh3.googleusercontent.com/a-/ALV-UjXX2JZuEhJa1jKqco4ggMkLcpruRINLA4A1NqIjMQ5pQamDUmoS=s120-c-rp-mo-br100', 'local_guide': True, 'reviews': 1, 'photos': 0}",5.0,Best website design company in Delhi NCR.. Really appreciate ☺️,6 years ago,Noida,SP Technosoft (P) Ltd
"{'name': 'Season On', 'link': 'https://www.google.com/maps/contrib/100549908146697896908?hl=en-US', 'contributor_id': '100549908146697896908', 'thumbnail': 'https://lh3.googleusercontent.com/a-/ALV-UjVyBk6jO-v3j9Yq7RcQLtMmpuJECad5g419qJro9edbOVg2q6Or=s120-c-rp-mo-ba4-br100', 'local_guide': True, 'reviews': 31, 'photos': 198}",5.0,"We are extremely satisfied with the services provided by Markstein Technology Solutions Pvt. Ltd. Their team is highly skilled, innovative, and dedicated to ensuring client satisfaction. They have consistently delivered high-quality solutions that have significantly benefited our business. Markstein is our go-to partner for all technology needs.",9 months ago,Noida,Markstein Technology Solutions - Web Design & Development Company in Noida
"{'name': 'Vishal Sharma', 'link': 'https://www.google.com/maps/contrib/102940964781671003258?hl=en-US', 'contributor_id': '102940964781671003258', 'thumbnail': 'https://lh3.googleusercontent.com/a-/ALV-UjWRvWL-jHfwy8sTowunXLcjQ4P5iCSh-pCAcp4zIQ9gtbT9TT7O=s120-c-rp-mo-br100', 'reviews': 1, 'photos': 0}",5.0,"Markstein Technology Solutions delivers beyond expectations! Their application development services crafted a user-friendly interface that elevated our customer experience. The team's commitment to innovation, combined with their technical prowess, makes them an invaluable partner for any business.",a year ago,Noida,Markstein Technology Solutions - Web Design & Development Company in Noida
"{'name': 'Sheela Sahu', 'link': 'https://www.google.com/maps/contrib/113180168610820138411?hl=en-US', 'contributor_id': '113180168610820138411', 'thumbnail': 'https://lh3.googleusercontent.com/a/ACg8ocJthX2SPi1SUPjtpaInwc4BVsQXRSau7s5MIUPtCuJ38gS-vpvm=s120-c-rp-mo-br100', 'reviews': 2, 'photos': 0}",5.0,"Markstein Technology Solutions created a visually stunning website for our business. Some initial communication challenges, but they addressed our concerns promptly, and the end result was impressive.",a year ago,Noida,Markstein Technology Solutions - Web Design & Development Company in Noida
"{'name': 'Jyoti Kashyap', 'link': 'https://www.google.com/maps/contrib/107062779240388940294?hl=en-US', 'contributor_id': '107062779240388940294', 'thumbnail': 'https://lh3.googleusercontent.com/a/ACg8ocIc6ilBvPzFthcXO3-ys2Udt1A9bSGKpCLeJQsbMvAxASHBTA=s120-c-rp-mo-ba2-br100', 'local_guide': True, 'reviews': 5, 'photos': 5}",1.0,If you have knowledge like Chatgpt then go there for interview.,2 days ago,Noida,Markstein Technology Solutions - Web Design & Development Company in Noida
"{'name': 'Mahesh Chidar', 'link': 'https://www.google.com/maps/contrib/108898531884964239732?hl=en-US', 'contributor_id': '108898531884964239732', 'thumbnail': 'https://lh3.googleusercontent.com/a/ACg8ocL1shlNfDSFdPyMQV3HUjodxMBy9DvGKa9qwhfWwYE3j10Vlg=s120-c-rp-mo-br100', 'reviews': 1, 'photos': 0}",5.0,"Markstein Technology Solutions exceeded our expectations! Their team delivered a customized software solution that transformed our business operations. Exceptional service, highly recommended!",a year ago,Noida,Markstein Technology Solutions - Web Design & Development Company in Noida
"{'name': 'Ved Singh', 'link': 'https://www.google.com/maps/contrib/106249042497921594293?hl=en-US', 'contributor_id': '106249042497921594293', 'thumbnail': 'https://lh3.googleusercontent.com/a-/ALV-UjVK5RLKu01I6VBYNBLh7k8VxEzMPpfyrRHaSwk8ymZ4arSTIroB=s120-c-rp-mo-br100', 'reviews': 1, 'photos': 0}",5.0,"Markstein Technology Solutions knows digital marketing inside out. Their team crafted engaging campaigns that resonated with our audience, leading to increased leads and conversions.",a year ago,Noida,Markstein Technology Solutions - Web Design & Development Company in Noida
"{'name': 'subodh kumar khandesh', 'link': 'https://www.google.com/maps/contrib/104277759313653685948?hl=en-US', 'contributor_id': '104277759313653685948', 'thumbnail': 'https://lh3.googleusercontent.com/a/ACg8ocJlhyrORJ_R1GRPmZXep3XRUq2kaY5i-DSa4O4jovgv9p4rxg=s120-c-rp-mo-br100', 'reviews': 2, 'photos': 0}",5.0,"Top-notch digital marketing services from Markstein! They brought creativity and precision to our campaigns, making our brand stand out in the crowded digital landscape.",a year ago,Noida,Markstein Technology Solutions - Web Design & Development Company in Noida
"{'name': 'Arindam Biswas', 'link': 'https://www.google.com/maps/contrib/101339692737816856246?hl=en-US', 'contributor_id': '101339692737816856246', 'thumbnail': 'https://lh3.googleusercontent.com/a-/ALV-UjWotRBqDBdM2ZwF9s9B9YBDHMruxi2jxiGEgeq2Y-4ROU3pyFig=s120-c-rp-mo-br100', 'local_guide': True, 'reviews': 3, 'photos': 0}",5.0,Markstein Technology Solutions delivers excellence in every project.,a year ago,Noida,Markstein Technology Solutions - Web Design & Development Company in Noida
"{'name': 'Rajeev Kumar', 'link': 'https://www.google.com/maps/contrib/112652578375804580988?hl=en-US', 'contributor_id': '112652578375804580988', 'thumbnail': 'https://lh3.googleusercontent.com/a/ACg8ocJC9cjeL95bjT3koXSyGHFtHaQpKy4TPj02kwhvT0HEuG4ZpA=s120-c-rp-mo-ba3-br100', 'local_guide': True, 'reviews': 3, 'photos': 0}",5.0,"TechConfer is an outstanding company for web and software application development. Their expertise and dedication shine through in every project. The team at TechConfer understands the importance of creating visually appealing designs while ensuring seamless functionality. Their attention to detail and commitment to delivering high-quality solutions is commendable. Communication with the team is smooth and efficient, making the development process a breeze. With their timely delivery and ability to meet specific business requirements, TechConfer has proven to be a reliable partner. If you're seeking exceptional web and software development services, TechConfer is the go-to choice. Their professionalism and expertise will exceed your expectations.",a year ago,Noida,TechConfer Technologies - Software Development Company | Website Development Company| Mobile App Development Company
"{'name': 'SURBHIT', 'link': 'https://www.google.com/maps/contrib/108872131392781020803?hl=en-US', 'contributor_id': '108872131392781020803', 'thumbnail': 'https://lh3.googleusercontent.com/a-/ALV-UjUUC1kW9fIXI8_nAA8cBao01IyNqX1DcjFS4AlqlN2L6MmAaAk1=s120-c-rp-mo-br100', 'local_guide': True, 'reviews': 7, 'photos': 0}",5.0,"TechConfer Tech’s are fantastic. About a year ago we totally revamped my online presence and built a new website. The goal for us was to show up for landscaping and drainage leads in our service area. This year with the rain that we've had we have been averaging several leads a day just from organic search results because we are now ranking on the first page near the top for drainage in our area. Every time I've needed something I have called and they have immediately answered me or gotten right back to me, the customer service is unmatched. These guys really know what they're doing and if you want to build your online presence and dominate your Market there's no question that these are the guys you need to contact.",a year ago,Noida,TechConfer Technologies - Software Development Company | Website Development Company| Mobile App Development Company
"{'name': 'Astha Rawat', 'link': 'https://www.google.com/maps/contrib/100559128240744644370?hl=en-US', 'contributor_id': '100559128240744644370', 'thumbnail': 'https://lh3.googleusercontent.com/a-/ALV-UjUSj-ws2V-xiNdPr0gaSF-YnYmIJwLcs2aA5DDgh3T_arps2kFjHw=s120-c-rp-mo-br100', 'local_guide': True, 'reviews': 8, 'photos': 4}",5.0,"I recently had the pleasure of engaging with TechConfer Technologies, and I must say that my experience with the company was nothing short of exceptional.
TechConfer Technologies' commitment to quality and customer satisfaction is evident in every aspect of their work. Their attention to detail is impeccable, ensuring that every project they undertake is executed flawlessly.",a year ago,Noida,TechConfer Technologies - Software Development Company | Website Development Company| Mobile App Development Company
"{'name': 'Little story india', 'link': 'https://www.google.com/maps/contrib/111644955922439953014?hl=en-US', 'contributor_id': '111644955922439953014', 'thumbnail': 'https://lh3.googleusercontent.com/a-/ALV-UjWduiTEi5b6a4vP-Agc9ghC0fDX-JNVGSmnlHTvWTJXVgtiZI0=s120-c-rp-mo-br100', 'reviews': 2, 'photos': 0}",5.0,"Loved working with Techconfer. They were so easy, and understanding. They went beyond our expectations and at a very reasonable rate. Would definitely recommend, and looking forward to working with them on more projects of ours!",a year ago,Noida,TechConfer Technologies - Software Development Company | Website Development Company| Mobile App Development Company
"{'name': 'Nishat Anjum', 'link': 'https://www.google.com/maps/contrib/112194458402695192852?hl=en-US', 'contributor_id': '112194458402695192852', 'thumbnail': 'https://lh3.googleusercontent.com/a/ACg8ocKORFmfTBaz5Okp4phwtw_fmnTTzKdHvJDrYpuVAMLADv4f_w=s120-c-rp-mo-br100', 'reviews': 3, 'photos': 0}",5.0,"Best Place for work.Environment is too much friendly and confortable.Whenever you need someone managers, CEO, Director, all are there for your support.Some points are below:-
1)Perfect Environment
2)Friendly work Culture
3)Supportive colleagues
4)Online activities like fun,games in every week.
5)Comfortable environment",a year ago,Noida,TechConfer Technologies - Software Development Company | Website Development Company| Mobile App Development Company
"{'name': 'Shikhar Talreja', 'link': 'https://www.google.com/maps/contrib/115627667583213324260?hl=en-US', 'contributor_id': '115627667583213324260', 'thumbnail': 'https://lh3.googleusercontent.com/a/ACg8ocKwB8D0w9FITQxU-r9OzmViBxG8G40YEnP5t-3pk_-NoC7YWw=s120-c-rp-mo-ba3-br100', 'local_guide': True, 'reviews': 10, 'photos': 34}",5.0,Sushant and his company have helped me a lot since we both were starting our business in our own flats in Noida simultaneously till to a recent project where I required a complete revamp of website and a new app. They delivered well on time and accommodated all my requests patiently.,a year ago,Noida,TechConfer Technologies - Software Development Company | Website Development Company| Mobile App Development Company
"{'name': 'Neha Chaudhary', 'link': 'https://www.google.com/maps/contrib/111115460007945198606?hl=en-US', 'contributor_id': '111115460007945198606', 'thumbnail': 'https://lh3.googleusercontent.com/a/ACg8ocJ2WHfYoyP7Otz_JlcGPbbG1RqxOxzmm57ZLxgbtnwp0fXE6w=s120-c-rp-mo-br100', 'local_guide': True, 'reviews': 3, 'photos': 6}",5.0,One of the best place to work without any pressure with nice services. It was a great experience with Tech Confer. My heartfelt thanks to sushant and Hemant sir who always supported me and guide me .,a year ago,Noida,TechConfer Technologies - Software Development Company | Website Development Company| Mobile App Development Company
"{'name': 'Yateesh Bhardwaj', 'link': 'https://www.google.com/maps/contrib/116355131723863379460?hl=en-US', 'contributor_id': '116355131723863379460', 'thumbnail': 'https://lh3.googleusercontent.com/a-/ALV-UjXc39-G4mShpDQeSWzigO8NjFyqWowlASWK6T3QdT-GfMJd-J9z6g=s120-c-rp-mo-br100', 'local_guide': True, 'reviews': 3, 'photos': 0}",5.0,"I have worked with TechConfer Technologies and their developers are really efficient and Smart to handle complex problems.
Sushant is really a great Manager who patiently handles your requests.",a year ago,Noida,TechConfer Technologies - Software Development Company | Website Development Company| Mobile App Development Company
"{'name': 'vivek singh', 'link': 'https://www.google.com/maps/contrib/106500869471764052944?hl=en-US', 'contributor_id': '106500869471764052944', 'thumbnail': 'https://lh3.googleusercontent.com/a-/ALV-UjXCmCFpsZDGjZHsvCQ69veZKouOdq8CA8nRC9-t7E1grlCtaY8=s120-c-rp-mo-ba3-br100', 'local_guide': True, 'reviews': 34, 'photos': 0}",5.0,"For me Ucodice is good place to learn new things. Ucodice family is always help each other and this is a comfortable place to work. I would like to thank Ucodice family to make my experience healthy, The team is very supportive to me",a year ago,Noida,Ucodice Technologies IT Company
"{'name': 'subodh kumar', 'link': 'https://www.google.com/maps/contrib/116558366867751163205?hl=en-US', 'contributor_id': '116558366867751163205', 'thumbnail': 'https://lh3.googleusercontent.com/a-/ALV-UjXCYUCi7PuhySve4qeV_R1v-9H5u2CAqZWUfy6zRpSQiKdtK0PK=s120-c-rp-mo-ba2-br100', 'local_guide': True, 'reviews': 6, 'photos': 0}",5.0,"Ucodice Technologies It company, Good efforts deserves appreciation. I met this company online regarding some website work. They suggested me to easy way, and also suggested regarding cost deduction. Entire team is highly praiseworthy. I am doing highly recommended to must visit once! Thanks to UTIC team for wanderful services.",a year ago,Noida,Ucodice Technologies IT Company
"{'name': 'Saddam Hussain', 'link': 'https://www.google.com/maps/contrib/117140973560487660007?hl=en-US', 'contributor_id': '117140973560487660007', 'thumbnail': 'https://lh3.googleusercontent.com/a-/ALV-UjXjnFM1iVOXO3X3TUjGOnjR6ciKi2ZRddinRVuR2UsaZqedHGCX=s120-c-rp-mo-ba3-br100', 'local_guide': True, 'reviews': 3, 'photos': 1}",5.0,"I worked at Ucodice full-time for approx 4 years

I started my career in 2016 with Ucodice.

A good place to learn from scratch. Guidance and mentorship help you in your career.

-Independence to try new things
-Great benefits and salary appraisal in an year.
-Every project is unique and has something new.
-Good working environment, friendly staff.
-Great team spirit
-Supportive Management

""You dream and they will help you achieve it""

Thanks Ucodice",5 years ago,Noida,Ucodice Technologies IT Company
"{'name': 'avinash bhargav', 'link': 'https://www.google.com/maps/contrib/112394603402209979705?hl=en-US', 'contributor_id': '112394603402209979705', 'thumbnail': 'https://lh3.googleusercontent.com/a-/ALV-UjUtaAOWxWUEombH60Mci417QzsMk4mXuKmxWAV4Vqy9iHcM8IUtAQ=s120-c-rp-mo-ba2-br100', 'local_guide': True, 'reviews': 2, 'photos': 0}",5.0,"It was a pleasure working with ucodice team, beginning from the sales till the completion of the project. A special mention to the founders of ucodice, who personally lend their support in the hour of the need and in a critical situation.. The sales team made sure that all things go smoothly and kept all the communications very transparent. I also thank the developer team to put the extra effort for making things work out well.",a year ago,Noida,Ucodice Technologies IT Company
"{'name': 'Suryadaya Patra', 'link': 'https://www.google.com/maps/contrib/114869492722734353670?hl=en-US', 'contributor_id': '114869492722734353670', 'thumbnail': 'https://lh3.googleusercontent.com/a-/ALV-UjW6RPRv6MCK7axcHQce6BN7y1QBsBSeLq8TIW8Naw1ktHNzXb_guA=s120-c-rp-mo-ba4-br100', 'local_guide': True, 'reviews': 14, 'photos': 542}",4.0,I have given interview here. Interview has 2 rounds took around 3 hours but with Genuine analytical and technical test; worth going for interview. If you are problem solver and have basic technical knowledge you can easily get selected. They respect candidate time. Process was informed before going for interview.,a year ago,Noida,Ucodice Technologies IT Company
"{'name': 'Darren Lincoln', 'link': 'https://www.google.com/maps/contrib/107255414409292909845?hl=en-US', 'contributor_id': '107255414409292909845', 'thumbnail': 'https://lh3.googleusercontent.com/a-/ALV-UjXXtaJusoLaoGIHnb1mIG5wh_lS3475vs5usExdoNiPB_gmeTQ=s120-c-rp-mo-br100', 'local_guide': True, 'reviews': 2, 'photos': 0}",5.0,"Working with Uodice IT has been a complete blessing. They offer state of the art and up to date techniques that keep us at the top of the search engines. We have been working with them for 5 years now and I highly recommend them for any IT need. They took us mobile and also moved us from http to https which was a task all in itself because we have 50,000 pages on our site to be indexed on desktops, laptops, I-pads and all mobile devices. I can say enough how pleasant the experience has been. It takes a lot of stress off our company so we can focus on our revenue stream. Also their turn around time is Impeccable.",6 years ago,Noida,Ucodice Technologies IT Company
"{'name': 'Neha Kumari', 'link': 'https://www.google.com/maps/contrib/112383709177178817898?hl=en-US', 'contributor_id': '112383709177178817898', 'thumbnail': 'https://lh3.googleusercontent.com/a/ACg8ocIhFRxEiycUml9xmF0OEfHbcg4mBrEUcdjNC6IA0oZbVWm9Uw=s120-c-rp-mo-br100', 'local_guide': True, 'reviews': 2, 'photos': 0}",5.0,I have been with Ucodice for nearly 2 years. The company has always treated me fairly and made me valuable. I have had opportunities to grow and learn new things. I truly feel like a part of Ucodice family.,5 years ago,Noida,Ucodice Technologies IT Company
"{'name': 'Ankush Negi', 'link': 'https://www.google.com/maps/contrib/114648107339439971592?hl=en-US', 'contributor_id': '114648107339439971592', 'thumbnail': 'https://lh3.googleusercontent.com/a/ACg8ocLZFhuVRDubgnU_TfPQf7l5kx-wQkBr0BDcNUQWjK3WJlW5Tw=s120-c-rp-mo-br100', 'reviews': 2, 'photos': 0}",5.0,"I worked here for more then one year and I really enjoyed the time being a part of this organization, the staff is very friedly and Management is understanding and helping. I have learned so many things here and grow as whole in term of knowledge and skills. I highly recommand people who is looking forward to join Ucodice.",5 years ago,Noida,Ucodice Technologies IT Company
"{'name': 'Ben James', 'link': 'https://www.google.com/maps/contrib/107200443431374373654?hl=en-GB', 'contributor_id': '107200443431374373654', 'thumbnail': 'https://lh3.googleusercontent.com/a/ACg8ocJGU2LtojqrUVu8B5HG5JFjl0kIuM4vCb1tk637Dz5FdwaOe1o=s120-c-rp-mo-br100', 'local_guide': True, 'reviews': 1, 'photos': 0}",1.0,"This company purposely brought down a customer application repeatedly to request additional payments. I found they left backdoor access, which we tracked and logged their IP. AVOID",a week ago,Noida,Appsinvo : Mobile App & Website Development Company
